uniref90_ID	percent_cov	AA_length	unpaired_read_count	uniref90_desc	emapper_max_annot_OG	emapper_OG	emapper_max_annot_lvl	eggnog_cat	eggnog_GO	eggnog_desc	uniref90_GO
UniRef90_A0A009FM48	52.7778	72	1	UniRef90_A0A009FM48 DNA-directed RNA polymerase subunit omega n=3 Tax=Acinetobacter TaxID=469 RepID=A0A009FM48_ACIBA	1SCSR	COG1758@1|root,COG1758@2|Bacteria,1N6TX@1224|Proteobacteria,1SCSR@1236|Gammaproteobacteria,3NNVY@468|Moraxellaceae	1236|Gammaproteobacteria	K	GO:0003674,GO:0003676,GO:0003677,GO:0003824,GO:0003899,GO:0005488,GO:0005575,GO:0005622,GO:0005623,GO:0005737,GO:0005829,GO:0006139,GO:0006351,GO:0006725,GO:0006807,GO:0008150,GO:0008152,GO:0009058,GO:0009059,GO:0009987,GO:0010467,GO:0016070,GO:0016740,GO:0016772,GO:0016779,GO:0018130,GO:0019438,GO:0030880,GO:0032774,GO:0032991,GO:0034062,GO:0034641,GO:0034645,GO:0034654,GO:0043170,GO:0044237,GO:0044238,GO:0044249,GO:0044260,GO:0044271,GO:0044424,GO:0044444,GO:0044464,GO:0046483,GO:0061695,GO:0071704,GO:0090304,GO:0097159,GO:0097659,GO:0097747,GO:0140098,GO:1901360,GO:1901362,GO:1901363,GO:1901576,GO:1902494,GO:1990234	Promotes RNA polymerase assembly. Latches the N- and C- terminal regions of the beta' subunit thereby facilitating its interaction with the beta and alpha subunits	GO:0003677,GO:0003899,GO:0006351
UniRef90_A0A009NBC4	68.1035	116	20	UniRef90_A0A009NBC4 Uncharacterized protein n=1 Tax=Acinetobacter sp. 1475718 TaxID=1310652 RepID=A0A009NBC4_9GAMM	-	-	-	-	-	-	-
UniRef90_A0A016U7J8	58.0247	81	1	UniRef90_A0A016U7J8 MADS-box domain-containing protein n=1 Tax=Ancylostoma ceylanicum TaxID=53326 RepID=A0A016U7J8_9BILA	-	-	-	-	-	-	GO:0005634,GO:0003677,GO:0046983
UniRef90_A0A017HL67	73.5294	68	7	UniRef90_A0A017HL67 30S ribosomal protein S21 n=9 Tax=Bacteria TaxID=2 RepID=A0A017HL67_9RHOB	-	-	-	-	-	-	-
UniRef90_A0A031LIA7	87.8378	74	8	UniRef90_A0A031LIA7 Uncharacterized protein n=1 Tax=Acinetobacter sp. Ver3 TaxID=466088 RepID=A0A031LIA7_9GAMM	-	-	-	-	-	-	-
UniRef90_A0A044RXA6	79.7297	74	5	UniRef90_A0A044RXA6 Uncharacterized protein n=1 Tax=Onchocerca volvulus TaxID=6282 RepID=A0A044RXA6_ONCVO	-	-	-	-	-	-	-
UniRef90_A0A060BXR4	63.6364	33	4	UniRef90_A0A060BXR4 CAZy families CE14 protein (Fragment) n=1 Tax=uncultured Mycobacterium sp. TaxID=171292 RepID=A0A060BXR4_9MYCO	-	-	-	-	-	-	-
UniRef90_A0A060DH05	61.194	67	2	UniRef90_A0A060DH05 30S ribosomal protein S21 n=30 Tax=Rhodospirillales TaxID=204441 RepID=A0A060DH05_AZOBR	2JU14	COG0828@1|root,COG0828@2|Bacteria,1MZA1@1224|Proteobacteria,2UC58@28211|Alphaproteobacteria,2JU14@204441|Rhodospirillales	204441|Rhodospirillales	J	GO:0003674,GO:0003735,GO:0005198,GO:0005575,GO:0005622,GO:0005623,GO:0005737,GO:0005840,GO:0006412,GO:0006518,GO:0006807,GO:0008150,GO:0008152,GO:0009058,GO:0009059,GO:0009987,GO:0010467,GO:0019538,GO:0032991,GO:0034641,GO:0034645,GO:0043043,GO:0043170,GO:0043226,GO:0043228,GO:0043229,GO:0043232,GO:0043603,GO:0043604,GO:0044237,GO:0044238,GO:0044249,GO:0044260,GO:0044267,GO:0044271,GO:0044424,GO:0044444,GO:0044464,GO:0071704,GO:1901564,GO:1901566,GO:1901576,GO:1990904	Belongs to the bacterial ribosomal protein bS21 family	-
UniRef90_A0A060VRX2	57.9545	88	5	UniRef90_A0A060VRX2 Uncharacterized protein n=1 Tax=Oncorhynchus mykiss TaxID=8022 RepID=A0A060VRX2_ONCMY	3BXBC	KOG1075@1|root,KOG1075@2759|Eukaryota,39XVS@33154|Opisthokonta,3BXBC@33208|Metazoa,3DBAC@33213|Bilateria,421D4@6656|Arthropoda,3SR4B@50557|Insecta,3ED43@33342|Paraneoptera	33208|Metazoa	L	-	Reverse transcriptase (RNA-dependent DNA polymerase)	GO:0003676,GO:0008270
UniRef90_A0A060VT32	66.055	109	2	UniRef90_A0A060VT32 Uncharacterized protein n=1 Tax=Oncorhynchus mykiss TaxID=8022 RepID=A0A060VT32_ONCMY	3ACG2	2E78S@1|root,2SDVT@2759|Eukaryota,3ACG2@33154|Opisthokonta	33154|Opisthokonta	-	-	-	-
UniRef90_A0A060VWX0	74.6032	63	1	UniRef90_A0A060VWX0 Uncharacterized protein n=2 Tax=Oncorhynchus mykiss TaxID=8022 RepID=A0A060VWX0_ONCMY	-	-	-	-	-	-	-
UniRef90_A0A060VYG6	53.6977	311	12	UniRef90_A0A060VYG6 Uncharacterized protein n=1 Tax=Oncorhynchus mykiss TaxID=8022 RepID=A0A060VYG6_ONCMY	-	-	-	-	-	-	-
UniRef90_A0A060VYT8	80.8333	120	3	UniRef90_A0A060VYT8 Uncharacterized protein n=1 Tax=Oncorhynchus mykiss TaxID=8022 RepID=A0A060VYT8_ONCMY	-	-	-	-	-	-	-
UniRef90_A0A060VZK1	55.5556	126	10	UniRef90_A0A060VZK1 Uncharacterized protein n=1 Tax=Oncorhynchus mykiss TaxID=8022 RepID=A0A060VZK1_ONCMY	-	-	-	-	-	-	-
UniRef90_A0A060W211	79.1304	115	3	UniRef90_A0A060W211 Paired domain-containing protein n=1 Tax=Oncorhynchus mykiss TaxID=8022 RepID=A0A060W211_ONCMY	-	-	-	-	-	-	GO:0003677,GO:0006355
UniRef90_A0A060W2Q3	78.3784	74	23	UniRef90_A0A060W2Q3 Uncharacterized protein n=1 Tax=Oncorhynchus mykiss TaxID=8022 RepID=A0A060W2Q3_ONCMY	-	-	-	-	-	-	-
UniRef90_A0A060W5M6	53.7634	93	1	UniRef90_A0A060W5M6 Parathyroid hormone n=6 Tax=Salmonidae TaxID=8015 RepID=A0A060W5M6_ONCMY	-	-	-	-	-	-	GO:0005576,GO:0005179,GO:0006874,GO:0046326
UniRef90_A0A060W5Q9	70.5882	68	7	UniRef90_A0A060W5Q9 Uncharacterized protein n=1 Tax=Oncorhynchus mykiss TaxID=8022 RepID=A0A060W5Q9_ONCMY	-	-	-	-	-	-	-
UniRef90_A0A060W7U4	65.7143	70	1	UniRef90_A0A060W7U4 Uncharacterized protein n=1 Tax=Oncorhynchus mykiss TaxID=8022 RepID=A0A060W7U4_ONCMY	-	-	-	-	-	-	-
UniRef90_A0A060W9G7	62.5	80	2	UniRef90_A0A060W9G7 Uncharacterized protein n=1 Tax=Oncorhynchus mykiss TaxID=8022 RepID=A0A060W9G7_ONCMY	-	-	-	-	-	-	-
UniRef90_A0A060WBW3	69.7368	76	5	UniRef90_A0A060WBW3 Uncharacterized protein n=1 Tax=Oncorhynchus mykiss TaxID=8022 RepID=A0A060WBW3_ONCMY	-	-	-	-	-	-	-
UniRef90_A0A060WCG9	57.1429	77	2	UniRef90_A0A060WCG9 Uncharacterized protein n=1 Tax=Oncorhynchus mykiss TaxID=8022 RepID=A0A060WCG9_ONCMY	-	-	-	-	-	-	GO:0003676
UniRef90_A0A060WDJ9	52.9915	117	4	UniRef90_A0A060WDJ9 Uncharacterized protein n=1 Tax=Oncorhynchus mykiss TaxID=8022 RepID=A0A060WDJ9_ONCMY	3BIC8	28N8N@1|root,2QUTZ@2759|Eukaryota,39XUZ@33154|Opisthokonta,3BIC8@33208|Metazoa,3D1M8@33213|Bilateria,48DCS@7711|Chordata,49AIX@7742|Vertebrata,4A9GW@7898|Actinopterygii	33208|Metazoa	S	-	-	-
UniRef90_A0A060WF00	70.8054	298	43	UniRef90_A0A060WF00 Uncharacterized protein n=1 Tax=Oncorhynchus mykiss TaxID=8022 RepID=A0A060WF00_ONCMY	-	-	-	-	-	-	-
UniRef90_A0A060WG70	80.4878	205	10	UniRef90_A0A060WG70 Uncharacterized protein n=1 Tax=Oncorhynchus mykiss TaxID=8022 RepID=A0A060WG70_ONCMY	-	-	-	-	-	-	-
UniRef90_A0A060WLV8	77.0642	218	15	UniRef90_A0A060WLV8 DDE_3 domain-containing protein n=1 Tax=Oncorhynchus mykiss TaxID=8022 RepID=A0A060WLV8_ONCMY	-	-	-	-	-	-	GO:0003676
UniRef90_A0A060WMW8	66.1972	71	3	UniRef90_A0A060WMW8 Uncharacterized protein n=1 Tax=Oncorhynchus mykiss TaxID=8022 RepID=A0A060WMW8_ONCMY	3BIC8	28N8N@1|root,2QUTZ@2759|Eukaryota,39XUZ@33154|Opisthokonta,3BIC8@33208|Metazoa,3D1M8@33213|Bilateria,48DCS@7711|Chordata,49178@7742|Vertebrata,4A57R@7898|Actinopterygii	33208|Metazoa	S	-	-	GO:0003676
UniRef90_A0A060WQE2	54.2169	83	1	UniRef90_A0A060WQE2 Uncharacterized protein n=1 Tax=Oncorhynchus mykiss TaxID=8022 RepID=A0A060WQE2_ONCMY	-	-	-	-	-	-	-
UniRef90_A0A060WRZ2	68.75	128	11	UniRef90_A0A060WRZ2 Uncharacterized protein n=1 Tax=Oncorhynchus mykiss TaxID=8022 RepID=A0A060WRZ2_ONCMY	-	-	-	-	-	-	-
UniRef90_A0A060WUQ9	55.6818	88	1	UniRef90_A0A060WUQ9 Uncharacterized protein n=1 Tax=Oncorhynchus mykiss TaxID=8022 RepID=A0A060WUQ9_ONCMY	-	-	-	-	-	-	-
UniRef90_A0A060WW91	55.2941	85	2	UniRef90_A0A060WW91 Uncharacterized protein n=1 Tax=Oncorhynchus mykiss TaxID=8022 RepID=A0A060WW91_ONCMY	-	-	-	-	-	-	-
UniRef90_A0A060WX12	87.7778	90	31	UniRef90_A0A060WX12 Paired domain-containing protein n=1 Tax=Oncorhynchus mykiss TaxID=8022 RepID=A0A060WX12_ONCMY	-	-	-	-	-	-	GO:0003677,GO:0006355
UniRef90_A0A060X6A7	51.6129	124	16	UniRef90_A0A060X6A7 HTH_Tnp_Tc3_2 domain-containing protein n=1 Tax=Oncorhynchus mykiss TaxID=8022 RepID=A0A060X6A7_ONCMY	3ACG2	2E78S@1|root,2SDVT@2759|Eukaryota,3ACG2@33154|Opisthokonta	33154|Opisthokonta	-	-	-	GO:0003677,GO:0015074,GO:0006313
UniRef90_A0A060X741	55.0336	149	29	UniRef90_A0A060X741 Uncharacterized protein n=1 Tax=Oncorhynchus mykiss TaxID=8022 RepID=A0A060X741_ONCMY	-	-	-	-	-	-	GO:0016021
UniRef90_A0A060X814	55.6757	185	19	UniRef90_A0A060X814 Uncharacterized protein n=1 Tax=Oncorhynchus mykiss TaxID=8022 RepID=A0A060X814_ONCMY	-	-	-	-	-	-	-
UniRef90_A0A060XBZ1	92.4242	66	4	UniRef90_A0A060XBZ1 Uncharacterized protein n=1 Tax=Oncorhynchus mykiss TaxID=8022 RepID=A0A060XBZ1_ONCMY	-	-	-	-	-	-	-
UniRef90_A0A060XC94	61.8421	76	2	UniRef90_A0A060XC94 Uncharacterized protein n=1 Tax=Oncorhynchus mykiss TaxID=8022 RepID=A0A060XC94_ONCMY	-	-	-	-	-	-	-
UniRef90_A0A060XCK9	53.6364	110	20	UniRef90_A0A060XCK9 Uncharacterized protein n=1 Tax=Oncorhynchus mykiss TaxID=8022 RepID=A0A060XCK9_ONCMY	-	-	-	-	-	-	-
UniRef90_A0A060XEW2	74.6032	63	17	UniRef90_A0A060XEW2 Uncharacterized protein n=1 Tax=Oncorhynchus mykiss TaxID=8022 RepID=A0A060XEW2_ONCMY	3BQ1W	29UAV@1|root,2RXI8@2759|Eukaryota,3A161@33154|Opisthokonta,3BQ1W@33208|Metazoa,3D6JJ@33213|Bilateria,48DYM@7711|Chordata,49AVY@7742|Vertebrata,4A6H2@7898|Actinopterygii	33208|Metazoa	S	GO:0005575,GO:0005576,GO:0005622,GO:0005623,GO:0005737,GO:0005783,GO:0012505,GO:0043226,GO:0043227,GO:0043229,GO:0043231,GO:0044424,GO:0044444,GO:0044464	TAFA family	-
UniRef90_A0A060XG77	67.6471	68	1	UniRef90_A0A060XG77 Uncharacterized protein n=1 Tax=Oncorhynchus mykiss TaxID=8022 RepID=A0A060XG77_ONCMY	-	-	-	-	-	-	-
UniRef90_A0A060XHZ3	54.6296	108	18	UniRef90_A0A060XHZ3 Uncharacterized protein n=1 Tax=Oncorhynchus mykiss TaxID=8022 RepID=A0A060XHZ3_ONCMY	-	-	-	-	-	-	-
UniRef90_A0A060XI90	58.642	162	6	UniRef90_A0A060XI90 MARVEL domain-containing protein n=17 Tax=Salmonidae TaxID=8015 RepID=A0A060XI90_ONCMY	3BQ0B	KOG4788@1|root,KOG4788@2759|Eukaryota,3A2VV@33154|Opisthokonta,3BQ0B@33208|Metazoa,3D290@33213|Bilateria,487QG@7711|Chordata,48VNE@7742|Vertebrata,4A390@7898|Actinopterygii	33208|Metazoa	V	GO:0001766,GO:0003674,GO:0005198,GO:0005575,GO:0005622,GO:0005623,GO:0005634,GO:0005737,GO:0005856,GO:0005886,GO:0007049,GO:0007272,GO:0007275,GO:0007399,GO:0008104,GO:0008150,GO:0008366,GO:0009987,GO:0016020,GO:0016021,GO:0016043,GO:0019911,GO:0031224,GO:0031579,GO:0031580,GO:0032501,GO:0032502,GO:0033036,GO:0042552,GO:0043226,GO:0043227,GO:0043228,GO:0043229,GO:0043231,GO:0043232,GO:0044424,GO:0044425,GO:0044464,GO:0045121,GO:0048731,GO:0048856,GO:0051179,GO:0051641,GO:0051665,GO:0051668,GO:0061024,GO:0071840,GO:0071944,GO:0098589,GO:0098805,GO:0098857	membrane raft polarization	GO:0016021
UniRef90_A0A060XIZ8	50.2762	181	3	UniRef90_A0A060XIZ8 Uncharacterized protein n=1 Tax=Oncorhynchus mykiss TaxID=8022 RepID=A0A060XIZ8_ONCMY	-	-	-	-	-	-	-
UniRef90_A0A060XJH1	53.211	109	3	UniRef90_A0A060XJH1 DUF1891 domain-containing protein n=1 Tax=Oncorhynchus mykiss TaxID=8022 RepID=A0A060XJH1_ONCMY	-	-	-	-	-	-	GO:0016706,GO:0008168
UniRef90_A0A060XNE6	70.068	147	18	UniRef90_A0A060XNE6 DDE_3 domain-containing protein n=2 Tax=Oncorhynchus mykiss TaxID=8022 RepID=A0A060XNE6_ONCMY	-	-	-	-	-	-	GO:0003676
UniRef90_A0A060XR08	63.2812	128	3	UniRef90_A0A060XR08 Uncharacterized protein n=3 Tax=Oncorhynchus mykiss TaxID=8022 RepID=A0A060XR08_ONCMY	-	-	-	-	-	-	-
UniRef90_A0A060XX81	73.6842	171	11	UniRef90_A0A060XX81 Uncharacterized protein n=1 Tax=Oncorhynchus mykiss TaxID=8022 RepID=A0A060XX81_ONCMY	-	-	-	-	-	-	-
UniRef90_A0A060XXA6	65.3226	124	7	UniRef90_A0A060XXA6 Uncharacterized protein n=1 Tax=Oncorhynchus mykiss TaxID=8022 RepID=A0A060XXA6_ONCMY	-	-	-	-	-	-	-
UniRef90_A0A060XYE4	71.9697	132	11	UniRef90_A0A060XYE4 Uncharacterized protein n=1 Tax=Oncorhynchus mykiss TaxID=8022 RepID=A0A060XYE4_ONCMY	3BTPZ	KOG1075@1|root,KOG1075@2759|Eukaryota,3A7X5@33154|Opisthokonta,3BTPZ@33208|Metazoa,3D9N3@33213|Bilateria,48H7G@7711|Chordata,49FFY@7742|Vertebrata,4A6MA@7898|Actinopterygii	33208|Metazoa	S	-	interleukin-8 biosynthetic process	-
UniRef90_A0A060XZE3	52.7473	91	1	UniRef90_A0A060XZE3 HTH_Tnp_Tc3_2 domain-containing protein n=1 Tax=Oncorhynchus mykiss TaxID=8022 RepID=A0A060XZE3_ONCMY	-	-	-	-	-	-	GO:0003677,GO:0015074,GO:0006313
UniRef90_A0A060Y1Q3	72.4138	145	10	UniRef90_A0A060Y1Q3 Reverse transcriptase domain-containing protein n=1 Tax=Oncorhynchus mykiss TaxID=8022 RepID=A0A060Y1Q3_ONCMY	-	-	-	-	-	-	-
UniRef90_A0A060Y279	51.5464	97	9	UniRef90_A0A060Y279 HTH_Tnp_Tc3_2 domain-containing protein n=1 Tax=Oncorhynchus mykiss TaxID=8022 RepID=A0A060Y279_ONCMY	-	-	-	-	-	-	GO:0003677,GO:0015074,GO:0006313
UniRef90_A0A060Y4B8	52.4691	162	23	UniRef90_A0A060Y4B8 Reverse transcriptase domain-containing protein n=1 Tax=Oncorhynchus mykiss TaxID=8022 RepID=A0A060Y4B8_ONCMY	3BTPZ	KOG1075@1|root,KOG4308@1|root,KOG1075@2759|Eukaryota,KOG4308@2759|Eukaryota,3A7X5@33154|Opisthokonta,3BTPZ@33208|Metazoa,3D9N3@33213|Bilateria,48H7G@7711|Chordata,49FFY@7742|Vertebrata,4A6MA@7898|Actinopterygii	33208|Metazoa	S	-	interleukin-8 biosynthetic process	-
UniRef90_A0A060Y4V2	73.3333	75	3	UniRef90_A0A060Y4V2 Uncharacterized protein n=1 Tax=Oncorhynchus mykiss TaxID=8022 RepID=A0A060Y4V2_ONCMY	3BHUM	KOG3594@1|root,KOG3594@2759|Eukaryota,39DMX@33154|Opisthokonta,3BHUM@33208|Metazoa,3CUSG@33213|Bilateria,482MZ@7711|Chordata,48YMV@7742|Vertebrata,4A10V@7898|Actinopterygii	33208|Metazoa	S	-	Cadherins are calcium-dependent cell adhesion proteins	-
UniRef90_A0A060Y6N9	76.2238	143	38	UniRef90_A0A060Y6N9 Uncharacterized protein n=1 Tax=Oncorhynchus mykiss TaxID=8022 RepID=A0A060Y6N9_ONCMY	-	-	-	-	-	-	-
UniRef90_A0A060Y9G4	54.3478	92	6	UniRef90_A0A060Y9G4 Uncharacterized protein n=1 Tax=Oncorhynchus mykiss TaxID=8022 RepID=A0A060Y9G4_ONCMY	-	-	-	-	-	-	GO:0016021,GO:0031528
UniRef90_A0A060Y9Y9	74.4681	94	22	UniRef90_A0A060Y9Y9 Uncharacterized protein n=1 Tax=Oncorhynchus mykiss TaxID=8022 RepID=A0A060Y9Y9_ONCMY	-	-	-	-	-	-	-
UniRef90_A0A060YA34	51.5464	97	1	UniRef90_A0A060YA34 Uncharacterized protein n=1 Tax=Oncorhynchus mykiss TaxID=8022 RepID=A0A060YA34_ONCMY	-	-	-	-	-	-	-
UniRef90_A0A060YB82	58.6207	203	30	UniRef90_A0A060YB82 Uncharacterized protein n=1 Tax=Oncorhynchus mykiss TaxID=8022 RepID=A0A060YB82_ONCMY	-	-	-	-	-	-	-
UniRef90_A0A060YDE1	62.069	87	6	UniRef90_A0A060YDE1 Uncharacterized protein n=1 Tax=Oncorhynchus mykiss TaxID=8022 RepID=A0A060YDE1_ONCMY	-	-	-	-	-	-	-
UniRef90_A0A060YFE9	58.1081	74	2	UniRef90_A0A060YFE9 Uncharacterized protein (Fragment) n=2 Tax=Oncorhynchus mykiss TaxID=8022 RepID=A0A060YFE9_ONCMY	-	-	-	-	-	-	-
UniRef90_A0A060YG32	51.3228	189	9	UniRef90_A0A060YG32 zf-RVT domain-containing protein n=1 Tax=Oncorhynchus mykiss TaxID=8022 RepID=A0A060YG32_ONCMY	-	-	-	-	-	-	-
UniRef90_A0A060YI66	60.4839	124	3	UniRef90_A0A060YI66 Uncharacterized protein n=1 Tax=Oncorhynchus mykiss TaxID=8022 RepID=A0A060YI66_ONCMY	-	-	-	-	-	-	GO:0016021
UniRef90_A0A060YIF8	54.902	102	3	UniRef90_A0A060YIF8 Uncharacterized protein n=1 Tax=Oncorhynchus mykiss TaxID=8022 RepID=A0A060YIF8_ONCMY	-	-	-	-	-	-	-
UniRef90_A0A060YJC4	54.5455	88	1	UniRef90_A0A060YJC4 HTH_Tnp_Tc3_2 domain-containing protein n=1 Tax=Oncorhynchus mykiss TaxID=8022 RepID=A0A060YJC4_ONCMY	-	-	-	-	-	-	GO:0003677,GO:0015074,GO:0006313
UniRef90_A0A060YJL2	64.6341	82	3	UniRef90_A0A060YJL2 DDE_3 domain-containing protein n=1 Tax=Oncorhynchus mykiss TaxID=8022 RepID=A0A060YJL2_ONCMY	-	-	-	-	-	-	GO:0003676
UniRef90_A0A060YJW2	80	65	8	UniRef90_A0A060YJW2 Uncharacterized protein n=1 Tax=Oncorhynchus mykiss TaxID=8022 RepID=A0A060YJW2_ONCMY	3CDFG	2CUQ3@1|root,2RNM8@2759|Eukaryota,3999Y@33154|Opisthokonta,3CDFG@33208|Metazoa,3DUSZ@33213|Bilateria,48N25@7711|Chordata,49J1B@7742|Vertebrata,4A85X@7898|Actinopterygii	33208|Metazoa	S	-	Transposase	-
UniRef90_A0A060YKR2	58.5987	157	14	UniRef90_A0A060YKR2 Reverse transcriptase domain-containing protein n=1 Tax=Oncorhynchus mykiss TaxID=8022 RepID=A0A060YKR2_ONCMY	-	-	-	-	-	-	-
UniRef90_A0A060YMJ8	66.6667	114	4	UniRef90_A0A060YMJ8 DUF1891 domain-containing protein (Fragment) n=1 Tax=Oncorhynchus mykiss TaxID=8022 RepID=A0A060YMJ8_ONCMY	3BTPZ	KOG1075@1|root,KOG1075@2759|Eukaryota,3A7X5@33154|Opisthokonta,3BTPZ@33208|Metazoa,3D9N3@33213|Bilateria,48H7G@7711|Chordata,49FFY@7742|Vertebrata,4A6MA@7898|Actinopterygii	33208|Metazoa	S	-	interleukin-8 biosynthetic process	GO:0016706,GO:0008168
UniRef90_A0A060YPU3	72.6562	128	4	UniRef90_A0A060YPU3 DDE_3 domain-containing protein n=1 Tax=Oncorhynchus mykiss TaxID=8022 RepID=A0A060YPU3_ONCMY	3BIC8	28N8N@1|root,2QUTZ@2759|Eukaryota,39XUZ@33154|Opisthokonta,3BIC8@33208|Metazoa,3D1M8@33213|Bilateria,48DCS@7711|Chordata,49178@7742|Vertebrata,4A57R@7898|Actinopterygii	33208|Metazoa	S	-	-	GO:0003676
UniRef90_A0A060YPZ7	52	175	5	UniRef90_A0A060YPZ7 DUF1891 domain-containing protein n=1 Tax=Oncorhynchus mykiss TaxID=8022 RepID=A0A060YPZ7_ONCMY	-	-	-	-	-	-	GO:0016706,GO:0008168
UniRef90_A0A060YRX9	57.2973	185	5	UniRef90_A0A060YRX9 DUF1891 domain-containing protein n=4 Tax=Oncorhynchus mykiss TaxID=8022 RepID=A0A060YRX9_ONCMY	3BTPZ	KOG1075@1|root,KOG1075@2759|Eukaryota,3A7X5@33154|Opisthokonta,3BTPZ@33208|Metazoa,3D9N3@33213|Bilateria,48H7G@7711|Chordata,49FFY@7742|Vertebrata,4A6MA@7898|Actinopterygii	33208|Metazoa	S	-	interleukin-8 biosynthetic process	GO:0016706,GO:0008168
UniRef90_A0A060YS40	76.7241	116	11	UniRef90_A0A060YS40 Reverse transcriptase domain-containing protein n=1 Tax=Oncorhynchus mykiss TaxID=8022 RepID=A0A060YS40_ONCMY	-	-	-	-	-	-	-
UniRef90_A0A060YVE4	62.5	104	6	UniRef90_A0A060YVE4 Uncharacterized protein n=1 Tax=Oncorhynchus mykiss TaxID=8022 RepID=A0A060YVE4_ONCMY	3BIC8	28N8N@1|root,2QUTZ@2759|Eukaryota,39XUZ@33154|Opisthokonta,3BIC8@33208|Metazoa,3D1M8@33213|Bilateria,48DCS@7711|Chordata,49178@7742|Vertebrata,4A57R@7898|Actinopterygii	33208|Metazoa	S	-	-	GO:0003676
UniRef90_A0A060YVN3	93.1937	191	23	UniRef90_A0A060YVN3 Uncharacterized protein (Fragment) n=1 Tax=Oncorhynchus mykiss TaxID=8022 RepID=A0A060YVN3_ONCMY	-	-	-	-	-	-	-
UniRef90_A0A060YVR0	65.0685	146	326	UniRef90_A0A060YVR0 Uncharacterized protein (Fragment) n=1 Tax=Oncorhynchus mykiss TaxID=8022 RepID=A0A060YVR0_ONCMY	-	-	-	-	-	-	-
UniRef90_A0A060YW23	68.4211	95	8	UniRef90_A0A060YW23 Uncharacterized protein n=1 Tax=Oncorhynchus mykiss TaxID=8022 RepID=A0A060YW23_ONCMY	-	-	-	-	-	-	-
UniRef90_A0A060YYL9	55.2941	85	1	UniRef90_A0A060YYL9 Uncharacterized protein n=2 Tax=Oncorhynchus mykiss TaxID=8022 RepID=A0A060YYL9_ONCMY	-	-	-	-	-	-	-
UniRef90_A0A060Z006	51.8919	185	2	UniRef90_A0A060Z006 Uncharacterized protein n=1 Tax=Oncorhynchus mykiss TaxID=8022 RepID=A0A060Z006_ONCMY	-	-	-	-	-	-	GO:0003676
UniRef90_A0A060Z0W9	73.0159	126	6	UniRef90_A0A060Z0W9 Uncharacterized protein (Fragment) n=1 Tax=Oncorhynchus mykiss TaxID=8022 RepID=A0A060Z0W9_ONCMY	-	-	-	-	-	-	-
UniRef90_A0A060Z128	63.2911	79	3	UniRef90_A0A060Z128 Uncharacterized protein (Fragment) n=1 Tax=Oncorhynchus mykiss TaxID=8022 RepID=A0A060Z128_ONCMY	-	-	-	-	-	-	-
UniRef90_A0A060Z151	81.9672	61	1	UniRef90_A0A060Z151 Uncharacterized protein (Fragment) n=1 Tax=Oncorhynchus mykiss TaxID=8022 RepID=A0A060Z151_ONCMY	-	-	-	-	-	-	-
UniRef90_A0A060Z297	61.9529	297	10	UniRef90_A0A060Z297 Uncharacterized protein n=1 Tax=Oncorhynchus mykiss TaxID=8022 RepID=A0A060Z297_ONCMY	-	-	-	-	-	-	-
UniRef90_A0A060Z3Y7	75.3846	65	1	UniRef90_A0A060Z3Y7 Uncharacterized protein n=2 Tax=Oncorhynchus mykiss TaxID=8022 RepID=A0A060Z3Y7_ONCMY	-	-	-	-	-	-	-
UniRef90_A0A060Z4T9	58.6021	186	9	UniRef90_A0A060Z4T9 Reverse transcriptase domain-containing protein n=1 Tax=Oncorhynchus mykiss TaxID=8022 RepID=A0A060Z4T9_ONCMY	-	-	-	-	-	-	-
UniRef90_A0A060Z5G0	76.2376	101	15	UniRef90_A0A060Z5G0 Uncharacterized protein n=1 Tax=Oncorhynchus mykiss TaxID=8022 RepID=A0A060Z5G0_ONCMY	3BXZV	KOG1075@1|root,KOG1075@2759|Eukaryota,3AGM0@33154|Opisthokonta,3BXZV@33208|Metazoa,3E4GN@33213|Bilateria	33208|Metazoa	S	-	Ribonuclease H protein	-
UniRef90_A0A060Z5J9	67.5439	114	12	UniRef90_A0A060Z5J9 Uncharacterized protein n=1 Tax=Oncorhynchus mykiss TaxID=8022 RepID=A0A060Z5J9_ONCMY	-	-	-	-	-	-	GO:0003676
UniRef90_A0A060Z6N5	97.1698	106	30	UniRef90_A0A060Z6N5 Uncharacterized protein (Fragment) n=1 Tax=Oncorhynchus mykiss TaxID=8022 RepID=A0A060Z6N5_ONCMY	-	-	-	-	-	-	-
UniRef90_A0A060Z6Q5	55.0296	169	17	UniRef90_A0A060Z6Q5 Uncharacterized protein n=1 Tax=Oncorhynchus mykiss TaxID=8022 RepID=A0A060Z6Q5_ONCMY	3BIC8	28N8N@1|root,2QUTZ@2759|Eukaryota,39XUZ@33154|Opisthokonta,3BIC8@33208|Metazoa,3D1M8@33213|Bilateria,48DCS@7711|Chordata,49178@7742|Vertebrata,4A57R@7898|Actinopterygii	33208|Metazoa	S	-	-	GO:0003676
UniRef90_A0A060Z6X3	53.3981	206	17	UniRef90_A0A060Z6X3 HTH_Tnp_Tc3_2 domain-containing protein n=1 Tax=Oncorhynchus mykiss TaxID=8022 RepID=A0A060Z6X3_ONCMY	3CDFG	2CUQ3@1|root,2RNM8@2759|Eukaryota,3999Y@33154|Opisthokonta,3CDFG@33208|Metazoa,3DUSZ@33213|Bilateria,48N25@7711|Chordata,49J1B@7742|Vertebrata,4A85X@7898|Actinopterygii	33208|Metazoa	S	-	Transposase	GO:0003677,GO:0015074,GO:0006313
UniRef90_A0A060Z8D4	79.4872	117	7	UniRef90_A0A060Z8D4 Uncharacterized protein n=1 Tax=Oncorhynchus mykiss TaxID=8022 RepID=A0A060Z8D4_ONCMY	-	-	-	-	-	-	-
UniRef90_A0A060Z8G2	59.5506	356	52	UniRef90_A0A060Z8G2 Integrase catalytic domain-containing protein (Fragment) n=1 Tax=Oncorhynchus mykiss TaxID=8022 RepID=A0A060Z8G2_ONCMY	3BA5H	COG2801@1|root,KOG0017@2759|Eukaryota,38F42@33154|Opisthokonta,3BA5H@33208|Metazoa,3E5BZ@33213|Bilateria,48QR2@7711|Chordata,49MAS@7742|Vertebrata,4A2QN@7898|Actinopterygii	33208|Metazoa	L	-	K02A2.6-like	GO:0003676,GO:0015074
UniRef90_A0A060Z9E0	58.1699	153	15	UniRef90_A0A060Z9E0 Uncharacterized protein n=2 Tax=Oncorhynchus mykiss TaxID=8022 RepID=A0A060Z9E0_ONCMY	-	-	-	-	-	-	-
UniRef90_A0A060Z9R4	74.1935	62	3	UniRef90_A0A060Z9R4 Uncharacterized protein n=1 Tax=Oncorhynchus mykiss TaxID=8022 RepID=A0A060Z9R4_ONCMY	-	-	-	-	-	-	-
UniRef90_A0A060Z9T9	77.4194	62	1	UniRef90_A0A060Z9T9 Uncharacterized protein (Fragment) n=1 Tax=Oncorhynchus mykiss TaxID=8022 RepID=A0A060Z9T9_ONCMY	3BIC8	28N8N@1|root,2QUTZ@2759|Eukaryota,39XUZ@33154|Opisthokonta,3BIC8@33208|Metazoa,3D1M8@33213|Bilateria,48DCS@7711|Chordata,49178@7742|Vertebrata,4A57R@7898|Actinopterygii	33208|Metazoa	S	-	-	-
UniRef90_A0A060ZAX3	52.0833	96	8	UniRef90_A0A060ZAX3 DDE_3 domain-containing protein (Fragment) n=1 Tax=Oncorhynchus mykiss TaxID=8022 RepID=A0A060ZAX3_ONCMY	-	-	-	-	-	-	GO:0003676
UniRef90_A0A060ZBF5	51.7928	251	3	UniRef90_A0A060ZBF5 Reverse transcriptase domain-containing protein n=1 Tax=Oncorhynchus mykiss TaxID=8022 RepID=A0A060ZBF5_ONCMY	-	-	-	-	-	-	-
UniRef90_A0A060ZC67	90	60	6	UniRef90_A0A060ZC67 Uncharacterized protein n=1 Tax=Oncorhynchus mykiss TaxID=8022 RepID=A0A060ZC67_ONCMY	-	-	-	-	-	-	GO:0003676
UniRef90_A0A060ZDY4	57.0048	207	8	UniRef90_A0A060ZDY4 Uncharacterized protein n=1 Tax=Oncorhynchus mykiss TaxID=8022 RepID=A0A060ZDY4_ONCMY	-	-	-	-	-	-	-
UniRef90_A0A060ZV32	68.9655	116	16	UniRef90_A0A060ZV32 Uncharacterized protein (Fragment) n=1 Tax=Oncorhynchus mykiss TaxID=8022 RepID=A0A060ZV32_ONCMY	-	-	-	-	-	-	-
UniRef90_A0A061A0G9	75.6757	74	5	UniRef90_A0A061A0G9 Uncharacterized protein (Fragment) n=1 Tax=Oncorhynchus mykiss TaxID=8022 RepID=A0A061A0G9_ONCMY	-	-	-	-	-	-	-
UniRef90_A0A061A636	54.023	87	1	UniRef90_A0A061A636 Reverse transcriptase domain-containing protein (Fragment) n=1 Tax=Oncorhynchus mykiss TaxID=8022 RepID=A0A061A636_ONCMY	-	-	-	-	-	-	-
UniRef90_A0A066VMJ7	52.1277	94	1	UniRef90_A0A066VMJ7 Histone H2A (Fragment) n=1 Tax=Rhizoctonia solani AG-8 WAC10335 TaxID=1287689 RepID=A0A066VMJ7_9AGAM	-	-	-	-	-	-	GO:0000786,GO:0005634,GO:0003677,GO:0046982
UniRef90_A0A067SIS7	74.026	77	6	UniRef90_A0A067SIS7 Uncharacterized protein (Fragment) n=1 Tax=Galerina marginata (strain CBS 339.88) TaxID=685588 RepID=A0A067SIS7_GALM3	3NXRR	KOG0078@1|root,KOG0078@2759|Eukaryota,38GT3@33154|Opisthokonta,3NXRR@4751|Fungi,3UZ7S@5204|Basidiomycota,224P9@155619|Agaricomycetes,3H1HF@355688|Agaricomycetes incertae sedis	4751|Fungi	U	GO:0000003,GO:0000131,GO:0000166,GO:0000910,GO:0001411,GO:0001882,GO:0001883,GO:0002790,GO:0003006,GO:0003674,GO:0003824,GO:0003924,GO:0005488,GO:0005525,GO:0005575,GO:0005622,GO:0005623,GO:0005628,GO:0005737,GO:0005739,GO:0005740,GO:0005741,GO:0005768,GO:0005783,GO:0005815,GO:0005816,GO:0005856,GO:0005886,GO:0005933,GO:0005934,GO:0005935,GO:0005937,GO:0006810,GO:0006886,GO:0006887,GO:0006892,GO:0006893,GO:0006903,GO:0006904,GO:0006906,GO:0006914,GO:0006996,GO:0007049,GO:0007107,GO:0008104,GO:0008150,GO:0008152,GO:0009056,GO:0009306,GO:0009653,GO:0009987,GO:0010927,GO:0012505,GO:0012506,GO:0015031,GO:0015630,GO:0015833,GO:0016020,GO:0016043,GO:0016050,GO:0016192,GO:0016462,GO:0016787,GO:0016817,GO:0016818,GO:0017076,GO:0017111,GO:0017157,GO:0019001,GO:0019867,GO:0019953,GO:0022402,GO:0022406,GO:0022413,GO:0022414,GO:0022607,GO:0023052,GO:0030133,GO:0030154,GO:0030427,GO:0030435,GO:0030437,GO:0030658,GO:0030659,GO:0031090,GO:0031321,GO:0031410,GO:0031521,GO:0031966,GO:0031967,GO:0031968,GO:0031975,GO:0031982,GO:0032502,GO:0032505,GO:0032506,GO:0032549,GO:0032550,GO:0032553,GO:0032555,GO:0032561,GO:0032879,GO:0032940,GO:0032989,GO:0032991,GO:0033036,GO:0034293,GO:0034613,GO:0035639,GO:0035690,GO:0035974,GO:0036094,GO:0042221,GO:0042493,GO:0042763,GO:0042764,GO:0042886,GO:0042995,GO:0043167,GO:0043168,GO:0043226,GO:0043227,GO:0043228,GO:0043229,GO:0043231,GO:0043232,GO:0043332,GO:0043934,GO:0043935,GO:0044085,GO:0044237,GO:0044248,GO:0044422,GO:0044424,GO:0044429,GO:0044430,GO:0044433,GO:0044444,GO:0044446,GO:0044463,GO:0044464,GO:0044703,GO:0045184,GO:0046903,GO:0046907,GO:0048193,GO:0048278,GO:0048284,GO:0048468,GO:0048646,GO:0048856,GO:0048869,GO:0050789,GO:0050794,GO:0050896,GO:0051046,GO:0051049,GO:0051179,GO:0051234,GO:0051286,GO:0051301,GO:0051321,GO:0051640,GO:0051641,GO:0051648,GO:0051649,GO:0051650,GO:0051656,GO:0051704,GO:0051716,GO:0060627,GO:0061024,GO:0061025,GO:0061919,GO:0065007,GO:0070727,GO:0070887,GO:0071702,GO:0071705,GO:0071840,GO:0071944,GO:0072657,GO:0072659,GO:0090174,GO:0097159,GO:0097367,GO:0097708,GO:0098588,GO:0098805,GO:0098876,GO:0120025,GO:0120038,GO:0140029,GO:0140056,GO:1901265,GO:1901363,GO:1903046,GO:1903530,GO:1990778	GTP-binding protein	GO:0005525,GO:0003924
