uniref90_ID	percent_cov	AA_length	unpaired_read_count	uniref90_desc	emapper_max_annot_OG	emapper_OG	emapper_max_annot_lvl	eggnog_cat	eggnog_GO	eggnog_desc	uniref90_GO
UniRef90_A0A060VNE8	66.6667	75	2	UniRef90_A0A060VNE8 Uncharacterized protein n=1 Tax=Oncorhynchus mykiss TaxID=8022 RepID=A0A060VNE8_ONCMY	3BTPZ	KOG1075@1|root,KOG1075@2759|Eukaryota,3A7X5@33154|Opisthokonta,3BTPZ@33208|Metazoa,3D9N3@33213|Bilateria,48H7G@7711|Chordata,49FFY@7742|Vertebrata,4A6MA@7898|Actinopterygii	33208|Metazoa	S	-	interleukin-8 biosynthetic process	-
UniRef90_A0A060VZK1	75.3968	126	50	UniRef90_A0A060VZK1 Uncharacterized protein n=1 Tax=Oncorhynchus mykiss TaxID=8022 RepID=A0A060VZK1_ONCMY	-	-	-	-	-	-	-
UniRef90_A0A060W2Q3	71.6216	74	23	UniRef90_A0A060W2Q3 Uncharacterized protein n=1 Tax=Oncorhynchus mykiss TaxID=8022 RepID=A0A060W2Q3_ONCMY	-	-	-	-	-	-	-
UniRef90_A0A060W5K2	63.7584	149	2	UniRef90_A0A060W5K2 HTH_Tnp_Tc3_2 domain-containing protein n=1 Tax=Oncorhynchus mykiss TaxID=8022 RepID=A0A060W5K2_ONCMY	3BIC8	28N8N@1|root,2QUTZ@2759|Eukaryota,39XUZ@33154|Opisthokonta,3BIC8@33208|Metazoa,3D1M8@33213|Bilateria,48DCS@7711|Chordata,49178@7742|Vertebrata,4A57R@7898|Actinopterygii	33208|Metazoa	S	-	-	GO:0003677,GO:0015074,GO:0006313
UniRef90_A0A060W6K6	65.6442	163	10	UniRef90_A0A060W6K6 Uncharacterized protein n=1 Tax=Oncorhynchus mykiss TaxID=8022 RepID=A0A060W6K6_ONCMY	3BIC8	28N8N@1|root,2QUTZ@2759|Eukaryota,39XUZ@33154|Opisthokonta,3BIC8@33208|Metazoa,3D1M8@33213|Bilateria,48DCS@7711|Chordata,49178@7742|Vertebrata,4A57R@7898|Actinopterygii	33208|Metazoa	S	-	-	GO:0003676
UniRef90_A0A060W9G7	58.75	80	3	UniRef90_A0A060W9G7 Uncharacterized protein n=1 Tax=Oncorhynchus mykiss TaxID=8022 RepID=A0A060W9G7_ONCMY	-	-	-	-	-	-	-
UniRef90_A0A060WAS1	67.1698	265	9	UniRef90_A0A060WAS1 Reverse transcriptase domain-containing protein n=1 Tax=Oncorhynchus mykiss TaxID=8022 RepID=A0A060WAS1_ONCMY	-	-	-	-	-	-	-
UniRef90_A0A060WG64	61.3208	212	15	UniRef90_A0A060WG64 Uncharacterized protein n=1 Tax=Oncorhynchus mykiss TaxID=8022 RepID=A0A060WG64_ONCMY	-	-	-	-	-	-	-
UniRef90_A0A060WKM9	66.1972	71	2	UniRef90_A0A060WKM9 DDE_3 domain-containing protein n=1 Tax=Oncorhynchus mykiss TaxID=8022 RepID=A0A060WKM9_ONCMY	-	-	-	-	-	-	GO:0003676
UniRef90_A0A060WN58	63.7255	102	4	UniRef90_A0A060WN58 Reverse transcriptase domain-containing protein n=1 Tax=Oncorhynchus mykiss TaxID=8022 RepID=A0A060WN58_ONCMY	-	-	-	-	-	-	-
UniRef90_A0A060WRZ2	73.4375	128	14	UniRef90_A0A060WRZ2 Uncharacterized protein n=1 Tax=Oncorhynchus mykiss TaxID=8022 RepID=A0A060WRZ2_ONCMY	-	-	-	-	-	-	-
UniRef90_A0A060WUQ9	72.7273	88	5	UniRef90_A0A060WUQ9 Uncharacterized protein n=1 Tax=Oncorhynchus mykiss TaxID=8022 RepID=A0A060WUQ9_ONCMY	-	-	-	-	-	-	-
UniRef90_A0A060WUT9	75	76	3	UniRef90_A0A060WUT9 Uncharacterized protein n=1 Tax=Oncorhynchus mykiss TaxID=8022 RepID=A0A060WUT9_ONCMY	-	-	-	-	-	-	GO:0003676
UniRef90_A0A060WW91	62.3529	85	10	UniRef90_A0A060WW91 Uncharacterized protein n=1 Tax=Oncorhynchus mykiss TaxID=8022 RepID=A0A060WW91_ONCMY	-	-	-	-	-	-	-
UniRef90_A0A060WX12	81.1111	90	34	UniRef90_A0A060WX12 Paired domain-containing protein n=1 Tax=Oncorhynchus mykiss TaxID=8022 RepID=A0A060WX12_ONCMY	-	-	-	-	-	-	GO:0003677,GO:0006355
UniRef90_A0A060WZU4	58.1395	86	6	UniRef90_A0A060WZU4 Uncharacterized protein n=1 Tax=Oncorhynchus mykiss TaxID=8022 RepID=A0A060WZU4_ONCMY	-	-	-	-	-	-	-
UniRef90_A0A060X2Y4	55.8824	136	7	UniRef90_A0A060X2Y4 DDE_3 domain-containing protein n=1 Tax=Oncorhynchus mykiss TaxID=8022 RepID=A0A060X2Y4_ONCMY	3CNIB	2CZ2E@1|root,2S808@2759|Eukaryota,3AAWE@33154|Opisthokonta,3CNIB@33208|Metazoa,3E4QH@33213|Bilateria,48MBV@7711|Chordata	33208|Metazoa	S	-	DDE superfamily endonuclease	GO:0003676
UniRef90_A0A060X5Z9	54.5455	88	2	UniRef90_A0A060X5Z9 Uncharacterized protein n=1 Tax=Oncorhynchus mykiss TaxID=8022 RepID=A0A060X5Z9_ONCMY	-	-	-	-	-	-	-
UniRef90_A0A060X704	98.4615	65	8	UniRef90_A0A060X704 Reverse transcriptase domain-containing protein n=1 Tax=Oncorhynchus mykiss TaxID=8022 RepID=A0A060X704_ONCMY	-	-	-	-	-	-	-
UniRef90_A0A060X741	61.0738	149	24	UniRef90_A0A060X741 Uncharacterized protein n=1 Tax=Oncorhynchus mykiss TaxID=8022 RepID=A0A060X741_ONCMY	-	-	-	-	-	-	GO:0016021
UniRef90_A0A060X873	60.3659	164	9	UniRef90_A0A060X873 Uncharacterized protein n=1 Tax=Oncorhynchus mykiss TaxID=8022 RepID=A0A060X873_ONCMY	-	-	-	-	-	-	-
UniRef90_A0A060X8U4	52.0619	194	3	UniRef90_A0A060X8U4 Uncharacterized protein n=1 Tax=Oncorhynchus mykiss TaxID=8022 RepID=A0A060X8U4_ONCMY	-	-	-	-	-	-	GO:0003676
UniRef90_A0A060XAF9	61.2069	116	4	UniRef90_A0A060XAF9 Uncharacterized protein n=1 Tax=Oncorhynchus mykiss TaxID=8022 RepID=A0A060XAF9_ONCMY	-	-	-	-	-	-	-
UniRef90_A0A060XBZ1	74.2424	66	1	UniRef90_A0A060XBZ1 Uncharacterized protein n=1 Tax=Oncorhynchus mykiss TaxID=8022 RepID=A0A060XBZ1_ONCMY	-	-	-	-	-	-	-
UniRef90_A0A060XCK9	59.0909	110	36	UniRef90_A0A060XCK9 Uncharacterized protein n=1 Tax=Oncorhynchus mykiss TaxID=8022 RepID=A0A060XCK9_ONCMY	-	-	-	-	-	-	-
UniRef90_A0A060XCY8	75.5725	131	2	UniRef90_A0A060XCY8 Reverse transcriptase domain-containing protein n=1 Tax=Oncorhynchus mykiss TaxID=8022 RepID=A0A060XCY8_ONCMY	-	-	-	-	-	-	-
UniRef90_A0A060XGQ7	67.1053	76	2	UniRef90_A0A060XGQ7 Uncharacterized protein n=1 Tax=Oncorhynchus mykiss TaxID=8022 RepID=A0A060XGQ7_ONCMY	-	-	-	-	-	-	-
UniRef90_A0A060XJA8	50.4505	111	2	UniRef90_A0A060XJA8 Reverse transcriptase domain-containing protein n=1 Tax=Oncorhynchus mykiss TaxID=8022 RepID=A0A060XJA8_ONCMY	-	-	-	-	-	-	-
UniRef90_A0A060XJH1	52.2936	109	2	UniRef90_A0A060XJH1 DUF1891 domain-containing protein n=1 Tax=Oncorhynchus mykiss TaxID=8022 RepID=A0A060XJH1_ONCMY	-	-	-	-	-	-	GO:0016706,GO:0008168
UniRef90_A0A060XNN0	51.6854	89	3	UniRef90_A0A060XNN0 Uncharacterized protein n=1 Tax=Oncorhynchus mykiss TaxID=8022 RepID=A0A060XNN0_ONCMY	-	-	-	-	-	-	-
UniRef90_A0A060XT60	84.4828	58	3	UniRef90_A0A060XT60 Uncharacterized protein n=1 Tax=Oncorhynchus mykiss TaxID=8022 RepID=A0A060XT60_ONCMY	-	-	-	-	-	-	-
UniRef90_A0A060XYE4	71.9697	132	10	UniRef90_A0A060XYE4 Uncharacterized protein n=1 Tax=Oncorhynchus mykiss TaxID=8022 RepID=A0A060XYE4_ONCMY	3BTPZ	KOG1075@1|root,KOG1075@2759|Eukaryota,3A7X5@33154|Opisthokonta,3BTPZ@33208|Metazoa,3D9N3@33213|Bilateria,48H7G@7711|Chordata,49FFY@7742|Vertebrata,4A6MA@7898|Actinopterygii	33208|Metazoa	S	-	interleukin-8 biosynthetic process	-
UniRef90_A0A060XZE3	50.5495	91	1	UniRef90_A0A060XZE3 HTH_Tnp_Tc3_2 domain-containing protein n=1 Tax=Oncorhynchus mykiss TaxID=8022 RepID=A0A060XZE3_ONCMY	-	-	-	-	-	-	GO:0003677,GO:0015074,GO:0006313
UniRef90_A0A060Y4B8	81.4815	162	9	UniRef90_A0A060Y4B8 Reverse transcriptase domain-containing protein n=1 Tax=Oncorhynchus mykiss TaxID=8022 RepID=A0A060Y4B8_ONCMY	3BTPZ	KOG1075@1|root,KOG4308@1|root,KOG1075@2759|Eukaryota,KOG4308@2759|Eukaryota,3A7X5@33154|Opisthokonta,3BTPZ@33208|Metazoa,3D9N3@33213|Bilateria,48H7G@7711|Chordata,49FFY@7742|Vertebrata,4A6MA@7898|Actinopterygii	33208|Metazoa	S	-	interleukin-8 biosynthetic process	-
UniRef90_A0A060Y4M7	67.6056	71	1	UniRef90_A0A060Y4M7 Uncharacterized protein n=2 Tax=Oncorhynchus mykiss TaxID=8022 RepID=A0A060Y4M7_ONCMY	-	-	-	-	-	-	-
UniRef90_A0A060Y4V2	68	75	3	UniRef90_A0A060Y4V2 Uncharacterized protein n=1 Tax=Oncorhynchus mykiss TaxID=8022 RepID=A0A060Y4V2_ONCMY	3BHUM	KOG3594@1|root,KOG3594@2759|Eukaryota,39DMX@33154|Opisthokonta,3BHUM@33208|Metazoa,3CUSG@33213|Bilateria,482MZ@7711|Chordata,48YMV@7742|Vertebrata,4A10V@7898|Actinopterygii	33208|Metazoa	S	-	Cadherins are calcium-dependent cell adhesion proteins	-
UniRef90_A0A060Y4Y3	62.1145	227	13	UniRef90_A0A060Y4Y3 Uncharacterized protein n=1 Tax=Oncorhynchus mykiss TaxID=8022 RepID=A0A060Y4Y3_ONCMY	-	-	-	-	-	-	-
UniRef90_A0A060Y6N9	74.1259	143	9	UniRef90_A0A060Y6N9 Uncharacterized protein n=1 Tax=Oncorhynchus mykiss TaxID=8022 RepID=A0A060Y6N9_ONCMY	-	-	-	-	-	-	-
UniRef90_A0A060Y7N2	50.3546	141	7	UniRef90_A0A060Y7N2 Uncharacterized protein n=1 Tax=Oncorhynchus mykiss TaxID=8022 RepID=A0A060Y7N2_ONCMY	-	-	-	-	-	-	-
UniRef90_A0A060Y9N0	91.6667	60	4	UniRef90_A0A060Y9N0 Uncharacterized protein n=1 Tax=Oncorhynchus mykiss TaxID=8022 RepID=A0A060Y9N0_ONCMY	-	-	-	-	-	-	GO:0003676
UniRef90_A0A060YB76	55.5556	90	9	UniRef90_A0A060YB76 Uncharacterized protein n=1 Tax=Oncorhynchus mykiss TaxID=8022 RepID=A0A060YB76_ONCMY	-	-	-	-	-	-	GO:0003676
UniRef90_A0A060YCR7	64.539	141	5	UniRef90_A0A060YCR7 Reverse transcriptase domain-containing protein n=1 Tax=Oncorhynchus mykiss TaxID=8022 RepID=A0A060YCR7_ONCMY	-	-	-	-	-	-	-
UniRef90_A0A060YDE1	62.069	87	9	UniRef90_A0A060YDE1 Uncharacterized protein n=1 Tax=Oncorhynchus mykiss TaxID=8022 RepID=A0A060YDE1_ONCMY	-	-	-	-	-	-	-
UniRef90_A0A060YIF8	58.8235	102	26	UniRef90_A0A060YIF8 Uncharacterized protein n=1 Tax=Oncorhynchus mykiss TaxID=8022 RepID=A0A060YIF8_ONCMY	-	-	-	-	-	-	-
UniRef90_A0A060YJH6	56.1151	139	9	UniRef90_A0A060YJH6 Uncharacterized protein n=1 Tax=Oncorhynchus mykiss TaxID=8022 RepID=A0A060YJH6_ONCMY	-	-	-	-	-	-	-
UniRef90_A0A060YKR2	66.242	157	23	UniRef90_A0A060YKR2 Reverse transcriptase domain-containing protein n=1 Tax=Oncorhynchus mykiss TaxID=8022 RepID=A0A060YKR2_ONCMY	-	-	-	-	-	-	-
UniRef90_A0A060YRT9	90.3846	52	6	UniRef90_A0A060YRT9 Uncharacterized protein (Fragment) n=1 Tax=Oncorhynchus mykiss TaxID=8022 RepID=A0A060YRT9_ONCMY	-	-	-	-	-	-	-
UniRef90_A0A060YVR0	62.3288	146	174	UniRef90_A0A060YVR0 Uncharacterized protein (Fragment) n=1 Tax=Oncorhynchus mykiss TaxID=8022 RepID=A0A060YVR0_ONCMY	-	-	-	-	-	-	-
UniRef90_A0A060YYL9	84.7059	85	3	UniRef90_A0A060YYL9 Uncharacterized protein n=2 Tax=Oncorhynchus mykiss TaxID=8022 RepID=A0A060YYL9_ONCMY	-	-	-	-	-	-	-
UniRef90_A0A060Z0D0	79.8387	124	5	UniRef90_A0A060Z0D0 Uncharacterized protein (Fragment) n=1 Tax=Oncorhynchus mykiss TaxID=8022 RepID=A0A060Z0D0_ONCMY	-	-	-	-	-	-	-
UniRef90_A0A060Z297	59.596	297	16	UniRef90_A0A060Z297 Uncharacterized protein n=1 Tax=Oncorhynchus mykiss TaxID=8022 RepID=A0A060Z297_ONCMY	-	-	-	-	-	-	-
UniRef90_A0A060Z3Y7	80	65	3	UniRef90_A0A060Z3Y7 Uncharacterized protein n=2 Tax=Oncorhynchus mykiss TaxID=8022 RepID=A0A060Z3Y7_ONCMY	-	-	-	-	-	-	-
UniRef90_A0A060Z492	50.5155	97	5	UniRef90_A0A060Z492 Uncharacterized protein n=1 Tax=Oncorhynchus mykiss TaxID=8022 RepID=A0A060Z492_ONCMY	-	-	-	-	-	-	GO:0005576,GO:0005179
UniRef90_A0A060Z4T9	52.1505	186	2	UniRef90_A0A060Z4T9 Reverse transcriptase domain-containing protein n=1 Tax=Oncorhynchus mykiss TaxID=8022 RepID=A0A060Z4T9_ONCMY	-	-	-	-	-	-	-
UniRef90_A0A060Z4X6	73.8255	149	7	UniRef90_A0A060Z4X6 HTH_Tnp_Tc3_2 domain-containing protein n=1 Tax=Oncorhynchus mykiss TaxID=8022 RepID=A0A060Z4X6_ONCMY	3CDFG	2CUQ3@1|root,2RNM8@2759|Eukaryota,3999Y@33154|Opisthokonta,3CDFG@33208|Metazoa,3DUSZ@33213|Bilateria,48N25@7711|Chordata,49J1B@7742|Vertebrata,4A85X@7898|Actinopterygii	33208|Metazoa	S	-	Transposase	GO:0003677,GO:0015074,GO:0006313
UniRef90_A0A060Z5G0	73.2673	101	9	UniRef90_A0A060Z5G0 Uncharacterized protein n=1 Tax=Oncorhynchus mykiss TaxID=8022 RepID=A0A060Z5G0_ONCMY	3BXZV	KOG1075@1|root,KOG1075@2759|Eukaryota,3AGM0@33154|Opisthokonta,3BXZV@33208|Metazoa,3E4GN@33213|Bilateria	33208|Metazoa	S	-	Ribonuclease H protein	-
UniRef90_A0A060Z5J9	73.6842	114	6	UniRef90_A0A060Z5J9 Uncharacterized protein n=1 Tax=Oncorhynchus mykiss TaxID=8022 RepID=A0A060Z5J9_ONCMY	-	-	-	-	-	-	GO:0003676
UniRef90_A0A060Z6N5	77.3585	106	8	UniRef90_A0A060Z6N5 Uncharacterized protein (Fragment) n=1 Tax=Oncorhynchus mykiss TaxID=8022 RepID=A0A060Z6N5_ONCMY	-	-	-	-	-	-	-
UniRef90_A0A060Z8G2	74.1573	356	34	UniRef90_A0A060Z8G2 Integrase catalytic domain-containing protein (Fragment) n=1 Tax=Oncorhynchus mykiss TaxID=8022 RepID=A0A060Z8G2_ONCMY	3BA5H	COG2801@1|root,KOG0017@2759|Eukaryota,38F42@33154|Opisthokonta,3BA5H@33208|Metazoa,3E5BZ@33213|Bilateria,48QR2@7711|Chordata,49MAS@7742|Vertebrata,4A2QN@7898|Actinopterygii	33208|Metazoa	L	-	K02A2.6-like	GO:0003676,GO:0015074
UniRef90_A0A060Z8U5	74.4526	137	6	UniRef90_A0A060Z8U5 Uncharacterized protein (Fragment) n=1 Tax=Oncorhynchus mykiss TaxID=8022 RepID=A0A060Z8U5_ONCMY	-	-	-	-	-	-	-
UniRef90_A0A060Z9E0	75.817	153	29	UniRef90_A0A060Z9E0 Uncharacterized protein n=2 Tax=Oncorhynchus mykiss TaxID=8022 RepID=A0A060Z9E0_ONCMY	-	-	-	-	-	-	-
UniRef90_A0A060Z9R4	91.9355	62	6	UniRef90_A0A060Z9R4 Uncharacterized protein n=1 Tax=Oncorhynchus mykiss TaxID=8022 RepID=A0A060Z9R4_ONCMY	-	-	-	-	-	-	-
UniRef90_A0A060Z9T9	75.8065	62	14	UniRef90_A0A060Z9T9 Uncharacterized protein (Fragment) n=1 Tax=Oncorhynchus mykiss TaxID=8022 RepID=A0A060Z9T9_ONCMY	3BIC8	28N8N@1|root,2QUTZ@2759|Eukaryota,39XUZ@33154|Opisthokonta,3BIC8@33208|Metazoa,3D1M8@33213|Bilateria,48DCS@7711|Chordata,49178@7742|Vertebrata,4A57R@7898|Actinopterygii	33208|Metazoa	S	-	-	-
UniRef90_A0A060ZA50	57.8512	121	2	UniRef90_A0A060ZA50 DDE_3 domain-containing protein (Fragment) n=1 Tax=Oncorhynchus mykiss TaxID=8022 RepID=A0A060ZA50_ONCMY	-	-	-	-	-	-	GO:0003676
UniRef90_A0A060ZCM5	76.9231	65	1	UniRef90_A0A060ZCM5 Uncharacterized protein n=1 Tax=Oncorhynchus mykiss TaxID=8022 RepID=A0A060ZCM5_ONCMY	-	-	-	-	-	-	-
UniRef90_A0A060ZV32	73.2759	116	34	UniRef90_A0A060ZV32 Uncharacterized protein (Fragment) n=1 Tax=Oncorhynchus mykiss TaxID=8022 RepID=A0A060ZV32_ONCMY	-	-	-	-	-	-	-
UniRef90_A0A061A0G9	63.5135	74	3	UniRef90_A0A061A0G9 Uncharacterized protein (Fragment) n=1 Tax=Oncorhynchus mykiss TaxID=8022 RepID=A0A061A0G9_ONCMY	-	-	-	-	-	-	-
UniRef90_A0A061A4K8	74.6269	67	3	UniRef90_A0A061A4K8 Uncharacterized protein n=1 Tax=Oncorhynchus mykiss TaxID=8022 RepID=A0A061A4K8_ONCMY	-	-	-	-	-	-	-
UniRef90_A0A061A5F6	80	160	12	UniRef90_A0A061A5F6 Reverse transcriptase domain-containing protein n=1 Tax=Oncorhynchus mykiss TaxID=8022 RepID=A0A061A5F6_ONCMY	-	-	-	-	-	-	-
UniRef90_A0A061A636	83.908	87	4	UniRef90_A0A061A636 Reverse transcriptase domain-containing protein (Fragment) n=1 Tax=Oncorhynchus mykiss TaxID=8022 RepID=A0A061A636_ONCMY	-	-	-	-	-	-	-
UniRef90_A0A073A8L1	56.4706	85	6	UniRef90_A0A073A8L1 DUF3567 domain-containing protein n=34 Tax=Proteobacteria TaxID=1224 RepID=A0A073A8L1_RALSL	2VVIR	2E6W9@1|root,331FT@2|Bacteria,1N6E1@1224|Proteobacteria,2VVIR@28216|Betaproteobacteria,1K8KB@119060|Burkholderiaceae	28216|Betaproteobacteria	S	-	Protein of unknown function (DUF3567)	-
UniRef90_A0A076PN50	54.2857	105	2	UniRef90_A0A076PN50 Uncharacterized protein n=3 Tax=Comamonas TaxID=283 RepID=A0A076PN50_COMTE	-	-	-	-	-	-	-
UniRef90_A0A076PP83	56.6176	136	2	UniRef90_A0A076PP83 Uncharacterized protein n=5 Tax=Comamonas TaxID=283 RepID=A0A076PP83_COMTE	-	-	-	-	-	-	-
UniRef90_A0A081J5I6	53.2609	92	1	UniRef90_A0A081J5I6 Uncharacterized protein n=1 Tax=Delftia sp. 670 TaxID=1537702 RepID=A0A081J5I6_9BURK	-	-	-	-	-	-	-
UniRef90_A0A085B2J4	55.5556	90	1	UniRef90_A0A085B2J4 Uncharacterized protein n=8 Tax=Cutibacterium acnes TaxID=1747 RepID=A0A085B2J4_CUTAC	-	-	-	-	-	-	-
UniRef90_A0A089PNV9	59.4937	79	3	UniRef90_A0A089PNV9 Two-component-system connector protein YcgZ n=2 Tax=Pluralibacter gergoviae TaxID=61647 RepID=A0A089PNV9_PLUGE	1SB5M	2CBKZ@1|root,32RTK@2|Bacteria,1N1WZ@1224|Proteobacteria,1SB5M@1236|Gammaproteobacteria	1236|Gammaproteobacteria	S	GO:0001101,GO:0006355,GO:0008150,GO:0009889,GO:0009890,GO:0009892,GO:0009987,GO:0010468,GO:0010556,GO:0010558,GO:0010605,GO:0010629,GO:0019219,GO:0019222,GO:0031323,GO:0031324,GO:0031326,GO:0031327,GO:0042221,GO:0045892,GO:0045934,GO:0048519,GO:0048523,GO:0050789,GO:0050794,GO:0050896,GO:0051171,GO:0051172,GO:0051252,GO:0051253,GO:0051716,GO:0060255,GO:0065007,GO:0070887,GO:0071229,GO:0080090,GO:1902679,GO:1903506,GO:1903507,GO:2000112,GO:2000113,GO:2001141	Two-component-system connector protein YcgZ	GO:0071468
UniRef90_A0A090IR55	80.3571	56	8	UniRef90_A0A090IR55 Uncharacterized protein n=3 Tax=Bacillus thermoamylovorans TaxID=35841 RepID=A0A090IR55_9BACI	-	-	-	-	-	-	-
UniRef90_A0A094ALN3	50	98	1	UniRef90_A0A094ALN3 Sacchrp_dh_C domain-containing protein n=1 Tax=Pseudogymnoascus sp. VKM F-3775 TaxID=1420901 RepID=A0A094ALN3_9PEZI	3NUXI	COG1748@1|root,KOG0172@2759|Eukaryota,38BKM@33154|Opisthokonta,3NUXI@4751|Fungi,3QKR4@4890|Ascomycota,20V6D@147548|Leotiomycetes	4751|Fungi	E	GO:0003674,GO:0003824,GO:0004753,GO:0004755,GO:0005575,GO:0005622,GO:0005623,GO:0005737,GO:0006082,GO:0006091,GO:0006520,GO:0006553,GO:0006807,GO:0008150,GO:0008152,GO:0008652,GO:0009058,GO:0009066,GO:0009067,GO:0009085,GO:0009987,GO:0016053,GO:0016491,GO:0016645,GO:0016646,GO:0019752,GO:0019878,GO:0043436,GO:0044237,GO:0044238,GO:0044249,GO:0044281,GO:0044283,GO:0044424,GO:0044464,GO:0046394,GO:0055114,GO:0071704,GO:0071944,GO:1901564,GO:1901566,GO:1901576,GO:1901605,GO:1901607	saccharopine dehydrogenase	-
UniRef90_A0A095YRK3	63.2911	79	4	UniRef90_A0A095YRK3 ATP synthase subunit epsilon n=3 Tax=Prevotella histicola TaxID=470565 RepID=A0A095YRK3_9BACT	4NUYG	COG0355@1|root,COG0355@2|Bacteria,4NUYG@976|Bacteroidetes,2FUIM@200643|Bacteroidia	976|Bacteroidetes	C	-	ATP synthase, Delta Epsilon	GO:0045261,GO:0046933
UniRef90_A0A0A2WM60	59.5506	89	3	UniRef90_A0A0A2WM60 30S ribosomal protein S20 n=57 Tax=Bacteria TaxID=2 RepID=A0A0A2WM60_9GAMM	1X7IW	COG0268@1|root,COG0268@2|Bacteria,1MZ94@1224|Proteobacteria,1S9AI@1236|Gammaproteobacteria,1X7IW@135614|Xanthomonadales	135614|Xanthomonadales	J	GO:0003674,GO:0003676,GO:0003723,GO:0003735,GO:0005198,GO:0005488,GO:0005575,GO:0005622,GO:0005623,GO:0005737,GO:0005840,GO:0006412,GO:0006518,GO:0006807,GO:0008150,GO:0008152,GO:0009058,GO:0009059,GO:0009987,GO:0010467,GO:0019538,GO:0019843,GO:0032991,GO:0034641,GO:0034645,GO:0043043,GO:0043170,GO:0043226,GO:0043228,GO:0043229,GO:0043232,GO:0043603,GO:0043604,GO:0044237,GO:0044238,GO:0044249,GO:0044260,GO:0044267,GO:0044271,GO:0044424,GO:0044444,GO:0044464,GO:0071704,GO:0097159,GO:1901363,GO:1901564,GO:1901566,GO:1901576,GO:1990904	Binds directly to 16S ribosomal RNA	-
UniRef90_A0A0B5X4R0	55.6818	88	2	UniRef90_A0A0B5X4R0 Uncharacterized protein n=1 Tax=Bacillus coagulans DSM 1 = ATCC 7050 TaxID=1121088 RepID=A0A0B5X4R0_BACCO	-	-	-	-	-	-	-
UniRef90_A0A0B7AG49	63.0137	73	1	UniRef90_A0A0B7AG49 Uncharacterized protein (Fragment) n=1 Tax=Arion vulgaris TaxID=1028688 RepID=A0A0B7AG49_9EUPU	COG3344	COG3344@1|root,COG3344@2|Bacteria	2|Bacteria	L	-	homing of group II introns; reverse transcriptase	-
UniRef90_A0A0B7C1D3	67.1429	70	1	UniRef90_A0A0B7C1D3 Dynamin-type G domain-containing protein (Fragment) n=1 Tax=Arion vulgaris TaxID=1028688 RepID=A0A0B7C1D3_9EUPU	-	-	-	-	-	-	GO:0005525
UniRef90_A0A0C2RNV3	59.3496	123	4	UniRef90_A0A0C2RNV3 Reverse transcriptase domain-containing protein (Fragment) n=1 Tax=Pseudomonas stutzeri TaxID=316 RepID=A0A0C2RNV3_PSEST	-	-	-	-	-	-	-
UniRef90_A0A0C2S076	74.4186	129	3	UniRef90_A0A0C2S076 DUF1891 domain-containing protein (Fragment) n=1 Tax=Pseudomonas stutzeri TaxID=316 RepID=A0A0C2S076_PSEST	-	-	-	-	-	-	GO:0016706,GO:0008168
UniRef90_A0A0D0FGY7	72.4638	69	1	UniRef90_A0A0D0FGY7 Uncharacterized protein n=4 Tax=Bacillus TaxID=1386 RepID=A0A0D0FGY7_9BACI	-	-	-	-	-	-	-
UniRef90_A0A0D0FHD5	54.1176	85	2	UniRef90_A0A0D0FHD5 DUF4256 domain-containing protein n=1 Tax=Bacillus thermoamylovorans TaxID=35841 RepID=A0A0D0FHD5_9BACI	-	-	-	-	-	-	-
UniRef90_A0A0D0QIT5	56.1798	89	1	UniRef90_A0A0D0QIT5 30S ribosomal protein S20 n=40 Tax=Xanthomonadales TaxID=135614 RepID=A0A0D0QIT5_9GAMM	-	-	-	-	-	-	-
UniRef90_A0A0D6R972	73.3696	184	7	UniRef90_A0A0D6R972 Uncharacterized protein n=1 Tax=Araucaria cunninghamii TaxID=56994 RepID=A0A0D6R972_ARACU	-	-	-	-	-	-	-
UniRef90_A0A0E9RVU4	60.5263	76	5	UniRef90_A0A0E9RVU4 HTH arsR-type domain-containing protein n=1 Tax=Anguilla anguilla TaxID=7936 RepID=A0A0E9RVU4_ANGAN	-	-	-	-	-	-	GO:0003700
UniRef90_A0A0E9VFI6	57.1429	56	4	UniRef90_A0A0E9VFI6 Uncharacterized protein n=2 Tax=Anguilla anguilla TaxID=7936 RepID=A0A0E9VFI6_ANGAN	-	-	-	-	-	-	-
UniRef90_A0A0E9WIG2	61.039	77	1	UniRef90_A0A0E9WIG2 Uncharacterized protein n=1 Tax=Anguilla anguilla TaxID=7936 RepID=A0A0E9WIG2_ANGAN	-	-	-	-	-	-	-
UniRef90_A0A0E9XFR7	50	92	4	UniRef90_A0A0E9XFR7 DDE_3 domain-containing protein n=1 Tax=Anguilla anguilla TaxID=7936 RepID=A0A0E9XFR7_ANGAN	-	-	-	-	-	-	GO:0003676
UniRef90_A0A0F6B5C9	58.1081	74	4	UniRef90_A0A0F6B5C9 Uncharacterized protein n=1 Tax=Salmonella typhimurium (strain 14028s / SGSC 2262) TaxID=588858 RepID=A0A0F6B5C9_SALT1	-	-	-	-	-	-	-
UniRef90_A0A0G4BYJ6	51.0101	198	33	UniRef90_A0A0G4BYJ6 Uncharacterized protein n=2 Tax=Neisseria meningitidis TaxID=487 RepID=A0A0G4BYJ6_NEIME	-	-	-	-	-	-	-
UniRef90_A0A0H1R6T2	62.8205	78	1	UniRef90_A0A0H1R6T2 ATP-binding protein n=20 Tax=Rhizobiales TaxID=356 RepID=A0A0H1R6T2_9RHIZ	2UBUW	COG0271@1|root,COG0271@2|Bacteria,1R3MM@1224|Proteobacteria,2UBUW@28211|Alphaproteobacteria,1JVWQ@119045|Methylobacteriaceae	28211|Alphaproteobacteria	T	-	Belongs to the BolA IbaG family	GO:0005524
UniRef90_A0A0J6R2J0	51.5464	97	2	UniRef90_A0A0J6R2J0 Uncharacterized protein n=2 Tax=Methylobacterium TaxID=407 RepID=A0A0J6R2J0_9RHIZ	-	-	-	-	-	-	-
UniRef90_A0A0J6T050	59.5238	84	1	UniRef90_A0A0J6T050 Uncharacterized protein n=1 Tax=Methylobacterium aquaticum TaxID=270351 RepID=A0A0J6T050_9RHIZ	2V00T	2AA6T@1|root,30ZFW@2|Bacteria,1PME5@1224|Proteobacteria,2V00T@28211|Alphaproteobacteria,1JV95@119045|Methylobacteriaceae	28211|Alphaproteobacteria	-	-	-	-
UniRef90_A0A0J6T6B0	92.5532	94	2	UniRef90_A0A0J6T6B0 Uncharacterized protein n=2 Tax=Methylobacterium variabile TaxID=298794 RepID=A0A0J6T6B0_9RHIZ	-	-	-	-	-	-	-
UniRef90_A0A0K0SS62	80.3279	61	5	UniRef90_A0A0K0SS62 Uncharacterized protein n=3 Tax=Methylophilaceae TaxID=32011 RepID=A0A0K0SS62_9PROT	-	-	-	-	-	-	-
UniRef90_A0A0K2VLH5	64.9485	97	15	UniRef90_A0A0K2VLH5 Uncharacterized protein (Fragment) n=1 Tax=Lepeophtheirus salmonis TaxID=72036 RepID=A0A0K2VLH5_LEPSM	-	-	-	-	-	-	-
UniRef90_A0A0K2VLN8	100	55	40	UniRef90_A0A0K2VLN8 Uncharacterized protein n=1 Tax=Lepeophtheirus salmonis TaxID=72036 RepID=A0A0K2VLN8_LEPSM	-	-	-	-	-	-	-
UniRef90_A0A0K2VLS3	85.5072	69	4	UniRef90_A0A0K2VLS3 Uncharacterized protein (Fragment) n=1 Tax=Lepeophtheirus salmonis TaxID=72036 RepID=A0A0K2VLS3_LEPSM	-	-	-	-	-	-	-
UniRef90_A0A0K2YBY3	50.8197	61	3	UniRef90_A0A0K2YBY3 Uncharacterized protein n=1 Tax=Rhodococcus sp. RD6.2 TaxID=260936 RepID=A0A0K2YBY3_9NOCA	-	-	-	-	-	-	-
UniRef90_A0A0M8MSD9	77.907	86	3	UniRef90_A0A0M8MSD9 Uncharacterized protein n=1 Tax=Malassezia pachydermatis TaxID=77020 RepID=A0A0M8MSD9_9BASI	3P6XG	2DMTJ@1|root,2S7HN@2759|Eukaryota,3A8ZU@33154|Opisthokonta,3P6XG@4751|Fungi,3V2K3@5204|Basidiomycota,3N1HP@452284|Ustilaginomycotina	4751|Fungi	S	-	NADH-ubiquinone reductase complex 1 MLRQ subunit	GO:0016021
UniRef90_A0A0M8MTU3	68.0556	72	1	UniRef90_A0A0M8MTU3 Uncharacterized protein n=1 Tax=Malassezia pachydermatis TaxID=77020 RepID=A0A0M8MTU3_9BASI	-	-	-	-	-	-	-
UniRef90_A0A0N7HZ30	61.1111	72	4	UniRef90_A0A0N7HZ30 XRE family transcriptional regulator n=3 Tax=Alphaproteobacteria TaxID=28211 RepID=A0A0N7HZ30_9CAUL	-	-	-	-	-	-	GO:0003677
UniRef90_A0A0N9HHB0	60.7843	51	7	UniRef90_A0A0N9HHB0 Uncharacterized protein n=1 Tax=uncultured bacterium 5H7 TaxID=1701327 RepID=A0A0N9HHB0_9BACT	2UJNP	2DNPH@1|root,32YF1@2|Bacteria,1NARM@1224|Proteobacteria,2UJNP@28211|Alphaproteobacteria	28211|Alphaproteobacteria	-	-	-	-
UniRef90_A0A0P7Z4R6	50	90	4	UniRef90_A0A0P7Z4R6 Uncharacterized protein n=2 Tax=Osteoglossocephalai TaxID=1489341 RepID=A0A0P7Z4R6_SCLFO	3BDS4	COG2319@1|root,KOG2394@2759|Eukaryota,38GEV@33154|Opisthokonta,3BDS4@33208|Metazoa,3CSCN@33213|Bilateria,48801@7711|Chordata,493G7@7742|Vertebrata,49ZIJ@7898|Actinopterygii	33208|Metazoa	S	GO:0003674,GO:0005488,GO:0005515,GO:0005575,GO:0006464,GO:0006508,GO:0006807,GO:0008150,GO:0008152,GO:0009893,GO:0009987,GO:0010468,GO:0010604,GO:0010628,GO:0016579,GO:0019222,GO:0019538,GO:0030162,GO:0031323,GO:0031325,GO:0031399,GO:0031401,GO:0032268,GO:0032270,GO:0032879,GO:0032880,GO:0036211,GO:0040012,GO:0040017,GO:0043170,GO:0043412,GO:0044237,GO:0044238,GO:0044260,GO:0044267,GO:0045862,GO:0048518,GO:0048520,GO:0048522,GO:0050789,GO:0050794,GO:0050795,GO:0051171,GO:0051173,GO:0051246,GO:0051247,GO:0060255,GO:0060341,GO:0065007,GO:0070646,GO:0070647,GO:0071704,GO:0080090,GO:0090085,GO:0090325,GO:0090326,GO:1901564,GO:1903003,GO:1903320,GO:1903322,GO:1903827,GO:1903829,GO:2000008,GO:2000010	WD repeat domain 20	-
UniRef90_A0A0Q2X1Y9	56.4103	78	1	UniRef90_A0A0Q2X1Y9 General stress protein CsbD n=3 Tax=Mycobacterium TaxID=1763 RepID=A0A0Q2X1Y9_MYCGO	-	-	-	-	-	-	-
UniRef90_A0A0Q4BXW8	50.5376	93	1	UniRef90_A0A0Q4BXW8 Uncharacterized protein n=1 Tax=Novosphingobium sp. Leaf2 TaxID=1735670 RepID=A0A0Q4BXW8_9SPHN	-	-	-	-	-	-	-
UniRef90_A0A0Q5JQD7	69.5652	69	1	UniRef90_A0A0Q5JQD7 Transporter n=2 Tax=Microbacteriaceae TaxID=85023 RepID=A0A0Q5JQD7_9MICO	2UFW3	COG3585@1|root,COG3585@2|Bacteria,1N7IB@1224|Proteobacteria,2UFW3@28211|Alphaproteobacteria,43M1H@69277|Phyllobacteriaceae	28211|Alphaproteobacteria	H	-	PFAM TOBE domain protein	GO:0015689
UniRef90_A0A0Q6CKC6	53.2609	92	1	UniRef90_A0A0Q6CKC6 Uncharacterized protein n=4 Tax=Methylobacteriaceae TaxID=119045 RepID=A0A0Q6CKC6_9RHIZ	2UX8U	2CBP3@1|root,33HRW@2|Bacteria,1P9W9@1224|Proteobacteria,2UX8U@28211|Alphaproteobacteria,1JVTB@119045|Methylobacteriaceae	28211|Alphaproteobacteria	-	-	-	GO:0016021
UniRef90_A0A0U1MGB7	50	52	6	UniRef90_A0A0U1MGB7 Uncharacterized protein n=2 Tax=Staphylococcus TaxID=1279 RepID=A0A0U1MGB7_STAAU	-	-	-	-	-	-	-
UniRef90_A0A0V0YX51	67.6471	68	5	UniRef90_A0A0V0YX51 Uncharacterized protein (Fragment) n=1 Tax=Trichinella patagoniensis TaxID=990121 RepID=A0A0V0YX51_9BILA	-	-	-	-	-	-	-
UniRef90_A0A127SJ89	72.4638	207	46	UniRef90_A0A127SJ89 Uncharacterized protein (Fragment) n=1 Tax=uncultured bacterium TaxID=77133 RepID=A0A127SJ89_9BACT	-	-	-	-	-	-	-
UniRef90_A0A132GMG5	56.5217	46	1	UniRef90_A0A132GMG5 Uncharacterized protein (Fragment) n=1 Tax=bacterium P201 TaxID=1768112 RepID=A0A132GMG5_9BACT	-	-	-	-	-	-	-
UniRef90_A0A133Q0W3	67.6471	68	1	UniRef90_A0A133Q0W3 Protein VraX n=3 Tax=Staphylococcus TaxID=1279 RepID=A0A133Q0W3_STALU	-	-	-	-	-	-	-
UniRef90_A0A133RX49	66.6667	69	1	UniRef90_A0A133RX49 Uncharacterized protein n=1 Tax=Streptococcus mitis TaxID=28037 RepID=A0A133RX49_STRMT	-	-	-	-	-	-	-
