UniRef90_A0A4W5RHM6	77.2277	101	4	UniRef90_A0A4W5RHM6 Uncharacterized protein n=1 Tax=Hucho hucho TaxID=62062 RepID=A0A4W5RHM6_9TELE	3BD2R	COG1215@1|root,KOG2571@2759|Eukaryota,38HE4@33154|Opisthokonta,3BD2R@33208|Metazoa,3CT71@33213|Bilateria,487C1@7711|Chordata,499XP@7742|Vertebrata,4A18E@7898|Actinopterygii	33208|Metazoa	M	GO:0000003,GO:0000271,GO:0001655,GO:0001838,GO:0002009,GO:0003006,GO:0003674,GO:0003824,GO:0004100,GO:0005575,GO:0005622,GO:0005623,GO:0005737,GO:0005886,GO:0005938,GO:0005975,GO:0005976,GO:0006022,GO:0006023,GO:0006030,GO:0006031,GO:0006034,GO:0006035,GO:0006037,GO:0006038,GO:0006040,GO:0006807,GO:0006950,GO:0007275,GO:0007276,GO:0007281,GO:0007292,GO:0007424,GO:0007442,GO:0007443,GO:0007591,GO:0007593,GO:0008150,GO:0008152,GO:0008194,GO:0008362,GO:0008375,GO:0009058,GO:0009059,GO:0009611,GO:0009653,GO:0009790,GO:0009887,GO:0009888,GO:0009987,GO:0010383,GO:0016020,GO:0016021,GO:0016051,GO:0016331,GO:0016740,GO:0016757,GO:0016758,GO:0017144,GO:0019953,GO:0021700,GO:0022404,GO:0022412,GO:0022414,GO:0030154,GO:0030428,GO:0030703,GO:0031224,GO:0032501,GO:0032502,GO:0032504,GO:0032879,GO:0032880,GO:0033692,GO:0034637,GO:0034645,GO:0035148,GO:0035150,GO:0035151,GO:0035152,GO:0035158,GO:0035159,GO:0035239,GO:0035295,GO:0035296,GO:0040003,GO:0042303,GO:0042335,GO:0042546,GO:0043170,GO:0043473,GO:0044036,GO:0044038,GO:0044085,GO:0044237,GO:0044238,GO:0044249,GO:0044260,GO:0044262,GO:0044264,GO:0044424,GO:0044425,GO:0044444,GO:0044464,GO:0044703,GO:0045177,GO:0046349,GO:0048066,GO:0048067,GO:0048085,GO:0048468,GO:0048477,GO:0048513,GO:0048518,GO:0048546,GO:0048565,GO:0048598,GO:0048609,GO:0048619,GO:0048646,GO:0048729,GO:0048731,GO:0048856,GO:0048869,GO:0050789,GO:0050896,GO:0051704,GO:0055123,GO:0060341,GO:0060429,GO:0060438,GO:0060439,GO:0060541,GO:0060562,GO:0061326,GO:0061333,GO:0061525,GO:0065007,GO:0065008,GO:0070589,GO:0070592,GO:0071554,GO:0071704,GO:0071840,GO:0071944,GO:0072001,GO:0072002,GO:0072175,GO:0090066,GO:0099568,GO:1901071,GO:1901073,GO:1901135,GO:1901137,GO:1901564,GO:1901566,GO:1901576,GO:1903827,GO:1903829,GO:1904375,GO:1904377,GO:1904776,GO:1904778	cell wall polysaccharide biosynthetic process	GO:0016021,GO:0004100
UniRef90_A0A4Y1MQQ3	54.0541	111	2	UniRef90_A0A4Y1MQQ3 Uncharacterized protein n=1 Tax=Roseomonas mucosa TaxID=207340 RepID=A0A4Y1MQQ3_9PROT	-	-	-	-	-	-	-
UniRef90_A0A4Y1N0R4	64.3836	73	1	UniRef90_A0A4Y1N0R4 Diguanylate cyclase n=1 Tax=Roseomonas mucosa TaxID=207340 RepID=A0A4Y1N0R4_9PROT	1RGCV	COG2199@1|root,COG2199@2|Bacteria,1RGCV@1224|Proteobacteria	1224|Proteobacteria	T	-	Diguanylate cyclase	GO:0016021,GO:0052621
UniRef90_A0A4Y7U3M7	50.5155	97	1	UniRef90_A0A4Y7U3M7 Magnesium chelatase (Fragment) n=1 Tax=Flavobacterium circumlabens TaxID=2133765 RepID=A0A4Y7U3M7_9FLAO	-	-	-	-	-	-	-
UniRef90_A0A4Y9T5G9	74.6667	75	3	UniRef90_A0A4Y9T5G9 Uncharacterized protein (Fragment) n=1 Tax=Pseudomonas fluorescens TaxID=294 RepID=A0A4Y9T5G9_PSEFL	-	-	-	-	-	-	-
UniRef90_A0A510J3C5	58.8235	85	4	UniRef90_A0A510J3C5 GlnE domain-containing protein n=1 Tax=Halomonas axialensis TaxID=115555 RepID=A0A510J3C5_9GAMM	1XHKJ	COG1391@1|root,COG1391@2|Bacteria,1MU4I@1224|Proteobacteria,1RP9N@1236|Gammaproteobacteria,1XHKJ@135619|Oceanospirillales	135619|Oceanospirillales	OT	GO:0000166,GO:0003674,GO:0003824,GO:0005488,GO:0005524,GO:0008081,GO:0008144,GO:0008150,GO:0008152,GO:0008882,GO:0016740,GO:0016772,GO:0016779,GO:0016787,GO:0016788,GO:0017076,GO:0030554,GO:0032553,GO:0032555,GO:0032559,GO:0035639,GO:0036094,GO:0042578,GO:0043167,GO:0043168,GO:0047388,GO:0070566,GO:0097159,GO:0097367,GO:0140096,GO:1901265,GO:1901363	Involved in the regulation of glutamine synthetase GlnA, a key enzyme in the process to assimilate ammonia. When cellular nitrogen levels are high, the C-terminal adenylyl transferase (AT) inactivates GlnA by covalent transfer of an adenylyl group from ATP to specific tyrosine residue of GlnA, thus reducing its activity. Conversely, when nitrogen levels are low, the N-terminal adenylyl removase (AR) activates GlnA by removing the adenylyl group by phosphorolysis, increasing its activity. The regulatory region of GlnE binds the signal transduction protein PII (GlnB) which indicates the nitrogen status of the cell	GO:0008882
UniRef90_A0A511F6Q8	54.023	87	2	UniRef90_A0A511F6Q8 Uncharacterized protein n=1 Tax=Methylorubrum extorquens TaxID=408 RepID=A0A511F6Q8_METEX	2V19X	2AB9U@1|root,310QD@2|Bacteria,1PNQB@1224|Proteobacteria,2V19X@28211|Alphaproteobacteria,1JWVM@119045|Methylobacteriaceae	28211|Alphaproteobacteria	-	-	-	-
UniRef90_A0A512DHM1	61.25	80	3	UniRef90_A0A512DHM1 Phosphoribosylformylglycinamidine synthase subunit PurS n=1 Tax=Skermanella aerolata TaxID=393310 RepID=A0A512DHM1_9PROT	2JTEV	COG1828@1|root,COG1828@2|Bacteria,1N83G@1224|Proteobacteria,2UF7S@28211|Alphaproteobacteria,2JTEV@204441|Rhodospirillales	204441|Rhodospirillales	F	-	Part of the phosphoribosylformylglycinamidine synthase complex involved in the purines biosynthetic pathway. Catalyzes the ATP-dependent conversion of formylglycinamide ribonucleotide (FGAR) and glutamine to yield formylglycinamidine ribonucleotide (FGAM) and glutamate. The FGAM synthase complex is composed of three subunits. PurQ produces an ammonia molecule by converting glutamine to glutamate. PurL transfers the ammonia molecule to FGAR to form FGAM in an ATP-dependent manner. PurS interacts with PurQ and PurL and is thought to assist in the transfer of the ammonia molecule from PurQ to PurL	GO:0005737,GO:0005524,GO:0004642,GO:0006189
UniRef90_A0A512DIF9	60.7143	84	4	UniRef90_A0A512DIF9 Uncharacterized protein n=1 Tax=Skermanella aerolata TaxID=393310 RepID=A0A512DIF9_9PROT	-	-	-	-	-	-	-
UniRef90_A0A512DIG5	67.8322	143	2	UniRef90_A0A512DIG5 PRC domain-containing protein n=1 Tax=Skermanella aerolata TaxID=393310 RepID=A0A512DIG5_9PROT	-	-	-	-	-	-	-
UniRef90_A0A512DIP1	81.9672	61	4	UniRef90_A0A512DIP1 Uncharacterized protein n=1 Tax=Skermanella aerolata TaxID=393310 RepID=A0A512DIP1_9PROT	-	-	-	-	-	-	GO:0016021
UniRef90_A0A512DJX2	63.0137	73	2	UniRef90_A0A512DJX2 Uncharacterized protein n=1 Tax=Skermanella aerolata TaxID=393310 RepID=A0A512DJX2_9PROT	-	-	-	-	-	-	GO:0016021
UniRef90_A0A512DKQ1	96.4789	142	60	UniRef90_A0A512DKQ1 DUF2382 domain-containing protein n=1 Tax=Skermanella aerolata TaxID=393310 RepID=A0A512DKQ1_9PROT	-	-	-	-	-	-	-
UniRef90_A0A512DKX7	50.2674	187	4	UniRef90_A0A512DKX7 Glutamine amidotransferase n=4 Tax=Skermanella TaxID=204447 RepID=A0A512DKX7_9PROT	-	-	-	-	-	-	GO:0016740,GO:0006541
UniRef90_A0A512DLN9	99.5671	231	58	UniRef90_A0A512DLN9 DUF2382 domain-containing protein n=1 Tax=Skermanella aerolata TaxID=393310 RepID=A0A512DLN9_9PROT	-	-	-	-	-	-	-
UniRef90_A0A512DLP0	84.8315	178	11	UniRef90_A0A512DLP0 Uncharacterized protein n=1 Tax=Skermanella aerolata TaxID=393310 RepID=A0A512DLP0_9PROT	-	-	-	-	-	-	-
UniRef90_A0A512DPU2	66.4122	131	8	UniRef90_A0A512DPU2 Cytochrome C protein n=2 Tax=Skermanella aerolata TaxID=393310 RepID=A0A512DPU2_9PROT	2UCUT	COG3474@1|root,COG3474@2|Bacteria,1MZGS@1224|Proteobacteria,2UCUT@28211|Alphaproteobacteria,3JY3A@41294|Bradyrhizobiaceae	28211|Alphaproteobacteria	C	GO:0003674,GO:0003824,GO:0005488,GO:0005575,GO:0005623,GO:0006091,GO:0008150,GO:0008152,GO:0009055,GO:0009987,GO:0015979,GO:0016491,GO:0020037,GO:0022900,GO:0042597,GO:0043167,GO:0043169,GO:0044237,GO:0044464,GO:0046872,GO:0046906,GO:0048037,GO:0055114,GO:0097159,GO:1901363	cytochrome	GO:0009055,GO:0020037,GO:0046872
UniRef90_A0A512DQD1	94.8052	77	5	UniRef90_A0A512DQD1 Uncharacterized protein n=1 Tax=Skermanella aerolata TaxID=393310 RepID=A0A512DQD1_9PROT	-	-	-	-	-	-	-
UniRef90_A0A512DQV0	59.1549	142	7	UniRef90_A0A512DQV0 Phasin_2 domain-containing protein n=1 Tax=Skermanella aerolata TaxID=393310 RepID=A0A512DQV0_9PROT	-	-	-	-	-	-	-
UniRef90_A0A512DQY4	64.1026	156	3	UniRef90_A0A512DQY4 Uncharacterized protein n=1 Tax=Skermanella aerolata TaxID=393310 RepID=A0A512DQY4_9PROT	-	-	-	-	-	-	GO:0016021
UniRef90_A0A512DR42	54.9708	171	2	UniRef90_A0A512DR42 Adenine phosphoribosyltransferase n=1 Tax=Skermanella aerolata TaxID=393310 RepID=A0A512DR42_9PROT	2JRRF	COG0503@1|root,COG0503@2|Bacteria,1MVZ6@1224|Proteobacteria,2TV7J@28211|Alphaproteobacteria,2JRRF@204441|Rhodospirillales	204441|Rhodospirillales	F	GO:0003674,GO:0003824,GO:0003999,GO:0005575,GO:0005622,GO:0005623,GO:0005737,GO:0006139,GO:0006144,GO:0006163,GO:0006164,GO:0006166,GO:0006167,GO:0006168,GO:0006725,GO:0006753,GO:0006793,GO:0006796,GO:0006807,GO:0008150,GO:0008152,GO:0009058,GO:0009112,GO:0009113,GO:0009116,GO:0009117,GO:0009119,GO:0009123,GO:0009124,GO:0009126,GO:0009127,GO:0009150,GO:0009152,GO:0009156,GO:0009161,GO:0009163,GO:0009165,GO:0009167,GO:0009168,GO:0009259,GO:0009260,GO:0009987,GO:0016740,GO:0016757,GO:0016763,GO:0017144,GO:0018130,GO:0019438,GO:0019637,GO:0019693,GO:0032261,GO:0034404,GO:0034641,GO:0034654,GO:0042278,GO:0042440,GO:0042451,GO:0042455,GO:0043094,GO:0043096,GO:0043101,GO:0043173,GO:0043174,GO:0044209,GO:0044237,GO:0044238,GO:0044249,GO:0044271,GO:0044281,GO:0044283,GO:0044424,GO:0044464,GO:0046033,GO:0046083,GO:0046084,GO:0046112,GO:0046128,GO:0046129,GO:0046148,GO:0046390,GO:0046483,GO:0055086,GO:0071704,GO:0072521,GO:0072522,GO:0090407,GO:1901135,GO:1901137,GO:1901293,GO:1901360,GO:1901362,GO:1901564,GO:1901566,GO:1901576,GO:1901657,GO:1901659	Catalyzes a salvage reaction resulting in the formation of AMP, that is energically less costly than de novo synthesis	GO:0005737,GO:0003999,GO:0006168,GO:0044209,GO:0006166
UniRef90_A0A512DRH4	86.1111	108	16	UniRef90_A0A512DRH4 Uncharacterized protein n=1 Tax=Skermanella aerolata TaxID=393310 RepID=A0A512DRH4_9PROT	-	-	-	-	-	-	-
UniRef90_A0A512DS97	74.6269	67	2	UniRef90_A0A512DS97 Uncharacterized protein n=1 Tax=Skermanella aerolata TaxID=393310 RepID=A0A512DS97_9PROT	-	-	-	-	-	-	-
UniRef90_A0A512DSY3	64.1304	92	7	UniRef90_A0A512DSY3 Uncharacterized protein n=2 Tax=Skermanella aerolata TaxID=393310 RepID=A0A512DSY3_9PROT	-	-	-	-	-	-	GO:0016021
UniRef90_A0A512DTT5	52.7174	184	8	UniRef90_A0A512DTT5 Uncharacterized protein n=3 Tax=Skermanella aerolata TaxID=393310 RepID=A0A512DTT5_9PROT	2K1AD	COG3403@1|root,COG3403@2|Bacteria,1RB0K@1224|Proteobacteria,2U584@28211|Alphaproteobacteria,2K1AD@204457|Sphingomonadales	204457|Sphingomonadales	S	-	YqcI/YcgG family	-
UniRef90_A0A512DWT1	75	64	7	UniRef90_A0A512DWT1 Uncharacterized protein n=1 Tax=Skermanella aerolata TaxID=393310 RepID=A0A512DWT1_9PROT	-	-	-	-	-	-	-
UniRef90_A0A512DXB2	89.6	125	9	UniRef90_A0A512DXB2 Uncharacterized protein n=1 Tax=Skermanella aerolata TaxID=393310 RepID=A0A512DXB2_9PROT	-	-	-	-	-	-	-
UniRef90_A0A512DXF5	93.1035	145	19	UniRef90_A0A512DXF5 Uncharacterized protein n=1 Tax=Skermanella aerolata TaxID=393310 RepID=A0A512DXF5_9PROT	-	-	-	-	-	-	GO:0016021
UniRef90_A0A512DXF7	69.5122	82	16	UniRef90_A0A512DXF7 Uncharacterized protein n=1 Tax=Skermanella aerolata TaxID=393310 RepID=A0A512DXF7_9PROT	-	-	-	-	-	-	-
UniRef90_A0A512DXM9	60.8974	156	4	UniRef90_A0A512DXM9 MarR family transcriptional regulator n=1 Tax=Skermanella aerolata TaxID=393310 RepID=A0A512DXM9_9PROT	-	-	-	-	-	-	GO:0003700
UniRef90_A0A512DZN7	57.0248	121	18	UniRef90_A0A512DZN7 Uncharacterized protein n=1 Tax=Skermanella aerolata TaxID=393310 RepID=A0A512DZN7_9PROT	-	-	-	-	-	-	-
UniRef90_A0A512E119	69.5906	171	25	UniRef90_A0A512E119 YciE/YciF family protein n=1 Tax=Skermanella aerolata TaxID=393310 RepID=A0A512E119_9PROT	-	-	-	-	-	-	-
UniRef90_A0A512E138	78.481	158	4	UniRef90_A0A512E138 Uncharacterized protein n=1 Tax=Skermanella aerolata TaxID=393310 RepID=A0A512E138_9PROT	-	-	-	-	-	-	-
UniRef90_A0A512E1Y0	53.1915	94	2	UniRef90_A0A512E1Y0 Uncharacterized protein n=1 Tax=Skermanella aerolata TaxID=393310 RepID=A0A512E1Y0_9PROT	-	-	-	-	-	-	-
UniRef90_A0A512E229	96.8421	95	7	UniRef90_A0A512E229 Uncharacterized protein n=1 Tax=Skermanella aerolata TaxID=393310 RepID=A0A512E229_9PROT	-	-	-	-	-	-	-
UniRef90_A0A515BCW9	50.505	198	5	UniRef90_A0A515BCW9 Uncharacterized protein n=3 Tax=Acinetobacter TaxID=469 RepID=A0A515BCW9_9GAMM	1THJT	28PFD@1|root,2ZC6I@2|Bacteria,1R8PT@1224|Proteobacteria,1THJT@1236|Gammaproteobacteria,3NKM3@468|Moraxellaceae	1236|Gammaproteobacteria	-	-	-	-
UniRef90_A0A520HG04	96	50	1	UniRef90_A0A520HG04 Signal recognition particle protein (Fragment) n=1 Tax=Sphingomonas sp. TaxID=28214 RepID=A0A520HG04_SPHSX	-	-	-	-	-	-	GO:0048500,GO:0005525,GO:0003924,GO:0006614
UniRef90_A0A520JIU9	50.4	125	4	UniRef90_A0A520JIU9 rADc domain-containing protein (Fragment) n=1 Tax=Sphingomonas sp. TaxID=28214 RepID=A0A520JIU9_SPHSX	2K042	COG0030@1|root,COG0030@2|Bacteria,1MVNU@1224|Proteobacteria,2TRD9@28211|Alphaproteobacteria,2K042@204457|Sphingomonadales	204457|Sphingomonadales	J	GO:0000154,GO:0000179,GO:0001510,GO:0003674,GO:0003676,GO:0003723,GO:0003824,GO:0005488,GO:0005575,GO:0005622,GO:0005623,GO:0005737,GO:0006139,GO:0006364,GO:0006396,GO:0006725,GO:0006807,GO:0008150,GO:0008152,GO:0008168,GO:0008170,GO:0008173,GO:0008649,GO:0008757,GO:0008988,GO:0009451,GO:0009987,GO:0010467,GO:0016070,GO:0016072,GO:0016433,GO:0016740,GO:0016741,GO:0022613,GO:0031167,GO:0032259,GO:0034470,GO:0034641,GO:0034660,GO:0042254,GO:0043170,GO:0043412,GO:0043414,GO:0044085,GO:0044237,GO:0044238,GO:0044260,GO:0044424,GO:0044464,GO:0046483,GO:0052908,GO:0071704,GO:0071840,GO:0090304,GO:0097159,GO:0140098,GO:0140102,GO:1901360,GO:1901363	Specifically dimethylates two adjacent adenosines (A1518 and A1519) in the loop of a conserved hairpin near the 3'-end of 16S rRNA in the 30S particle. May play a critical role in biogenesis of 30S subunits	GO:0003723,GO:0000179
UniRef90_A0A526ZRA3	56.8182	88	3	UniRef90_A0A526ZRA3 Dihydroorotase (Fragment) n=1 Tax=Mesorhizobium sp. TaxID=1871066 RepID=A0A526ZRA3_9RHIZ	2TSQH	COG0044@1|root,COG0044@2|Bacteria,1MW10@1224|Proteobacteria,2TSQH@28211|Alphaproteobacteria,43GPJ@69277|Phyllobacteriaceae	28211|Alphaproteobacteria	F	-	COG0044 Dihydroorotase and related cyclic amidohydrolases	GO:0004151
UniRef90_A0A527MWI4	71.4286	70	1	UniRef90_A0A527MWI4 HTH domain-containing protein (Fragment) n=1 Tax=Mesorhizobium sp. TaxID=1871066 RepID=A0A527MWI4_9RHIZ	-	-	-	-	-	-	-
UniRef90_A0A527XMZ3	52.6316	95	2	UniRef90_A0A527XMZ3 Urea ABC transporter permease subunit UrtC (Fragment) n=1 Tax=Mesorhizobium sp. TaxID=1871066 RepID=A0A527XMZ3_9RHIZ	2TTN2	COG4177@1|root,COG4177@2|Bacteria,1MUPI@1224|Proteobacteria,2TTN2@28211|Alphaproteobacteria,43JG2@69277|Phyllobacteriaceae	28211|Alphaproteobacteria	E	-	Belongs to the binding-protein-dependent transport system permease family	GO:0016021,GO:0005886,GO:0015658
UniRef90_A0A528G3H1	51.5464	97	1	UniRef90_A0A528G3H1 Carbohydrate ABC transporter permease (Fragment) n=1 Tax=Mesorhizobium sp. TaxID=1871066 RepID=A0A528G3H1_9RHIZ	-	-	-	-	-	-	GO:0016021,GO:0005886,GO:0055085
UniRef90_A0A528NUK6	73.5294	68	2	UniRef90_A0A528NUK6 Glu_syn_central domain-containing protein (Fragment) n=1 Tax=Mesorhizobium sp. TaxID=1871066 RepID=A0A528NUK6_9RHIZ	2TRHQ	COG0067@1|root,COG0069@1|root,COG0070@1|root,COG0067@2|Bacteria,COG0069@2|Bacteria,COG0070@2|Bacteria,1MU7B@1224|Proteobacteria,2TRHQ@28211|Alphaproteobacteria,43HRW@69277|Phyllobacteriaceae	28211|Alphaproteobacteria	E	GO:0001505,GO:0003674,GO:0003824,GO:0004355,GO:0005488,GO:0005575,GO:0005622,GO:0005623,GO:0005737,GO:0006082,GO:0006520,GO:0006536,GO:0006537,GO:0006541,GO:0006807,GO:0008150,GO:0008152,GO:0008652,GO:0009058,GO:0009064,GO:0009084,GO:0009987,GO:0015930,GO:0016041,GO:0016053,GO:0016491,GO:0016638,GO:0016639,GO:0016643,GO:0017144,GO:0019676,GO:0019740,GO:0019752,GO:0042133,GO:0043167,GO:0043169,GO:0043436,GO:0043648,GO:0043650,GO:0044237,GO:0044238,GO:0044249,GO:0044281,GO:0044283,GO:0044424,GO:0044464,GO:0045181,GO:0046394,GO:0046872,GO:0048037,GO:0051536,GO:0051538,GO:0051540,GO:0055114,GO:0065007,GO:0065008,GO:0071704,GO:0097054,GO:1901564,GO:1901566,GO:1901576,GO:1901605,GO:1901607	glutamate synthase	GO:0015930,GO:0006807
UniRef90_A0A528W8G7	55.6818	88	1	UniRef90_A0A528W8G7 Dihydroorotase (Fragment) n=1 Tax=Mesorhizobium sp. TaxID=1871066 RepID=A0A528W8G7_9RHIZ	2TSQH	COG0044@1|root,COG0044@2|Bacteria,1MW10@1224|Proteobacteria,2TSQH@28211|Alphaproteobacteria,43GPJ@69277|Phyllobacteriaceae	28211|Alphaproteobacteria	F	-	COG0044 Dihydroorotase and related cyclic amidohydrolases	GO:0004151
UniRef90_A0A529LA64	59.7561	82	2	UniRef90_A0A529LA64 Alpha-hydroxy-acid oxidizing protein (Fragment) n=1 Tax=Mesorhizobium sp. TaxID=1871066 RepID=A0A529LA64_9RHIZ	2TQNW	COG1304@1|root,COG1304@2|Bacteria,1MUEZ@1224|Proteobacteria,2TQNW@28211|Alphaproteobacteria,43HSZ@69277|Phyllobacteriaceae	28211|Alphaproteobacteria	C	GO:0000166,GO:0002218,GO:0002253,GO:0002376,GO:0002682,GO:0002684,GO:0003674,GO:0003824,GO:0003973,GO:0004457,GO:0005488,GO:0005575,GO:0005622,GO:0005623,GO:0005737,GO:0005777,GO:0005886,GO:0006082,GO:0006089,GO:0006950,GO:0006952,GO:0007154,GO:0007165,GO:0008150,GO:0008152,GO:0009058,GO:0009605,GO:0009607,GO:0009617,GO:0009853,GO:0009854,GO:0009987,GO:0010181,GO:0010204,GO:0016020,GO:0016491,GO:0016614,GO:0016899,GO:0016999,GO:0017000,GO:0017144,GO:0019752,GO:0023052,GO:0031347,GO:0031349,GO:0032553,GO:0032787,GO:0036094,GO:0042579,GO:0042742,GO:0042743,GO:0043094,GO:0043167,GO:0043168,GO:0043207,GO:0043226,GO:0043227,GO:0043229,GO:0043231,GO:0043436,GO:0044237,GO:0044249,GO:0044281,GO:0044424,GO:0044444,GO:0044464,GO:0045088,GO:0045089,GO:0048037,GO:0048518,GO:0048583,GO:0048584,GO:0050662,GO:0050665,GO:0050776,GO:0050778,GO:0050789,GO:0050794,GO:0050896,GO:0051186,GO:0051188,GO:0051704,GO:0051707,GO:0051716,GO:0052852,GO:0052853,GO:0052854,GO:0055114,GO:0065007,GO:0071704,GO:0071944,GO:0072593,GO:0080134,GO:0097159,GO:0097367,GO:0098542,GO:1901265,GO:1901363,GO:1901615,GO:1903409	COG1304 L-lactate dehydrogenase (FMN-dependent) and related alpha-hydroxy acid dehydrogenases	GO:0016491
UniRef90_A0A529NS77	65.9864	147	5	UniRef90_A0A529NS77 FAD-binding protein (Fragment) n=1 Tax=Mesorhizobium sp. TaxID=1871066 RepID=A0A529NS77_9RHIZ	2TSG6	COG0277@1|root,COG0277@2|Bacteria,1MU6Y@1224|Proteobacteria,2TSG6@28211|Alphaproteobacteria,43GWF@69277|Phyllobacteriaceae	28211|Alphaproteobacteria	C	-	Glycolate oxidase subunit	GO:0071949,GO:0016491
UniRef90_A0A530QGV0	87.9518	83	2	UniRef90_A0A530QGV0 Urea ABC transporter substrate-binding protein (Fragment) n=1 Tax=Mesorhizobium sp. TaxID=1871066 RepID=A0A530QGV0_9RHIZ	-	-	-	-	-	-	-
UniRef90_A0A533IUW6	76.4706	85	2	UniRef90_A0A533IUW6 Uncharacterized protein n=5 Tax=Staphylococcus TaxID=1279 RepID=A0A533IUW6_STAHO	-	-	-	-	-	-	GO:0016021
UniRef90_A0A536XXP1	92	50	2	UniRef90_A0A536XXP1 Methylated-DNA--[protein]-cysteine S-methyltransferase (Fragment) n=1 Tax=Betaproteobacteria bacterium TaxID=1891241 RepID=A0A536XXP1_9PROT	2TQRX	COG0350@1|root,COG2169@1|root,COG0350@2|Bacteria,COG2169@2|Bacteria,1N2YQ@1224|Proteobacteria,2TQRX@28211|Alphaproteobacteria,4BMK5@82115|Rhizobiaceae	28211|Alphaproteobacteria	FL	-	Methyltransferase	GO:0003908,GO:0006281,GO:0032259
UniRef90_A0A538QU91	53.2609	92	2	UniRef90_A0A538QU91 Amidohydrolase (Fragment) n=1 Tax=Deltaproteobacteria bacterium TaxID=2026735 RepID=A0A538QU91_9DELT	-	-	-	-	-	-	GO:0016787
UniRef90_A0A558HBT8	93.5484	62	15	UniRef90_A0A558HBT8 Uncharacterized protein (Fragment) n=1 Tax=Vibrio tasmaniensis TaxID=212663 RepID=A0A558HBT8_9VIBR	-	-	-	-	-	-	-
UniRef90_A0A562QAV5	50.3546	141	7	UniRef90_A0A562QAV5 Sigma 54 modulation/S30EA-like ribosomal protein n=7 Tax=Pseudomonas TaxID=286 RepID=A0A562QAV5_9PSED	1SDXP	COG1544@1|root,COG1544@2|Bacteria,1N9T3@1224|Proteobacteria,1SDXP@1236|Gammaproteobacteria,1Z2U3@136846|Pseudomonas stutzeri group	1236|Gammaproteobacteria	J	-	Ribosomal subunit interface protein	-
UniRef90_A0A5C4L7X0	55.6818	88	3	UniRef90_A0A5C4L7X0 DNA recombinase n=2 Tax=unclassified Methylobacterium TaxID=2615210 RepID=A0A5C4L7X0_9RHIZ	2TRBJ	COG0582@1|root,COG0582@2|Bacteria,1MWGG@1224|Proteobacteria,2TRBJ@28211|Alphaproteobacteria,1JVK3@119045|Methylobacteriaceae	28211|Alphaproteobacteria	L	-	Belongs to the 'phage' integrase family	GO:0003677,GO:0015074,GO:0006310
UniRef90_A0A5C6XYZ6	50.505	198	4	UniRef90_A0A5C6XYZ6 Cytochrome c5 family protein (Fragment) n=2 Tax=unclassified Ralstonia TaxID=209769 RepID=A0A5C6XYZ6_9RALS	2VMBB	COG3245@1|root,COG3245@2|Bacteria,1MZBZ@1224|Proteobacteria,2VMBB@28216|Betaproteobacteria,1K3FB@119060|Burkholderiaceae	28216|Betaproteobacteria	C	-	Cytochrome c	GO:0016021,GO:0009055,GO:0020037,GO:0005506
UniRef90_A0A5C8U031	78.6885	61	3	UniRef90_A0A5C8U031 Uncharacterized protein n=1 Tax=Methylobacterium sp. WL9 TaxID=2603898 RepID=A0A5C8U031_9RHIZ	-	-	-	-	-	-	-
UniRef90_A0A5F8AKK8	55.6818	88	8	UniRef90_A0A5F8AKK8 Uncharacterized protein n=1 Tax=Macaca mulatta TaxID=9544 RepID=A0A5F8AKK8_MACMU	3CDE1	2F9WG@1|root,2TB2G@2759|Eukaryota,398VA@33154|Opisthokonta,3CDE1@33208|Metazoa,3DUR8@33213|Bilateria,48M5R@7711|Chordata,49I18@7742|Vertebrata	33208|Metazoa	S	-	Pfam:GVQW	-
UniRef90_A0A5J6LMQ9	70.7692	65	2	UniRef90_A0A5J6LMQ9 Uncharacterized protein n=1 Tax=Streptococcus sp. LPB0220 TaxID=2610896 RepID=A0A5J6LMQ9_9STRE	-	-	-	-	-	-	-
UniRef90_A0A5K7Y7T2	50	100	6	UniRef90_A0A5K7Y7T2 Uncharacterized protein n=1 Tax=Cobetia sp. AM6 TaxID=2661553 RepID=A0A5K7Y7T2_9GAMM	1XPMX	COG1216@1|root,COG1216@2|Bacteria,1MX5Z@1224|Proteobacteria,1RMDY@1236|Gammaproteobacteria,1XPMX@135619|Oceanospirillales	135619|Oceanospirillales	M	-	Glycosyl transferase, family 2	-
UniRef90_A0A5P8XF69	67.1329	143	6	UniRef90_A0A5P8XF69 Uncharacterized protein n=1 Tax=Delftia tsuruhatensis TaxID=180282 RepID=A0A5P8XF69_9BURK	-	-	-	-	-	-	-
UniRef90_A0A5R8M0S7	57.6471	85	4	UniRef90_A0A5R8M0S7 PDH_E1_M domain-containing protein (Fragment) n=1 Tax=Halomonas urmiana TaxID=490901 RepID=A0A5R8M0S7_9GAMM	1RN6K	COG2609@1|root,COG2609@2|Bacteria,1MV21@1224|Proteobacteria,1RN6K@1236|Gammaproteobacteria,1YWJ9@136845|Pseudomonas putida group	1236|Gammaproteobacteria	C	-	Component of the pyruvate dehydrogenase (PDH) complex, that catalyzes the overall conversion of pyruvate to acetyl-CoA and CO(2)	GO:0016491
UniRef90_A0A640MZ01	100	46	5	UniRef90_A0A640MZ01 Uncharacterized protein n=1 Tax=Bacillus anthracis TaxID=1392 RepID=A0A640MZ01_BACAN	-	-	-	-	-	-	-
UniRef90_A0A640MZY6	81.8182	44	2	UniRef90_A0A640MZY6 Uncharacterized protein n=1 Tax=Bacillus anthracis TaxID=1392 RepID=A0A640MZY6_BACAN	-	-	-	-	-	-	-
UniRef90_A0A653IJG3	67.8082	146	2	UniRef90_A0A653IJG3 Uncharacterized protein n=1 Tax=Micrococcus sp. 116 TaxID=2653154 RepID=A0A653IJG3_9MICC	-	-	-	-	-	-	-
UniRef90_A0A653LB16	86.2069	58	1	UniRef90_A0A653LB16 Uncharacterized protein n=1 Tax=Aeromonas veronii TaxID=654 RepID=A0A653LB16_9GAMM	1SF5Y	2E9J1@1|root,333RY@2|Bacteria,1NCU6@1224|Proteobacteria,1SF5Y@1236|Gammaproteobacteria,468B7@72275|Alteromonadaceae	1236|Gammaproteobacteria	-	-	-	-
UniRef90_A0A654BIR0	78.7879	66	2	UniRef90_A0A654BIR0 Uncharacterized protein n=1 Tax=Sphingomonas sp. T1 TaxID=2653172 RepID=A0A654BIR0_9SPHN	-	-	-	-	-	-	-
UniRef90_A0A654TSR9	55.5556	90	1	UniRef90_A0A654TSR9 Transposase for insertion sequence element IS1533 n=1 Tax=Mycobacterium tuberculosis TaxID=1773 RepID=A0A654TSR9_MYCTX	2HKD7	COG4584@1|root,COG4584@2|Bacteria,2HKD7@201174|Actinobacteria,233UB@1762|Mycobacteriaceae	201174|Actinobacteria	L	-	PFAM Integrase catalytic	-
UniRef90_A0A656ITX0	75	40	1	UniRef90_A0A656ITX0 Uncharacterized protein n=2 Tax=Chlamydia TaxID=810 RepID=A0A656ITX0_CHLPS	-	-	-	-	-	-	-
UniRef90_A0A657Q5I6	79.0323	62	8	UniRef90_A0A657Q5I6 Uncharacterized protein n=1 Tax=Propionibacterium sp. 4572_24 TaxID=1971622 RepID=A0A657Q5I6_9ACTN	-	-	-	-	-	-	-
UniRef90_A0A657ZWN7	59.0909	44	2	UniRef90_A0A657ZWN7 Beta-class phenol-soluble modulin n=2 Tax=Staphylococcus hominis TaxID=1290 RepID=A0A657ZWN7_STAHO	-	-	-	-	-	-	-
UniRef90_A0A660M6T8	76.5625	64	3	UniRef90_A0A660M6T8 Uncharacterized protein n=1 Tax=Candidatus Saccharimonas sp. TaxID=1917697 RepID=A0A660M6T8_9BACT	-	-	-	-	-	-	-
UniRef90_A0A673LDQ8	67.1233	73	1	UniRef90_A0A673LDQ8 Tubulin domain-containing protein n=1 Tax=Sinocyclocheilus rhinocerous TaxID=307959 RepID=A0A673LDQ8_9TELE	3BAUV	COG5023@1|root,KOG1376@2759|Eukaryota,38E06@33154|Opisthokonta,3BAUV@33208|Metazoa,3CRFN@33213|Bilateria,47ZHV@7711|Chordata,4901E@7742|Vertebrata,3J54Q@40674|Mammalia,35HUA@314146|Euarchontoglires,4Q6S0@9989|Rodentia	33208|Metazoa	Z	GO:0000166,GO:0001882,GO:0001883,GO:0001966,GO:0003008,GO:0003674,GO:0003824,GO:0003924,GO:0005198,GO:0005200,GO:0005488,GO:0005515,GO:0005525,GO:0005575,GO:0005622,GO:0005623,GO:0005737,GO:0005768,GO:0005856,GO:0005874,GO:0005881,GO:0006996,GO:0007010,GO:0007017,GO:0007600,GO:0007610,GO:0007638,GO:0008150,GO:0009581,GO:0009582,GO:0009605,GO:0009612,GO:0009628,GO:0009987,GO:0012505,GO:0015630,GO:0016020,GO:0016043,GO:0016462,GO:0016787,GO:0016817,GO:0016818,GO:0017076,GO:0017111,GO:0019001,GO:0019904,GO:0030424,GO:0031410,GO:0031644,GO:0031646,GO:0031982,GO:0032101,GO:0032103,GO:0032501,GO:0032549,GO:0032550,GO:0032553,GO:0032555,GO:0032561,GO:0032991,GO:0035639,GO:0035770,GO:0036094,GO:0036464,GO:0036477,GO:0040011,GO:0042330,GO:0042995,GO:0043005,GO:0043025,GO:0043167,GO:0043168,GO:0043209,GO:0043226,GO:0043227,GO:0043228,GO:0043229,GO:0043232,GO:0044057,GO:0044297,GO:0044422,GO:0044424,GO:0044425,GO:0044430,GO:0044444,GO:0044446,GO:0044464,GO:0045121,GO:0048518,GO:0048520,GO:0048583,GO:0048584,GO:0050789,GO:0050795,GO:0050877,GO:0050896,GO:0050906,GO:0050954,GO:0050974,GO:0050975,GO:0050976,GO:0050982,GO:0051239,GO:0051240,GO:0051606,GO:0051931,GO:0055037,GO:0065007,GO:0071840,GO:0097159,GO:0097367,GO:0097458,GO:0097708,GO:0098589,GO:0098805,GO:0098857,GO:0099080,GO:0099081,GO:0099512,GO:0099513,GO:0120025,GO:1901265,GO:1901363,GO:1905787,GO:1905789,GO:1905790,GO:1905792,GO:1990904	structural constituent of cytoskeleton	GO:0005737,GO:0005874,GO:0005525,GO:0005200,GO:0007017
UniRef90_A0A673ZGE4	72.449	98	2	UniRef90_A0A673ZGE4 DDE_3 domain-containing protein n=2 Tax=Salmoninae TaxID=504568 RepID=A0A673ZGE4_SALTR	-	-	-	-	-	-	-
