uniref90_ID	percent_cov	AA_length	unpaired_read_count	uniref90_desc	emapper_max_annot_OG	emapper_OG	emapper_max_annot_lvl	eggnog_cat	eggnog_GO	eggnog_desc	uniref90_GO
UniRef90_A0A023X066	51.1628	86	6	UniRef90_A0A023X066 Putative membrane protein n=2 Tax=Rubrobacter radiotolerans TaxID=42256 RepID=A0A023X066_9ACTN	-	-	-	-	-	-	GO:0016021,GO:0005886
UniRef90_A0A060BXF1	89.0909	55	2	UniRef90_A0A060BXF1 CAZy families GH13 protein (Fragment) n=1 Tax=uncultured Ketogulonicigenium sp. TaxID=543051 RepID=A0A060BXF1_9RHOB	-	-	-	-	-	-	GO:0003824,GO:0005975
UniRef90_A0A060VNE8	64	75	1	UniRef90_A0A060VNE8 Uncharacterized protein n=1 Tax=Oncorhynchus mykiss TaxID=8022 RepID=A0A060VNE8_ONCMY	3BTPZ	KOG1075@1|root,KOG1075@2759|Eukaryota,3A7X5@33154|Opisthokonta,3BTPZ@33208|Metazoa,3D9N3@33213|Bilateria,48H7G@7711|Chordata,49FFY@7742|Vertebrata,4A6MA@7898|Actinopterygii	33208|Metazoa	S	-	interleukin-8 biosynthetic process	-
UniRef90_A0A060VS97	82.963	135	6	UniRef90_A0A060VS97 Uncharacterized protein n=1 Tax=Oncorhynchus mykiss TaxID=8022 RepID=A0A060VS97_ONCMY	-	-	-	-	-	-	-
UniRef90_A0A060VUB7	52.1739	92	5	UniRef90_A0A060VUB7 Uncharacterized protein n=1 Tax=Oncorhynchus mykiss TaxID=8022 RepID=A0A060VUB7_ONCMY	-	-	-	-	-	-	-
UniRef90_A0A060VVK8	70	70	8	UniRef90_A0A060VVK8 HTH_Tnp_Tc3_2 domain-containing protein n=1 Tax=Oncorhynchus mykiss TaxID=8022 RepID=A0A060VVK8_ONCMY	3BIC8	28N8N@1|root,2QUTZ@2759|Eukaryota,39XUZ@33154|Opisthokonta,3BIC8@33208|Metazoa,3D1M8@33213|Bilateria,48DCS@7711|Chordata,49178@7742|Vertebrata,4A57R@7898|Actinopterygii	33208|Metazoa	S	-	-	GO:0003677,GO:0015074,GO:0006313
UniRef90_A0A060W2Q3	66.2162	74	8	UniRef90_A0A060W2Q3 Uncharacterized protein n=1 Tax=Oncorhynchus mykiss TaxID=8022 RepID=A0A060W2Q3_ONCMY	-	-	-	-	-	-	-
UniRef90_A0A060WBW3	64.4737	76	1	UniRef90_A0A060WBW3 Uncharacterized protein n=1 Tax=Oncorhynchus mykiss TaxID=8022 RepID=A0A060WBW3_ONCMY	-	-	-	-	-	-	-
UniRef90_A0A060WG64	50	212	13	UniRef90_A0A060WG64 Uncharacterized protein n=1 Tax=Oncorhynchus mykiss TaxID=8022 RepID=A0A060WG64_ONCMY	-	-	-	-	-	-	-
UniRef90_A0A060WGN2	79.6681	241	29	UniRef90_A0A060WGN2 Uncharacterized protein n=1 Tax=Oncorhynchus mykiss TaxID=8022 RepID=A0A060WGN2_ONCMY	-	-	-	-	-	-	-
UniRef90_A0A060WKM9	66.1972	71	1	UniRef90_A0A060WKM9 DDE_3 domain-containing protein n=1 Tax=Oncorhynchus mykiss TaxID=8022 RepID=A0A060WKM9_ONCMY	-	-	-	-	-	-	GO:0003676
UniRef90_A0A060WMZ5	55.0847	118	6	UniRef90_A0A060WMZ5 HTH_Tnp_Tc3_2 domain-containing protein n=1 Tax=Oncorhynchus mykiss TaxID=8022 RepID=A0A060WMZ5_ONCMY	-	-	-	-	-	-	GO:0003677,GO:0015074,GO:0006313
UniRef90_A0A060WN58	84.3137	102	13	UniRef90_A0A060WN58 Reverse transcriptase domain-containing protein n=1 Tax=Oncorhynchus mykiss TaxID=8022 RepID=A0A060WN58_ONCMY	-	-	-	-	-	-	-
UniRef90_A0A060WPE0	56.8627	102	7	UniRef90_A0A060WPE0 Uncharacterized protein n=1 Tax=Oncorhynchus mykiss TaxID=8022 RepID=A0A060WPE0_ONCMY	-	-	-	-	-	-	-
UniRef90_A0A060WRZ2	64.0625	128	9	UniRef90_A0A060WRZ2 Uncharacterized protein n=1 Tax=Oncorhynchus mykiss TaxID=8022 RepID=A0A060WRZ2_ONCMY	-	-	-	-	-	-	-
UniRef90_A0A060WU27	50	110	9	UniRef90_A0A060WU27 Uncharacterized protein n=1 Tax=Oncorhynchus mykiss TaxID=8022 RepID=A0A060WU27_ONCMY	-	-	-	-	-	-	GO:0016021
UniRef90_A0A060WUQ9	52.2727	88	3	UniRef90_A0A060WUQ9 Uncharacterized protein n=1 Tax=Oncorhynchus mykiss TaxID=8022 RepID=A0A060WUQ9_ONCMY	-	-	-	-	-	-	-
UniRef90_A0A060WX12	100	90	32	UniRef90_A0A060WX12 Paired domain-containing protein n=1 Tax=Oncorhynchus mykiss TaxID=8022 RepID=A0A060WX12_ONCMY	-	-	-	-	-	-	GO:0003677,GO:0006355
UniRef90_A0A060WXJ8	55.3073	179	6	UniRef90_A0A060WXJ8 Uncharacterized protein n=1 Tax=Oncorhynchus mykiss TaxID=8022 RepID=A0A060WXJ8_ONCMY	-	-	-	-	-	-	-
UniRef90_A0A060X2W5	79.3651	63	4	UniRef90_A0A060X2W5 Uncharacterized protein n=1 Tax=Oncorhynchus mykiss TaxID=8022 RepID=A0A060X2W5_ONCMY	-	-	-	-	-	-	-
UniRef90_A0A060X741	52.349	149	4	UniRef90_A0A060X741 Uncharacterized protein n=1 Tax=Oncorhynchus mykiss TaxID=8022 RepID=A0A060X741_ONCMY	-	-	-	-	-	-	GO:0016021
UniRef90_A0A060X9J5	53.1792	173	2	UniRef90_A0A060X9J5 DDE_3 domain-containing protein n=1 Tax=Oncorhynchus mykiss TaxID=8022 RepID=A0A060X9J5_ONCMY	-	-	-	-	-	-	GO:0003676
UniRef90_A0A060XBZ1	74.2424	66	2	UniRef90_A0A060XBZ1 Uncharacterized protein n=1 Tax=Oncorhynchus mykiss TaxID=8022 RepID=A0A060XBZ1_ONCMY	-	-	-	-	-	-	-
UniRef90_A0A060XCG8	59.854	137	3	UniRef90_A0A060XCG8 Reverse transcriptase domain-containing protein n=1 Tax=Oncorhynchus mykiss TaxID=8022 RepID=A0A060XCG8_ONCMY	-	-	-	-	-	-	-
UniRef90_A0A060XCK9	57.2727	110	35	UniRef90_A0A060XCK9 Uncharacterized protein n=1 Tax=Oncorhynchus mykiss TaxID=8022 RepID=A0A060XCK9_ONCMY	-	-	-	-	-	-	-
UniRef90_A0A060XG15	59.5238	84	1	UniRef90_A0A060XG15 Uncharacterized protein (Fragment) n=1 Tax=Oncorhynchus mykiss TaxID=8022 RepID=A0A060XG15_ONCMY	-	-	-	-	-	-	GO:0003676
UniRef90_A0A060XGI4	78.3333	60	5	UniRef90_A0A060XGI4 DDE_3 domain-containing protein n=1 Tax=Oncorhynchus mykiss TaxID=8022 RepID=A0A060XGI4_ONCMY	-	-	-	-	-	-	GO:0003676
UniRef90_A0A060XHZ3	67.5926	108	34	UniRef90_A0A060XHZ3 Uncharacterized protein n=1 Tax=Oncorhynchus mykiss TaxID=8022 RepID=A0A060XHZ3_ONCMY	-	-	-	-	-	-	-
UniRef90_A0A060XIV8	61.5942	138	17	UniRef90_A0A060XIV8 Uncharacterized protein n=1 Tax=Oncorhynchus mykiss TaxID=8022 RepID=A0A060XIV8_ONCMY	-	-	-	-	-	-	-
UniRef90_A0A060XJH1	64.2202	109	18	UniRef90_A0A060XJH1 DUF1891 domain-containing protein n=1 Tax=Oncorhynchus mykiss TaxID=8022 RepID=A0A060XJH1_ONCMY	-	-	-	-	-	-	GO:0016706,GO:0008168
UniRef90_A0A060XL02	52.1739	92	1	UniRef90_A0A060XL02 DDE_3 domain-containing protein n=1 Tax=Oncorhynchus mykiss TaxID=8022 RepID=A0A060XL02_ONCMY	3BIC8	28N8N@1|root,2QUTZ@2759|Eukaryota,39XUZ@33154|Opisthokonta,3BIC8@33208|Metazoa,3D1M8@33213|Bilateria,48DCS@7711|Chordata,49AIX@7742|Vertebrata	33208|Metazoa	S	-	-	GO:0003676
UniRef90_A0A060XR56	68.4211	95	12	UniRef90_A0A060XR56 Uncharacterized protein n=1 Tax=Oncorhynchus mykiss TaxID=8022 RepID=A0A060XR56_ONCMY	-	-	-	-	-	-	-
UniRef90_A0A060XXA6	57.2581	124	6	UniRef90_A0A060XXA6 Uncharacterized protein n=1 Tax=Oncorhynchus mykiss TaxID=8022 RepID=A0A060XXA6_ONCMY	-	-	-	-	-	-	-
UniRef90_A0A060XYE4	79.5455	132	5	UniRef90_A0A060XYE4 Uncharacterized protein n=1 Tax=Oncorhynchus mykiss TaxID=8022 RepID=A0A060XYE4_ONCMY	3BTPZ	KOG1075@1|root,KOG1075@2759|Eukaryota,3A7X5@33154|Opisthokonta,3BTPZ@33208|Metazoa,3D9N3@33213|Bilateria,48H7G@7711|Chordata,49FFY@7742|Vertebrata,4A6MA@7898|Actinopterygii	33208|Metazoa	S	-	interleukin-8 biosynthetic process	-
UniRef90_A0A060Y4Q3	62.7451	153	3	UniRef90_A0A060Y4Q3 Reverse transcriptase domain-containing protein n=1 Tax=Oncorhynchus mykiss TaxID=8022 RepID=A0A060Y4Q3_ONCMY	-	-	-	-	-	-	-
UniRef90_A0A060Y553	51	100	2	UniRef90_A0A060Y553 Reverse transcriptase domain-containing protein n=1 Tax=Oncorhynchus mykiss TaxID=8022 RepID=A0A060Y553_ONCMY	-	-	-	-	-	-	-
UniRef90_A0A060YCA1	67.619	210	4	UniRef90_A0A060YCA1 Reverse transcriptase domain-containing protein n=1 Tax=Oncorhynchus mykiss TaxID=8022 RepID=A0A060YCA1_ONCMY	-	-	-	-	-	-	-
UniRef90_A0A060YDE1	52.8736	87	4	UniRef90_A0A060YDE1 Uncharacterized protein n=1 Tax=Oncorhynchus mykiss TaxID=8022 RepID=A0A060YDE1_ONCMY	-	-	-	-	-	-	-
UniRef90_A0A060YEG3	54.4444	90	8	UniRef90_A0A060YEG3 Uncharacterized protein n=1 Tax=Oncorhynchus mykiss TaxID=8022 RepID=A0A060YEG3_ONCMY	-	-	-	-	-	-	-
UniRef90_A0A060YFA5	67.9245	212	9	UniRef90_A0A060YFA5 Uncharacterized protein n=1 Tax=Oncorhynchus mykiss TaxID=8022 RepID=A0A060YFA5_ONCMY	-	-	-	-	-	-	-
UniRef90_A0A060YJC4	53.4091	88	1	UniRef90_A0A060YJC4 HTH_Tnp_Tc3_2 domain-containing protein n=1 Tax=Oncorhynchus mykiss TaxID=8022 RepID=A0A060YJC4_ONCMY	-	-	-	-	-	-	GO:0003677,GO:0015074,GO:0006313
UniRef90_A0A060YKR2	64.9682	157	28	UniRef90_A0A060YKR2 Reverse transcriptase domain-containing protein n=1 Tax=Oncorhynchus mykiss TaxID=8022 RepID=A0A060YKR2_ONCMY	-	-	-	-	-	-	-
UniRef90_A0A060YNZ3	60.3604	111	10	UniRef90_A0A060YNZ3 Uncharacterized protein (Fragment) n=1 Tax=Oncorhynchus mykiss TaxID=8022 RepID=A0A060YNZ3_ONCMY	-	-	-	-	-	-	-
UniRef90_A0A060YUK6	51.9531	256	4	UniRef90_A0A060YUK6 Reverse transcriptase domain-containing protein n=1 Tax=Oncorhynchus mykiss TaxID=8022 RepID=A0A060YUK6_ONCMY	3BA5H	COG2801@1|root,KOG0017@2759|Eukaryota,38F42@33154|Opisthokonta,3BA5H@33208|Metazoa,3E5BZ@33213|Bilateria,48QR2@7711|Chordata,49MAS@7742|Vertebrata,4A2QN@7898|Actinopterygii	33208|Metazoa	L	-	K02A2.6-like	-
UniRef90_A0A060YVE4	69.2308	104	3	UniRef90_A0A060YVE4 Uncharacterized protein n=1 Tax=Oncorhynchus mykiss TaxID=8022 RepID=A0A060YVE4_ONCMY	3BIC8	28N8N@1|root,2QUTZ@2759|Eukaryota,39XUZ@33154|Opisthokonta,3BIC8@33208|Metazoa,3D1M8@33213|Bilateria,48DCS@7711|Chordata,49178@7742|Vertebrata,4A57R@7898|Actinopterygii	33208|Metazoa	S	-	-	GO:0003676
UniRef90_A0A060YVR0	62.3288	146	204	UniRef90_A0A060YVR0 Uncharacterized protein (Fragment) n=1 Tax=Oncorhynchus mykiss TaxID=8022 RepID=A0A060YVR0_ONCMY	-	-	-	-	-	-	-
UniRef90_A0A060YYL9	78.8235	85	8	UniRef90_A0A060YYL9 Uncharacterized protein n=2 Tax=Oncorhynchus mykiss TaxID=8022 RepID=A0A060YYL9_ONCMY	-	-	-	-	-	-	-
UniRef90_A0A060Z0D0	79.8387	124	4	UniRef90_A0A060Z0D0 Uncharacterized protein (Fragment) n=1 Tax=Oncorhynchus mykiss TaxID=8022 RepID=A0A060Z0D0_ONCMY	-	-	-	-	-	-	-
UniRef90_A0A060Z151	78.6885	61	5	UniRef90_A0A060Z151 Uncharacterized protein (Fragment) n=1 Tax=Oncorhynchus mykiss TaxID=8022 RepID=A0A060Z151_ONCMY	-	-	-	-	-	-	-
UniRef90_A0A060Z3Y7	52.3077	65	8	UniRef90_A0A060Z3Y7 Uncharacterized protein n=2 Tax=Oncorhynchus mykiss TaxID=8022 RepID=A0A060Z3Y7_ONCMY	-	-	-	-	-	-	-
UniRef90_A0A060Z436	51.8672	241	9	UniRef90_A0A060Z436 Integrase catalytic domain-containing protein n=1 Tax=Oncorhynchus mykiss TaxID=8022 RepID=A0A060Z436_ONCMY	3C2B0	COG2801@1|root,KOG0017@2759|Eukaryota,38F42@33154|Opisthokonta,3C2B0@33208|Metazoa,3E4PI@33213|Bilateria,48M6I@7711|Chordata,49I3R@7742|Vertebrata,4A97M@7898|Actinopterygii	33208|Metazoa	L	-	retrotransposable element Tf2 155 kDa protein type 1-like	GO:0003676,GO:0015074
UniRef90_A0A060Z4F9	63.871	155	8	UniRef90_A0A060Z4F9 Uncharacterized protein n=1 Tax=Oncorhynchus mykiss TaxID=8022 RepID=A0A060Z4F9_ONCMY	3BAW7	KOG2023@1|root,KOG2023@2759|Eukaryota,38DR7@33154|Opisthokonta,3BAW7@33208|Metazoa,3CSYC@33213|Bilateria,47ZTP@7711|Chordata,493JR@7742|Vertebrata,3J7TM@40674|Mammalia,35984@314146|Euarchontoglires,4PTT3@9989|Rodentia	33208|Metazoa	UY	GO:0000060,GO:0002164,GO:0002376,GO:0002520,GO:0003674,GO:0005048,GO:0005215,GO:0005488,GO:0005515,GO:0005575,GO:0005622,GO:0005623,GO:0005634,GO:0005635,GO:0005737,GO:0005829,GO:0005929,GO:0006606,GO:0006607,GO:0006610,GO:0006810,GO:0006886,GO:0006913,GO:0006928,GO:0006996,GO:0007017,GO:0007018,GO:0007275,GO:0008104,GO:0008139,GO:0008150,GO:0008536,GO:0008565,GO:0009791,GO:0009894,GO:0009987,GO:0010468,GO:0010608,GO:0010970,GO:0012505,GO:0015031,GO:0015833,GO:0016020,GO:0016032,GO:0016043,GO:0017016,GO:0017038,GO:0019219,GO:0019222,GO:0019899,GO:0022607,GO:0030030,GO:0030031,GO:0030097,GO:0030705,GO:0031090,GO:0031267,GO:0031323,GO:0031329,GO:0031503,GO:0031965,GO:0031967,GO:0031974,GO:0031975,GO:0031981,GO:0032386,GO:0032501,GO:0032502,GO:0032879,GO:0032880,GO:0033036,GO:0033157,GO:0033218,GO:0033365,GO:0034399,GO:0034504,GO:0034613,GO:0035166,GO:0035167,GO:0035735,GO:0042073,GO:0042277,GO:0042306,GO:0042886,GO:0042995,GO:0043226,GO:0043227,GO:0043229,GO:0043231,GO:0043233,GO:0043487,GO:0043488,GO:0044085,GO:0044403,GO:0044419,GO:0044422,GO:0044424,GO:0044428,GO:0044444,GO:0044446,GO:0044464,GO:0044782,GO:0045184,GO:0046822,GO:0046907,GO:0048513,GO:0048534,GO:0048542,GO:0048569,GO:0048731,GO:0048732,GO:0048856,GO:0050789,GO:0050794,GO:0051020,GO:0051049,GO:0051169,GO:0051170,GO:0051171,GO:0051179,GO:0051223,GO:0051234,GO:0051252,GO:0051641,GO:0051649,GO:0051704,GO:0060255,GO:0060271,GO:0060341,GO:0061013,GO:0065007,GO:0065008,GO:0070013,GO:0070201,GO:0070727,GO:0070925,GO:0071702,GO:0071705,GO:0071840,GO:0072594,GO:0080090,GO:0090087,GO:0099111,GO:0120025,GO:0120031,GO:0120036,GO:1900180,GO:1903311,GO:1903827,GO:1904589	ribosomal protein import into nucleus	GO:0005737,GO:0006606
UniRef90_A0A060Z4M6	52.2727	176	2	UniRef90_A0A060Z4M6 Uncharacterized protein (Fragment) n=1 Tax=Oncorhynchus mykiss TaxID=8022 RepID=A0A060Z4M6_ONCMY	-	-	-	-	-	-	-
UniRef90_A0A060Z4X6	68.4564	149	6	UniRef90_A0A060Z4X6 HTH_Tnp_Tc3_2 domain-containing protein n=1 Tax=Oncorhynchus mykiss TaxID=8022 RepID=A0A060Z4X6_ONCMY	3CDFG	2CUQ3@1|root,2RNM8@2759|Eukaryota,3999Y@33154|Opisthokonta,3CDFG@33208|Metazoa,3DUSZ@33213|Bilateria,48N25@7711|Chordata,49J1B@7742|Vertebrata,4A85X@7898|Actinopterygii	33208|Metazoa	S	-	Transposase	GO:0003677,GO:0015074,GO:0006313
UniRef90_A0A060Z6N5	73.5849	106	9	UniRef90_A0A060Z6N5 Uncharacterized protein (Fragment) n=1 Tax=Oncorhynchus mykiss TaxID=8022 RepID=A0A060Z6N5_ONCMY	-	-	-	-	-	-	-
UniRef90_A0A060Z6X3	50.4854	206	6	UniRef90_A0A060Z6X3 HTH_Tnp_Tc3_2 domain-containing protein n=1 Tax=Oncorhynchus mykiss TaxID=8022 RepID=A0A060Z6X3_ONCMY	3CDFG	2CUQ3@1|root,2RNM8@2759|Eukaryota,3999Y@33154|Opisthokonta,3CDFG@33208|Metazoa,3DUSZ@33213|Bilateria,48N25@7711|Chordata,49J1B@7742|Vertebrata,4A85X@7898|Actinopterygii	33208|Metazoa	S	-	Transposase	GO:0003677,GO:0015074,GO:0006313
UniRef90_A0A060Z7D5	60.6742	89	2	UniRef90_A0A060Z7D5 Uncharacterized protein n=1 Tax=Oncorhynchus mykiss TaxID=8022 RepID=A0A060Z7D5_ONCMY	-	-	-	-	-	-	GO:0016021,GO:0003676
UniRef90_A0A060Z8U5	76.6423	137	11	UniRef90_A0A060Z8U5 Uncharacterized protein (Fragment) n=1 Tax=Oncorhynchus mykiss TaxID=8022 RepID=A0A060Z8U5_ONCMY	-	-	-	-	-	-	-
UniRef90_A0A060Z9E0	64.0523	153	11	UniRef90_A0A060Z9E0 Uncharacterized protein n=2 Tax=Oncorhynchus mykiss TaxID=8022 RepID=A0A060Z9E0_ONCMY	-	-	-	-	-	-	-
UniRef90_A0A060Z9T9	80.6452	62	7	UniRef90_A0A060Z9T9 Uncharacterized protein (Fragment) n=1 Tax=Oncorhynchus mykiss TaxID=8022 RepID=A0A060Z9T9_ONCMY	3BIC8	28N8N@1|root,2QUTZ@2759|Eukaryota,39XUZ@33154|Opisthokonta,3BIC8@33208|Metazoa,3D1M8@33213|Bilateria,48DCS@7711|Chordata,49178@7742|Vertebrata,4A57R@7898|Actinopterygii	33208|Metazoa	S	-	-	-
UniRef90_A0A060ZAX3	72.9167	96	3	UniRef90_A0A060ZAX3 DDE_3 domain-containing protein (Fragment) n=1 Tax=Oncorhynchus mykiss TaxID=8022 RepID=A0A060ZAX3_ONCMY	-	-	-	-	-	-	GO:0003676
UniRef90_A0A060ZC67	93.3333	60	5	UniRef90_A0A060ZC67 Uncharacterized protein n=1 Tax=Oncorhynchus mykiss TaxID=8022 RepID=A0A060ZC67_ONCMY	-	-	-	-	-	-	GO:0003676
UniRef90_A0A060ZDY4	52.657	207	12	UniRef90_A0A060ZDY4 Uncharacterized protein n=1 Tax=Oncorhynchus mykiss TaxID=8022 RepID=A0A060ZDY4_ONCMY	-	-	-	-	-	-	-
UniRef90_A0A060ZEG0	71.2329	219	23	UniRef90_A0A060ZEG0 zf-RVT domain-containing protein (Fragment) n=1 Tax=Oncorhynchus mykiss TaxID=8022 RepID=A0A060ZEG0_ONCMY	-	-	-	-	-	-	-
UniRef90_A0A060ZFS7	64.3836	73	1	UniRef90_A0A060ZFS7 Uncharacterized protein n=1 Tax=Oncorhynchus mykiss TaxID=8022 RepID=A0A060ZFS7_ONCMY	-	-	-	-	-	-	-
UniRef90_A0A060ZV32	73.2759	116	27	UniRef90_A0A060ZV32 Uncharacterized protein (Fragment) n=1 Tax=Oncorhynchus mykiss TaxID=8022 RepID=A0A060ZV32_ONCMY	-	-	-	-	-	-	-
UniRef90_A0A061A636	62.069	87	5	UniRef90_A0A061A636 Reverse transcriptase domain-containing protein (Fragment) n=1 Tax=Oncorhynchus mykiss TaxID=8022 RepID=A0A061A636_ONCMY	-	-	-	-	-	-	-
UniRef90_A0A067GRY6	55.3846	65	3	UniRef90_A0A067GRY6 Uncharacterized protein (Fragment) n=1 Tax=Citrus sinensis TaxID=2711 RepID=A0A067GRY6_CITSI	37PTM	COG1100@1|root,KOG0070@2759|Eukaryota,37PTM@33090|Viridiplantae	33090|Viridiplantae	U	-	Belongs to the small GTPase superfamily. Arf family	GO:0005525,GO:0003924,GO:0006886,GO:0016192
UniRef90_A0A067SIS7	63.6364	77	3	UniRef90_A0A067SIS7 Uncharacterized protein (Fragment) n=1 Tax=Galerina marginata (strain CBS 339.88) TaxID=685588 RepID=A0A067SIS7_GALM3	3NXRR	KOG0078@1|root,KOG0078@2759|Eukaryota,38GT3@33154|Opisthokonta,3NXRR@4751|Fungi,3UZ7S@5204|Basidiomycota,224P9@155619|Agaricomycetes,3H1HF@355688|Agaricomycetes incertae sedis	4751|Fungi	U	GO:0000003,GO:0000131,GO:0000166,GO:0000910,GO:0001411,GO:0001882,GO:0001883,GO:0002790,GO:0003006,GO:0003674,GO:0003824,GO:0003924,GO:0005488,GO:0005525,GO:0005575,GO:0005622,GO:0005623,GO:0005628,GO:0005737,GO:0005739,GO:0005740,GO:0005741,GO:0005768,GO:0005783,GO:0005815,GO:0005816,GO:0005856,GO:0005886,GO:0005933,GO:0005934,GO:0005935,GO:0005937,GO:0006810,GO:0006886,GO:0006887,GO:0006892,GO:0006893,GO:0006903,GO:0006904,GO:0006906,GO:0006914,GO:0006996,GO:0007049,GO:0007107,GO:0008104,GO:0008150,GO:0008152,GO:0009056,GO:0009306,GO:0009653,GO:0009987,GO:0010927,GO:0012505,GO:0012506,GO:0015031,GO:0015630,GO:0015833,GO:0016020,GO:0016043,GO:0016050,GO:0016192,GO:0016462,GO:0016787,GO:0016817,GO:0016818,GO:0017076,GO:0017111,GO:0017157,GO:0019001,GO:0019867,GO:0019953,GO:0022402,GO:0022406,GO:0022413,GO:0022414,GO:0022607,GO:0023052,GO:0030133,GO:0030154,GO:0030427,GO:0030435,GO:0030437,GO:0030658,GO:0030659,GO:0031090,GO:0031321,GO:0031410,GO:0031521,GO:0031966,GO:0031967,GO:0031968,GO:0031975,GO:0031982,GO:0032502,GO:0032505,GO:0032506,GO:0032549,GO:0032550,GO:0032553,GO:0032555,GO:0032561,GO:0032879,GO:0032940,GO:0032989,GO:0032991,GO:0033036,GO:0034293,GO:0034613,GO:0035639,GO:0035690,GO:0035974,GO:0036094,GO:0042221,GO:0042493,GO:0042763,GO:0042764,GO:0042886,GO:0042995,GO:0043167,GO:0043168,GO:0043226,GO:0043227,GO:0043228,GO:0043229,GO:0043231,GO:0043232,GO:0043332,GO:0043934,GO:0043935,GO:0044085,GO:0044237,GO:0044248,GO:0044422,GO:0044424,GO:0044429,GO:0044430,GO:0044433,GO:0044444,GO:0044446,GO:0044463,GO:0044464,GO:0044703,GO:0045184,GO:0046903,GO:0046907,GO:0048193,GO:0048278,GO:0048284,GO:0048468,GO:0048646,GO:0048856,GO:0048869,GO:0050789,GO:0050794,GO:0050896,GO:0051046,GO:0051049,GO:0051179,GO:0051234,GO:0051286,GO:0051301,GO:0051321,GO:0051640,GO:0051641,GO:0051648,GO:0051649,GO:0051650,GO:0051656,GO:0051704,GO:0051716,GO:0060627,GO:0061024,GO:0061025,GO:0061919,GO:0065007,GO:0070727,GO:0070887,GO:0071702,GO:0071705,GO:0071840,GO:0071944,GO:0072657,GO:0072659,GO:0090174,GO:0097159,GO:0097367,GO:0097708,GO:0098588,GO:0098805,GO:0098876,GO:0120025,GO:0120038,GO:0140029,GO:0140056,GO:1901265,GO:1901363,GO:1903046,GO:1903530,GO:1990778	GTP-binding protein	GO:0005525,GO:0003924
UniRef90_A0A069XDS2	96	50	1	UniRef90_A0A069XDS2 Uncharacterized protein n=9 Tax=Escherichia coli TaxID=562 RepID=A0A069XDS2_ECOLX	-	-	-	-	-	-	-
UniRef90_A0A080NPJ4	60.4478	134	2	UniRef90_A0A080NPJ4 Uncharacterized protein n=4 Tax=Delftia TaxID=80865 RepID=A0A080NPJ4_DELAC	2WHRI	COG2165@1|root,COG2165@2|Bacteria,1N631@1224|Proteobacteria,2WHRI@28216|Betaproteobacteria,4AFA0@80864|Comamonadaceae	28216|Betaproteobacteria	U	-	Prokaryotic N-terminal methylation motif	GO:0016021
UniRef90_A0A085B3R4	51.4563	103	10	UniRef90_A0A085B3R4 Uncharacterized protein n=1 Tax=Cutibacterium acnes HL201PA1 TaxID=1271528 RepID=A0A085B3R4_CUTAC	-	-	-	-	-	-	-
UniRef90_A0A085TW82	52.6316	95	4	UniRef90_A0A085TW82 10 kDa chaperonin n=5 Tax=Rhodobacteraceae TaxID=31989 RepID=A0A085TW82_9RHOB	2U9AQ	COG0234@1|root,COG0234@2|Bacteria,1MZ2X@1224|Proteobacteria,2U9AQ@28211|Alphaproteobacteria,2XNJM@285107|Thioclava	28211|Alphaproteobacteria	O	GO:0000166,GO:0003674,GO:0005488,GO:0005524,GO:0005575,GO:0005622,GO:0005623,GO:0005737,GO:0006457,GO:0008144,GO:0008150,GO:0009987,GO:0017076,GO:0030554,GO:0032553,GO:0032555,GO:0032559,GO:0035639,GO:0036094,GO:0043167,GO:0043168,GO:0044424,GO:0044464,GO:0097159,GO:0097367,GO:1901265,GO:1901363	Binds to Cpn60 in the presence of Mg-ATP and suppresses the ATPase activity of the latter	GO:0005737,GO:0005524,GO:0006457
UniRef90_A0A086AHW4	61.1111	72	2	UniRef90_A0A086AHW4 Uncharacterized protein n=3 Tax=Flavobacterium TaxID=237 RepID=A0A086AHW4_FLAHY	4NVP8	2E8F7@1|root,332TJ@2|Bacteria,4NVP8@976|Bacteroidetes,1I5NX@117743|Flavobacteriia	976|Bacteroidetes	-	-	-	-
UniRef90_A0A090IPL7	60	120	12	UniRef90_A0A090IPL7 50S ribosomal protein L18 n=4 Tax=Bacillus TaxID=1386 RepID=A0A090IPL7_9BACI	4HIGF	COG0256@1|root,COG0256@2|Bacteria,1V6DM@1239|Firmicutes,4HIGF@91061|Bacilli,1ZG7C@1386|Bacillus	91061|Bacilli	J	GO:0003674,GO:0003676,GO:0003723,GO:0003735,GO:0005198,GO:0005488,GO:0005575,GO:0005622,GO:0005623,GO:0005737,GO:0005829,GO:0005840,GO:0006139,GO:0006364,GO:0006396,GO:0006412,GO:0006518,GO:0006725,GO:0006807,GO:0008097,GO:0008150,GO:0008152,GO:0009058,GO:0009059,GO:0009987,GO:0010467,GO:0015934,GO:0016070,GO:0016072,GO:0019538,GO:0019843,GO:0022613,GO:0022625,GO:0022626,GO:0032991,GO:0034470,GO:0034641,GO:0034645,GO:0034660,GO:0042254,GO:0043043,GO:0043170,GO:0043226,GO:0043228,GO:0043229,GO:0043232,GO:0043603,GO:0043604,GO:0044085,GO:0044237,GO:0044238,GO:0044249,GO:0044260,GO:0044267,GO:0044271,GO:0044391,GO:0044422,GO:0044424,GO:0044444,GO:0044445,GO:0044446,GO:0044464,GO:0046483,GO:0071704,GO:0071840,GO:0090304,GO:0097159,GO:1901360,GO:1901363,GO:1901564,GO:1901566,GO:1901576,GO:1990904	This is one of the proteins that binds and probably mediates the attachment of the 5S RNA into the large ribosomal subunit, where it forms part of the central protuberance	GO:0005840,GO:0019843,GO:0003735,GO:0006412
UniRef90_A0A090KUV4	73.0159	63	1	UniRef90_A0A090KUV4 Uncharacterized protein n=4 Tax=Bacillus TaxID=1386 RepID=A0A090KUV4_9BACI	-	-	-	-	-	-	GO:0016021
UniRef90_A0A090S4F6	55.5556	81	2	UniRef90_A0A090S4F6 Elongation factor Ts n=1 Tax=Vibrio maritimus TaxID=990268 RepID=A0A090S4F6_9VIBR	-	-	-	-	-	-	GO:0005737,GO:0003746
UniRef90_A0A0A1VLP2	50.505	99	1	UniRef90_A0A0A1VLP2 Transposase (Fragment) n=2 Tax=Acidovorax sp. MR-S7 TaxID=1268622 RepID=A0A0A1VLP2_9BURK	2VI1H	COG3039@1|root,COG3039@2|Bacteria,1MVDK@1224|Proteobacteria,2VI1H@28216|Betaproteobacteria	28216|Betaproteobacteria	L	-	PFAM transposase, IS4 family protein	GO:0003677,GO:0004803,GO:0006313
UniRef90_A0A0A9ALW6	51.0204	98	1	UniRef90_A0A0A9ALW6 Uncharacterized protein n=1 Tax=Arundo donax TaxID=35708 RepID=A0A0A9ALW6_ARUDO	-	-	-	-	-	-	GO:0016021
UniRef90_A0A0A9DP02	60.9756	82	5	UniRef90_A0A0A9DP02 ATP-dependent RNA helicase DDX23 n=2 Tax=Arundo donax TaxID=35708 RepID=A0A0A9DP02_ARUDO	3GACH	COG0513@1|root,KOG0333@2759|Eukaryota,37HJW@33090|Viridiplantae,3GACH@35493|Streptophyta,3KMTZ@4447|Liliopsida,3IG15@38820|Poales	35493|Streptophyta	A	GO:0000166,GO:0000375,GO:0003674,GO:0003676,GO:0003723,GO:0003724,GO:0003824,GO:0004004,GO:0004386,GO:0005488,GO:0005524,GO:0005575,GO:0005622,GO:0005623,GO:0005634,GO:0005681,GO:0005682,GO:0005730,GO:0005737,GO:0006139,GO:0006396,GO:0006397,GO:0006725,GO:0006807,GO:0008026,GO:0008144,GO:0008150,GO:0008152,GO:0008186,GO:0008380,GO:0009987,GO:0010467,GO:0010501,GO:0016070,GO:0016071,GO:0016462,GO:0016787,GO:0016817,GO:0016818,GO:0016887,GO:0017076,GO:0017111,GO:0030532,GO:0030554,GO:0031974,GO:0031981,GO:0032553,GO:0032555,GO:0032559,GO:0032991,GO:0034641,GO:0035639,GO:0036094,GO:0042623,GO:0043167,GO:0043168,GO:0043170,GO:0043226,GO:0043227,GO:0043228,GO:0043229,GO:0043231,GO:0043232,GO:0043233,GO:0044237,GO:0044238,GO:0044422,GO:0044424,GO:0044428,GO:0044446,GO:0044464,GO:0046483,GO:0070013,GO:0070035,GO:0071013,GO:0071704,GO:0090304,GO:0097159,GO:0097367,GO:0097525,GO:0120114,GO:0140098,GO:1901265,GO:1901360,GO:1901363,GO:1902494,GO:1990904	Belongs to the DEAD box helicase family	GO:0004386
UniRef90_A0A0B1ZSK0	75.3846	65	7	UniRef90_A0A0B1ZSK0 zf-CHCC domain-containing protein n=4 Tax=Novosphingobium TaxID=165696 RepID=A0A0B1ZSK0_9SPHN	2K6U4	COG4391@1|root,COG4391@2|Bacteria,1N7F4@1224|Proteobacteria,2UHY4@28211|Alphaproteobacteria,2K6U4@204457|Sphingomonadales	204457|Sphingomonadales	S	-	protein conserved in bacteria	-
UniRef90_A0A0C1R522	56.9767	86	2	UniRef90_A0A0C1R522 Protein kinase domain-containing protein (Fragment) n=1 Tax=Tolypothrix bouteillei VB521301 TaxID=1479485 RepID=A0A0C1R522_9CYAN	-	-	-	-	-	-	GO:0005524,GO:0004672
UniRef90_A0A0C2RNV3	93.4959	123	14	UniRef90_A0A0C2RNV3 Reverse transcriptase domain-containing protein (Fragment) n=1 Tax=Pseudomonas stutzeri TaxID=316 RepID=A0A0C2RNV3_PSEST	-	-	-	-	-	-	-
UniRef90_A0A0C2S076	75.969	129	5	UniRef90_A0A0C2S076 DUF1891 domain-containing protein (Fragment) n=1 Tax=Pseudomonas stutzeri TaxID=316 RepID=A0A0C2S076_PSEST	-	-	-	-	-	-	GO:0016706,GO:0008168
UniRef90_A0A0C2XG95	88.0597	67	2	UniRef90_A0A0C2XG95 Uncharacterized protein n=1 Tax=Amanita muscaria Koide BX008 TaxID=946122 RepID=A0A0C2XG95_AMAMU	-	-	-	-	-	-	-
UniRef90_A0A0D0EGF4	62.0253	79	2	UniRef90_A0A0D0EGF4 Uncharacterized protein n=4 Tax=Bacillus TaxID=1386 RepID=A0A0D0EGF4_9BACI	-	-	-	-	-	-	-
UniRef90_A0A0D0EUE6	96.2264	53	2	UniRef90_A0A0D0EUE6 Uncharacterized protein n=1 Tax=Bacillus thermoamylovorans TaxID=35841 RepID=A0A0D0EUE6_9BACI	-	-	-	-	-	-	-
UniRef90_A0A0D0F0V5	56.9767	86	4	UniRef90_A0A0D0F0V5 Uncharacterized protein n=6 Tax=Bacillus TaxID=1386 RepID=A0A0D0F0V5_9BACI	-	-	-	-	-	-	-
UniRef90_A0A0D0FUP8	51.5464	97	2	UniRef90_A0A0D0FUP8 Uncharacterized protein n=2 Tax=Bacillus thermoamylovorans TaxID=35841 RepID=A0A0D0FUP8_9BACI	-	-	-	-	-	-	-
UniRef90_A0A0D0G914	70.4225	71	2	UniRef90_A0A0D0G914 Integrase catalytic domain-containing protein n=2 Tax=Bacillus TaxID=1386 RepID=A0A0D0G914_9BACI	-	-	-	-	-	-	GO:0003676,GO:0015074
UniRef90_A0A0D0GFP8	70.8895	371	26	UniRef90_A0A0D0GFP8 Transposase n=11 Tax=Bacillus TaxID=1386 RepID=A0A0D0GFP8_9BACI	4HAPR	COG0675@1|root,COG0675@2|Bacteria,1TT4J@1239|Firmicutes,4HAPR@91061|Bacilli	91061|Bacilli	L	-	transposase, IS605 OrfB family	GO:0003677,GO:0006310,GO:0032196
