other_OG	read_count_sum	RPK_sum	other_eggnog_cat	other_eggnog_desc	LIBID	feature_class
23SHU|Others	47	64.44105366863579	L	Part of the Rad50 Mre11 complex, which is involved in the early steps of DNA double-strand break (DSB) repair. The complex may facilitate opening of the processed DNA ends to aid in the recruitment of HerA and NurA. Mre11 binds to DSB ends and has both double-stranded 3'-5' exonuclease activity and single- stranded endonuclease activity	MHS521	other_OG
23SHW|Others	15	16.722408026755854	E	Removes the N-terminal methionine from nascent proteins. The N-terminal methionine is often cleaved when the second residue in the primary sequence is small and uncharged (Met-Ala-, Cys, Gly, Pro, Ser, Thr, or Val)	MHS521	other_OG
23SHX|Others	17	13.959296295177387	L	Involved in regulation of DNA replication	MHS521	other_OG
23SHZ|Others	60	42.7567601480645	M	Belongs to the UDP-glucose GDP-mannose dehydrogenase family	MHS521	other_OG
23SI0|Others	19	22.838047251729304	E	COG2171 Tetrahydrodipicolinate N-succinyltransferase	MHS521	other_OG
23SI1|Others	8	11.444921316165953	I	COG1028 Dehydrogenases with different specificities (related to short-chain alcohol dehydrogenases)	MHS521	other_OG
23SI2|Others	72	33.10344827586207	L	COG1199 Rad3-related DNA helicases	MHS521	other_OG
23SI5|Others	31	84.05448325059072	L	COG3415 Transposase and inactivated derivatives	MHS521	other_OG
23SI6|Others	27	25.139664804469273	E	Catalyzes the NAD(P)( )-dependent oxidation of D-glucose to D-gluconate via gluconolactone. Can utilize both NAD( ) and NADP( ) as electron acceptor. Is involved in the degradation of glucose through a modified Entner-Doudoroff pathway	MHS521	other_OG
23SI7|Others	11	11.282051282051283	S	dehydrogenases and related proteins	MHS521	other_OG
23SID|Others	5	5.827505827505828	H	1,4-dihydroxy-2-naphthoate octaprenyltransferase	MHS521	other_OG
23SIE|Others	33	29.805669192451695	E	Belongs to the DegT DnrJ EryC1 family	MHS521	other_OG
23SIF|Others	29	14.803471158754466	I	Belongs to the enoyl-CoA hydratase isomerase family	MHS521	other_OG
23SII|Others	37	17.619047619047617	L	ATPase involved in replication control, Cdc46 Mcm family	MHS521	other_OG
23SIK|Others	6	14.598540145985403	E	COG1003 Glycine cleavage system protein P (pyridoxal-binding), C-terminal domain	MHS521	other_OG
23SIN|Others	17	15.610651974288338	L	Relaxes both positive and negative superturns and exhibits a strong decatenase activity	MHS521	other_OG
23SIQ|Others	13	11.21961587077866	M	membrane-associated Zn-dependent proteases 1	MHS521	other_OG
23SIS|Others	28	19.69057665260197	C	COG1249 Pyruvate 2-oxoglutarate dehydrogenase complex, dihydrolipoamide dehydrogenase (E3) component, and related enzymes	MHS521	other_OG
23SIT|Others	1	4.566210045662101	S	COG1606 ATP-utilizing enzymes of the PP-loop superfamily	MHS521	other_OG
23SIV|Others	38	27.86559406502404	C	COG2141 Coenzyme F420-dependent N5,N10-methylene tetrahydromethanopterin reductase and related flavin-dependent oxidoreductases	MHS521	other_OG
23SIZ|Others	8	7.386888273314867	L	Regulatory subunit of DNA primase, an RNA polymerase that catalyzes the synthesis of short RNA molecules used as primers for DNA polymerase during DNA replication. Stabilizes and modulates the activity of the small subunit, increasing the rate of DNA synthesis, and conferring RNA synthesis capability. The DNA polymerase activity may enable DNA primase to also catalyze primer extension after primer synthesis. May also play a role in DNA repair	MHS521	other_OG
23SJ2|Others	6	4.728132387706856	S	PFAM NurA domain	MHS521	other_OG
23SJ3|Others	31	25.064257577831516	G	COG0477 Permeases of the major facilitator superfamily	MHS521	other_OG
23SJ6|Others	14	13.056246707249008	E	Serine-pyruvate aminotransferase archaeal aspartate aminotransferase	MHS521	other_OG
23SJ7|Others	63	27.361069104188367	L	DNA-dependent ATPase and 3'-5' DNA helicase that may be involved in repair of stalled replication forks	MHS521	other_OG
23SJ8|Others	18	15.789473684210527	I	COG1960 Acyl-CoA dehydrogenases	MHS521	other_OG
23SJ9|Others	5	5.787037037037037	P	PFAM cobalamin (vitamin B12) biosynthesis CbiX	MHS521	other_OG
23SJB|Others	48	36.97764218249844	-	-	MHS521	other_OG
23SJE|Others	42	35.97296694559452	L	DEAD DEAH box helicase	MHS521	other_OG
23SJF|Others	21	21.89235684443352	F	COG0788 Formyltetrahydrofolate hydrolase	MHS521	other_OG
23SJG|Others	17	24.381110059918008	L	Transposase, is605 orfb family	MHS521	other_OG
23SJH|Others	32	38.47287464308741	E	periplasmic protein kinase ArgK and related GTPases of G3E family	MHS521	other_OG
23SJI|Others	30	37.878787878787875	E	Catalyzes a transaldol reaction between 6-deoxy-5- ketofructose 1-phosphate (DKFP) and L-aspartate semialdehyde (ASA) with an elimination of hydroxypyruvaldehyde phosphate to yield 2- amino-3,7-dideoxy-D-threo-hept-6-ulosonate (ADH). Plays a key role in an alternative pathway of the biosynthesis of 3-dehydroquinate (DHQ), which is involved in the canonical pathway for the biosynthesis of aromatic amino acids	MHS521	other_OG
23SJK|Others	18	22.22222222222222	E	IGPS catalyzes the conversion of PRFAR and glutamine to IGP, AICAR and glutamate. The HisF subunit catalyzes the cyclization activity that produces IGP and AICAR from PRFAR using the ammonia provided by the HisH subunit	MHS521	other_OG
23SJN|Others	22	21.956087824351297	S	Alcohol dehydrogenase zinc-binding domain protein	MHS521	other_OG
23SJQ|Others	22	22.63374485596708	K	HTH-type transcriptional regulatory protein	MHS521	other_OG
23SJR|Others	18	15.615194110224106	E	COG0665 Glycine D-amino acid oxidases (deaminating)	MHS521	other_OG
23SJT|Others	9	16.055984104721833	S	Intracellular protease, PfpI family	MHS521	other_OG
23SJZ|Others	25	15.27931803161161	P	COG1226 Kef-type K transport systems	MHS521	other_OG
23SK1|Others	65	52.06621467748358	C	COG0281 Malic enzyme	MHS521	other_OG
23SK2|Others	16	16.016016016016017	-	-	MHS521	other_OG
23SK3|Others	36	31.5560818749899	I	COG1960 Acyl-CoA dehydrogenases	MHS521	other_OG
23SK6|Others	14	16.21980676328502	E	COG0520 Selenocysteine lyase	MHS521	other_OG
23SK9|Others	36	22.304832713754646	J	protein synthesis factor GTP-binding	MHS521	other_OG
23SKC|Others	14	23.333333333333336	P	Destroys radicals which are normally produced within the cells and which are toxic to biological systems	MHS521	other_OG
23SKE|Others	14	17.0316301703163	F	Uridine phosphorylase	MHS521	other_OG
23SKF|Others	2	7.246376811594202	S	COG2366 Protein related to penicillin acylase	MHS521	other_OG
23SKK|Others	22	14.5791915175613	E	Broad specificity carboxypetidase that releases amino acids sequentially from the C-terminus, including neutral, aromatic, polar and basic residues	MHS521	other_OG
23SKM|Others	35	20.33519958621816	H	Bacteriocin biosynthesis docking scaffold, SagD family	MHS521	other_OG
23SKP|Others	13	10.19607843137255	S	ATP-grasp protein-like protein	MHS521	other_OG
23SKQ|Others	58	39.92720325884794	V	COG0534 Na -driven multidrug efflux pump	MHS521	other_OG
23SKR|Others	34	34.65851172273191	C	COG0022 Pyruvate 2-oxoglutarate dehydrogenase complex, dehydrogenase (E1) component, eukaryotic type, beta subunit	MHS521	other_OG
23SKT|Others	9	11.857707509881422	S	homolog of PrgY (pheromone shutdown protein)	MHS521	other_OG
23SKW|Others	6	10.638297872340427	I	Isopentenyl-diphosphate delta-isomerase	MHS521	other_OG
23SKY|Others	14	13.93034825870647	-	-	MHS521	other_OG
23SKZ|Others	17	26.93146768976153	S	zinc finger	MHS521	other_OG
23SM1|Others	5	5.411255411255411	E	ABC-type multidrug transport system, ATPase component	MHS521	other_OG
23SM5|Others	24	26.490066225165563	J	Belongs to the class I-like SAM-binding methyltransferase superfamily. RsmB NOP family	MHS521	other_OG
23SM7|Others	17	20.531400966183575	L	Endonuclease IV plays a role in DNA repair. It cleaves phosphodiester bonds at apurinic or apyrimidinic sites (AP sites) to produce new 5'-ends that are base-free deoxyribose 5-phosphate residues. It preferentially attacks modified AP sites created by bleomycin and neocarzinostatin	MHS521	other_OG
23SM8|Others	23	28.987396784006954	L	Structure-specific nuclease with 5'-flap endonuclease and 5'-3' exonuclease activities involved in DNA replication and repair. During DNA replication, cleaves the 5'-overhanging flap structure that is generated by displacement synthesis when DNA polymerase encounters the 5'-end of a downstream Okazaki fragment. Binds the unpaired 3'-DNA end and kinks the DNA to facilitate 5' cleavage specificity. Cleaves one nucleotide into the double- stranded DNA from the junction in flap DNA, leaving a nick for ligation. Also involved in the base excision repair (BER) pathway. Acts as a genome stabilization factor that prevents flaps from equilibrating into structurs that lead to duplications and deletions. Also possesses 5'-3' exonuclease activity on nicked or gapped double-stranded DNA	MHS521	other_OG
23SM9|Others	9	7.211538461538462	E	Catalyzes the reversible interconversion of serine and glycine with tetrahydrofolate (THF) serving as the one-carbon carrier. Also exhibits THF-independent aldolase activity toward beta-hydroxyamino acids, producing glycine and aldehydes, via a retro-aldol mechanism	MHS521	other_OG
23SMA|Others	1	3.7878787878787876	H	Molybdopterin biosynthesis protein MoeA LysR substrate binding-domain-containing protein	MHS521	other_OG
23SMC|Others	4	14.814814814814813	S	dehydrogenases and related proteins	MHS521	other_OG
23SMD|Others	7	5.028735632183908	F	Belongs to the lyase 1 family. Adenylosuccinate lyase subfamily	MHS521	other_OG
23SMK|Others	41	52.90460745176314	K	Stabilizes TBP binding to an archaeal box-A promoter. Also responsible for recruiting RNA polymerase II to the pre- initiation complex (DNA-TBP-TFIIB)	MHS521	other_OG
23SMM|Others	37	48.14510126532691	I	Belongs to the enoyl-CoA hydratase isomerase family	MHS521	other_OG
23SMR|Others	49	37.376048817696415	O	Thioredoxin reductase	MHS521	other_OG
23SMS|Others	63	25.331724969843183	L	Releases the supercoiling and torsional tension of DNA, which is introduced during the DNA replication and transcription, by transiently cleaving and rejoining one strand of the DNA duplex. Introduces a single-strand break via transesterification at a target site in duplex DNA. The scissile phosphodiester is attacked by the catalytic tyrosine of the enzyme, resulting in the formation of a DNA-(5'-phosphotyrosyl)-enzyme intermediate and the expulsion of a 3'-OH DNA strand. The free DNA strand then undergoes passage around the unbroken strand, thus removing DNA supercoils. Finally, in the religation step, the DNA 3'-OH attacks the covalent intermediate to expel the active-site tyrosine and restore the DNA phosphodiester backbone	MHS521	other_OG
23SMT|Others	29	22.280904439676515	F	Key enzyme in the regulation of glycerol uptake and metabolism. Catalyzes the phosphorylation of glycerol to yield sn- glycerol 3-phosphate	MHS521	other_OG
23SMU|Others	33	35.40305010893246	Q	Phenylacetate-CoA oxygenase subunit PaaA	MHS521	other_OG
23SMV|Others	14	14.314928425357873	E	Cysteine synthase	MHS521	other_OG
23SMW|Others	9	10.90909090909091	S	COG0656 Aldo keto reductases, related to diketogulonate reductase	MHS521	other_OG
23SMY|Others	6	11.1731843575419	K	transcriptional regulator with C-terminal CBS domains	MHS521	other_OG
23SN2|Others	37	34.74178403755869	C	NADH ubiquinone oxidoreductase subunit 1 (Chain H)	MHS521	other_OG
23SN3|Others	28	14.249363867684478	S	transport system, fused permease components	MHS521	other_OG
23SN4|Others	15	12.755102040816327	S	COG0458 Carbamoylphosphate synthase large subunit (split gene in MJ)	MHS521	other_OG
23SN5|Others	7	7.268951194184839	G	COG0524 Sugar kinases, ribokinase family	MHS521	other_OG
23SND|Others	59	33.79152348224513	J	COG1549 Queuine tRNA-ribosyltransferases, contain PUA domain	MHS521	other_OG
23SNF|Others	43	58.81858402429669	E	Catalyzes the ATP-dependent phosphorylation of L- homoserine to L-homoserine phosphate	MHS521	other_OG
23SNI|Others	18	26.86579115951313	E	COG0440 Acetolactate synthase, small (regulatory) subunit	MHS521	other_OG
23SNJ|Others	21	15.730337078651687	G	COG0477 Permeases of the major facilitator superfamily	MHS521	other_OG
23SNM|Others	62	31.997718886172898	P	COG1132 ABC-type multidrug transport system, ATPase and permease components	MHS521	other_OG
23SNP|Others	170	78.44800167328563	P	COG2217 Cation transport ATPase	MHS521	other_OG
23SNR|Others	31	31.921886163372236	M	COG1208 Nucleoside-diphosphate-sugar pyrophosphorylase involved in lipopolysaccharide biosynthesis translation initiation factor 2B, gamma epsilon subunits (eIF-2Bgamma eIF-2Bepsilon)	MHS521	other_OG
23SNS|Others	24	22.353279631760646	K	DNA-dependent RNA polymerase catalyzes the transcription of DNA into RNA using the four ribonucleoside triphosphates as substrates	MHS521	other_OG
23SNU|Others	12	12.82051282051282	S	GTPase that associates with the 50S ribosomal subunit and may have a role during protein synthesis or ribosome biogenesis	MHS521	other_OG
23SNX|Others	76	30.4853590052146	E	COG0665 Glycine D-amino acid oxidases (deaminating)	MHS521	other_OG
23SNY|Others	40	66.20344888264562	J	Belongs to the eukaryotic ribosomal protein eS1 family	MHS521	other_OG
23SNZ|Others	53	68.849867236964	E	Threonine dehydratase	MHS521	other_OG
23SP0|Others	8	5.649717514124294	J	Binds to RNA in loop regions with AU-rich sequences	MHS521	other_OG
23SP2|Others	17	23.224043715846996	-	-	MHS521	other_OG
23SP5|Others	14	10.777521170130871	M	Belongs to the glycosyl hydrolase 68 family	MHS521	other_OG
23SP9|Others	86	52.986135619480805	S	type I phosphodiesterase nucleotide pyrophosphatase	MHS521	other_OG
23SPA|Others	19	10.770975056689343	L	COG0433 Predicted ATPase	MHS521	other_OG
23SPC|Others	28	27.370478983382213	C	COG0604 NADPH quinone reductase and related Zn-dependent oxidoreductases	MHS521	other_OG
23SPD|Others	27	26.215355898871724	F	COG0152 Phosphoribosylaminoimidazolesuccinocarboxamide (SAICAR) synthase	MHS521	other_OG
23SPE|Others	23	26.995305164319248	S	COG0517 FOG CBS domain	MHS521	other_OG
23SPF|Others	8	7.912957467853611	S	Domain of unknown function (DUF4397)	MHS521	other_OG
23SPG|Others	12	9.925558312655086	L	integrase family	MHS521	other_OG
23SPI|Others	18	10.563380281690142	S	Belongs to the sodium solute symporter (SSF) (TC 2.A.21) family	MHS521	other_OG
23SPK|Others	14	11.354420113544201	E	Belongs to the argininosuccinate synthase family. Type 1 subfamily	MHS521	other_OG
23SPQ|Others	14	9.950248756218905	V	MATE efflux family protein	MHS521	other_OG
23SPT|Others	23	8.781977854142802	L	that it carries out the mismatch recognition step. This protein has a weak ATPase activity	MHS521	other_OG
23SPW|Others	29	45.42770248324327	S	COG1100 GTPase SAR1 and related small G proteins	MHS521	other_OG
23SPX|Others	11	16.296296296296294	S	protein conserved in archaea	MHS521	other_OG
23SPY|Others	73	69.39998203056133	J	Catalyzes the GTP-dependent ribosomal translocation step during translation elongation. During this step, the ribosome changes from the pre-translocational (PRE) to the post- translocational (POST) state as the newly formed A-site-bound peptidyl-tRNA and P-site-bound deacylated tRNA move to the P and E sites, respectively. Catalyzes the coordinated movement of the two tRNA molecules, the mRNA and conformational changes in the ribosome	MHS521	other_OG
23SPZ|Others	5	7.122507122507123	S	ICC-like phosphoesterases	MHS521	other_OG
23SQ0|Others	12	18.01801801801802	L	Endonuclease that specifically degrades the RNA of RNA- DNA hybrids	MHS521	other_OG
23SQ6|Others	8	7.532956685499058	S	dehydrogenases and related proteins	MHS521	other_OG
23SQ9|Others	17	14.273719563392106	J	translation factor	MHS521	other_OG
23SQA|Others	4	3.7037037037037033	E	The glycine cleavage system catalyzes the degradation of glycine	MHS521	other_OG
23SQB|Others	27	21.92857819456285	E	Threonine dehydratase	MHS521	other_OG
23SQD|Others	10	12.919896640826874	S	hydrolases or acyltransferases (alpha beta hydrolase superfamily)	MHS521	other_OG
23SQQ|Others	21	30.951755538043955	K	COG1940 Transcriptional regulator sugar kinase	MHS521	other_OG
23SQS|Others	12	9.900990099009901	I	COG1960 Acyl-CoA dehydrogenases	MHS521	other_OG
23SQT|Others	10	8.865248226950355	P	ABC-type Fe3 -siderophore transport system, permease component	MHS521	other_OG
23SQW|Others	13	12.003693444136658	S	dehydrogenases and related proteins	MHS521	other_OG
23SQX|Others	25	30.882111012404174	E	Belongs to the class-IV pyridoxal-phosphate-dependent aminotransferase family	MHS521	other_OG
23SQY|Others	27	27.19033232628399	O	signal peptide peptidase SppA, 36K type	MHS521	other_OG
23SR0|Others	25	18.54540049399583	L	Involved in regulation of DNA replication	MHS521	other_OG
23SR3|Others	9	8.310249307479225	E	COG0444 ABC-type dipeptide oligopeptide nickel transport system, ATPase component	MHS521	other_OG
23SR4|Others	34	34.871794871794876	C	oxidoreductases (related to aryl-alcohol dehydrogenases)	MHS521	other_OG
23SRE|Others	22	26.19047619047619	H	Belongs to the FPP GGPP synthase family	MHS521	other_OG
23SRH|Others	41	15.690776884806736	J	amino acids such as threonine, to avoid such errors, it has a posttransfer editing activity that hydrolyzes mischarged Thr-tRNA(Val) in a tRNA-dependent manner	MHS521	other_OG
23SRK|Others	32	28.018268103195545	E	Belongs to the class-III pyridoxal-phosphate-dependent aminotransferase family	MHS521	other_OG
23SRN|Others	17	12.454212454212454	H	Isochorismate synthase	MHS521	other_OG
23SRP|Others	13	12.858555885262119	S	Domain of unknown function (DUF1611_N) Rossmann-like domain	MHS521	other_OG
23SRQ|Others	27	21.87812502460649	E	COG0624 Acetylornithine deacetylase Succinyl-diaminopimelate desuccinylase and related deacylases	MHS521	other_OG
23SRR|Others	7	7.135575942915392	I	Catalyzes the phosphorylation of (R)-mevalonate (MVA) to (R)-mevalonate 5-phosphate (MVAP). Functions in the mevalonate (MVA) pathway leading to isopentenyl diphosphate (IPP), a key precursor for the biosynthesis of isoprenoid compounds such as archaeal membrane lipids	MHS521	other_OG
23SRU|Others	31	21.280978846686715	K	histone acetyltransferase, ELP3 family	MHS521	other_OG
23SRW|Others	12	10.050251256281408	E	COG1120 ABC-type cobalamin Fe3 -siderophores transport systems, ATPase components	MHS521	other_OG
23SRX|Others	13	24.992802250127344	J	One of the primary rRNA binding proteins, it binds directly to 16S rRNA where it nucleates assembly of the body of the 30S subunit	MHS521	other_OG
23SRZ|Others	6	8.73362445414847	S	DNA polymerase beta domain-containing protein region	MHS521	other_OG
23SS0|Others	6	6.153846153846154	K	Stabilizes TBP binding to an archaeal box-A promoter. Also responsible for recruiting RNA polymerase II to the pre- initiation complex (DNA-TBP-TFIIB)	MHS521	other_OG
23SS1|Others	8	10.519436058634962	M	COG0668 Small-conductance mechanosensitive channel	MHS521	other_OG
23SS2|Others	7	11.217948717948717	O	Facilitates the functional incorporation of the urease nickel metallocenter. This process requires GTP hydrolysis, probably effectuated by UreG	MHS521	other_OG
23SS3|Others	19	20.364415862808144	E	nucleic acid binding protein containing the AN1-type Zn-finger	MHS521	other_OG
23SS5|Others	29	24.534686971235196	U	Involved in targeting and insertion of nascent membrane proteins into the cytoplasmic membrane. Acts as a receptor for the complex formed by the signal recognition particle (SRP) and the ribosome-nascent chain (RNC)	MHS521	other_OG
23SS6|Others	23	15.241882041086814	S	Membrane protein involved in the export of O-antigen and teichoic acid	MHS521	other_OG
23SS7|Others	6	7.194244604316547	P	Part of the ABC transporter complex PstSACB involved in phosphate import. Responsible for energy coupling to the transport system	MHS521	other_OG
23SS8|Others	19	25.232403718459494	-	-	MHS521	other_OG
23SS9|Others	23	17.37625119978061	J	Responsible for synthesis of pseudouridine from uracil- 54 and uracil-55 in the psi GC loop of transfer RNAs	MHS521	other_OG
23SSA|Others	10	11.862396204033216	P	COG1116 ABC-type nitrate sulfonate bicarbonate transport system, ATPase component	MHS521	other_OG
23SSE|Others	3	3.717472118959108	E	Involved in the biosynthesis of the chorismate, which leads to the biosynthesis of aromatic amino acids. Catalyzes the reversible NADPH linked reduction of 3-dehydroshikimate (DHSA) to yield shikimate (SA)	MHS521	other_OG
23SSF|Others	51	46.227312032921326	E	COG3839 ABC-type sugar transport systems, ATPase components	MHS521	other_OG
23SSG|Others	2	5.698005698005699	M	COG4948 L-alanine-DL-glutamate epimerase and related enzymes of enolase superfamily	MHS521	other_OG
23SSH|Others	10	9.551098376313277	P	COG1173 ABC-type dipeptide oligopeptide nickel transport systems, permease components	MHS521	other_OG
23SSI|Others	47	38.77887788778878	O	COG0719 ABC-type transport system involved in Fe-S cluster assembly, permease component	MHS521	other_OG
23SSJ|Others	20	17.341445602801763	E	COG3842 ABC-type spermidine putrescine transport systems, ATPase components	MHS521	other_OG
23SSM|Others	12	19.32367149758454	I	MaoC domain-containing protein dehydratase	MHS521	other_OG
23SSR|Others	41	28.29100245372853	O	Belongs to the TCP-1 chaperonin family	MHS521	other_OG
23SSU|Others	11	7.147498375568551	E	ABC-type dipeptide transport system, periplasmic component	MHS521	other_OG
23SSV|Others	11	11.714589989350374	P	COG1175 ABC-type sugar transport systems, permease components	MHS521	other_OG
23SSW|Others	46	34.379671150971596	G	Belongs to the phosphohexose mutase family	MHS521	other_OG
23ST0|Others	7	8.706467661691542	P	COG3639 ABC-type phosphate phosphonate transport system, permease component	MHS521	other_OG
23ST1|Others	57	68.35541234037474	J	Function in general translation initiation by promoting the binding of the formylmethionine-tRNA to ribosomes. Seems to function along with eIF-2	MHS521	other_OG
23ST2|Others	15	16.286644951140065	H	COG1654 Biotin operon repressor	MHS521	other_OG
23ST3|Others	20	20.5761316872428	H	ABC-type tungstate transport system, permease component	MHS521	other_OG
23ST6|Others	22	22.12180282355721	J	phenylalanyl-tRNA synthetase, beta subunit	MHS521	other_OG
23ST7|Others	2	3.436426116838488	E	COG0624 Acetylornithine deacetylase Succinyl-diaminopimelate desuccinylase and related deacylases	MHS521	other_OG
23ST8|Others	4	7.49063670411985	E	COG0147 Anthranilate para-aminobenzoate synthases component I	MHS521	other_OG
23STA|Others	15	12.048192771084336	S	phosphohydrolase (DHH superfamily)	MHS521	other_OG
23STC|Others	2	4.761904761904762	J	COG1736 Diphthamide synthase subunit DPH2	MHS521	other_OG
23STG|Others	23	20.612891300220817	J	Catalyzes the attachment of serine to tRNA(Ser). Is also able to aminoacylate tRNA(Sec) with serine, to form the misacylated tRNA L-seryl-tRNA(Sec), which will be further converted into selenocysteinyl-tRNA(Sec)	MHS521	other_OG
23STI|Others	62	90.06093059044657	L	Transposase, is605 orfb family	MHS521	other_OG
23STJ|Others	18	41.74828323764494	I	COG0183 Acetyl-CoA acetyltransferase	MHS521	other_OG
23STK|Others	27	20.179372197309416	H	COG0001 Glutamate-1-semialdehyde aminotransferase	MHS521	other_OG
23STN|Others	48	43.07636934755578	J	Directs the termination of nascent peptide synthesis (translation) in response to the termination codons UAA, UAG and UGA	MHS521	other_OG
23STP|Others	4	5.602240896358544	-	-	MHS521	other_OG
23STQ|Others	4	4.920049200492005	P	divalent heavy-metal cations transporter	MHS521	other_OG
23STS|Others	4	6.0882800608828	K	transcription activator	MHS521	other_OG
23STT|Others	12	13.651877133105803	M	NAD-dependent epimerase dehydratase	MHS521	other_OG
23STV|Others	44	18.588931136459653	L	Relaxes both positive and negative superturns and exhibits a strong decatenase activity	MHS521	other_OG
23STW|Others	6	10.6951871657754	E	COG0334 Glutamate dehydrogenase leucine dehydrogenase	MHS521	other_OG
23STZ|Others	12	20.61855670103093	J	This protein binds to the 23S rRNA, and is important in its secondary structure. It is located near the subunit interface in the base of the L7 L12 stalk, and near the tRNA binding site of the peptidyltransferase center	MHS521	other_OG
23SU1|Others	43	97.80531384066738	-	-	MHS521	other_OG
23SU2|Others	29	23.66891638545182	C	COG1012 NAD-dependent aldehyde dehydrogenases	MHS521	other_OG
23SU3|Others	60	30.337657321273376	L	Has ATPase and non-specific DNA-binding activities	MHS521	other_OG
23SU5|Others	65	60.74055121467982	P	COG0475 Kef-type K transport systems, membrane components	MHS521	other_OG
23SU6|Others	10	14.17624521072797	H	Prenyltransferase that catalyzes the transfer of the geranylgeranyl moiety of geranylgeranyl diphosphate (GGPP) to the C3 hydroxyl of sn-glycerol-1-phosphate (G1P). This reaction is the first ether-bond-formation step in the biosynthesis of archaeal membrane lipids	MHS521	other_OG
23SU8|Others	27	15.93547117843793	M	COG1292 Choline-glycine betaine transporter	MHS521	other_OG
23SUA|Others	9	13.636363636363635	P	COG0226 ABC-type phosphate transport system, periplasmic component	MHS521	other_OG
23SUC|Others	26	19.563581640331076	J	Could be responsible for synthesis of pseudouridine from uracil-13 in transfer RNAs	MHS521	other_OG
23SUD|Others	52	37.112162872811965	F	COG2252 Permeases	MHS521	other_OG
23SUE|Others	6	10.989010989010989	-	-	MHS521	other_OG
23SUG|Others	31	20.791415157612338	F	COG2233 Xanthine uracil permeases	MHS521	other_OG
23SUH|Others	29	16.138007790762384	K	COG1061 DNA or RNA helicases of superfamily II	MHS521	other_OG
23SUI|Others	62	42.71980743948225	P	COG2217 Cation transport ATPase	MHS521	other_OG
23SUJ|Others	14	8.469449485783423	O	COG1331 Highly conserved protein containing a thioredoxin domain	MHS521	other_OG
23SUK|Others	20	28.368794326241137	G	Catalyzes the reversible conversion of ribose-5- phosphate to ribulose 5-phosphate	MHS521	other_OG
23SUP|Others	18	16.042780748663102	I	COG1562 Phytoene squalene synthetase	MHS521	other_OG
23SUU|Others	32	33.730851753904496	S	membrane	MHS521	other_OG
