other_OG	read_count_sum	RPK_sum	other_eggnog_cat	other_eggnog_desc	LIBID	feature_class
23TV6|Others	6	9.174311926605505	S	phosphatases	MHS521	other_OG
23TVD|Others	8	10.540184453227932	E	Catalyzes the conversion of 4-hydroxy- tetrahydrodipicolinate (HTPA) to tetrahydrodipicolinate	MHS521	other_OG
23TVQ|Others	17	18.77444157221449	H	COG1541 Coenzyme F390 synthetase	MHS521	other_OG
23TVR|Others	60	62.76991545998579	S	GTP-binding protein	MHS521	other_OG
23TW1|Others	15	28.409090909090907	J	Belongs to the universal ribosomal protein uL16 family	MHS521	other_OG
23TW8|Others	11	8.709422011084719	S	cobalamin synthesis protein P47K	MHS521	other_OG
23TWC|Others	23	48.52171004910509	L	Transposase and inactivated derivatives	MHS521	other_OG
23TWI|Others	8	7.511737089201878	S	xylanase chitin deacetylase	MHS521	other_OG
23TWK|Others	23	23.302938196555218	P	COG0601 ABC-type dipeptide oligopeptide nickel transport systems, permease components	MHS521	other_OG
23TWM|Others	9	12.987012987012989	Q	Maleate cis-trans isomerase	MHS521	other_OG
23TWT|Others	3	3.5971223021582737	S	COG0656 Aldo keto reductases, related to diketogulonate reductase	MHS521	other_OG
23TWU|Others	34	52.11964316396938	C	aconitate hydratase	MHS521	other_OG
23TX3|Others	24	17.66086041669418	C	Produces ATP from ADP in the presence of a proton gradient across the membrane. The archaeal alpha chain is a catalytic subunit	MHS521	other_OG
23TX4|Others	26	28.085394364464133	-	-	MHS521	other_OG
23TX7|Others	61	37.93532338308457	E	COG0028 Thiamine pyrophosphate-requiring enzymes acetolactate synthase, pyruvate dehydrogenase (cytochrome), glyoxylate carboligase, phosphonopyruvate decarboxylase	MHS521	other_OG
23TXD|Others	8	5.772005772005772	G	Belongs to the phosphohexose mutase family	MHS521	other_OG
23TXF|Others	14	17.412935323383085	C	COG1290 Cytochrome b subunit of the bc complex	MHS521	other_OG
23TXV|Others	17	17.598343685300208	S	Succinylglutamate desuccinylase aspartoacylase	MHS521	other_OG
23TXX|Others	4	3.546099290780142	P	Spermidine putrescine-binding periplasmic protein	MHS521	other_OG
23TXZ|Others	6	10.869565217391303	I	COG0170 Dolichol kinase	MHS521	other_OG
23TY3|Others	16	17.837235228539576	F	COG1957 Inosine-uridine nucleoside N-ribohydrolase	MHS521	other_OG
23TYD|Others	57	93.77157371446548	K	COG1061 DNA or RNA helicases of superfamily II	MHS521	other_OG
23TYV|Others	3	4.566210045662101	K	DNA binding protein	MHS521	other_OG
23TZ0|Others	7	9.114583333333334	C	Electron transfer flavoprotein, beta subunit	MHS521	other_OG
23TZ5|Others	6	6.25	S	dehydrogenases and related proteins	MHS521	other_OG
23TZB|Others	15	12.755102040816327	H	Catalyzes the ATP-dependent transfer of a sulfur to tRNA to produce 4-thiouridine in position 8 of tRNAs, which functions as a near-UV photosensor. Also catalyzes the transfer of sulfur to the sulfur carrier protein ThiS, forming ThiS-thiocarboxylate. This is a step in the synthesis of thiazole, in the thiamine biosynthesis pathway. The sulfur is donated as persulfide by IscS	MHS521	other_OG
23TZJ|Others	7	10.6544901065449	T	COG0639 Diadenosine tetraphosphatase and related serine threonine protein phosphatases	MHS521	other_OG
23TZN|Others	4	8.771929824561402	E	COG0436 Aspartate tyrosine aromatic aminotransferase	MHS521	other_OG
23TZT|Others	22	25.099695050433965	G	COG0697 Permeases of the drug metabolite transporter (DMT) superfamily	MHS521	other_OG
23U02|Others	10	8.090614886731391	P	COG1914 Mn2 and Fe2 transporters of the NRAMP family	MHS521	other_OG
23U03|Others	8	17.225734691488114	H	Catalyzes the conversion of D-ribulose 5-phosphate to formate and 3,4-dihydroxy-2-butanone 4-phosphate	MHS521	other_OG
23U05|Others	42	23.60876897133221	C	Formate hydrogenlyase subunit 3 Multisubunit Na H antiporter, MnhD subunit	MHS521	other_OG
23U0C|Others	1	6.289308176100628	M	COG0438 Glycosyltransferase	MHS521	other_OG
23U0G|Others	13	18.922852983988353	U	COG0681 Signal peptidase I	MHS521	other_OG
23U0H|Others	9	11.857707509881422	I	Belongs to the short-chain dehydrogenases reductases (SDR) family	MHS521	other_OG
23U0W|Others	1	3.7878787878787876	S	Zn-dependent hydrolases of the beta-lactamase fold	MHS521	other_OG
23U11|Others	31	39.07048008171603	G	COG0483 Archaeal fructose-1,6-bisphosphatase and related enzymes of inositol monophosphatase family	MHS521	other_OG
23U14|Others	20	38.12517160156645	C	Belongs to the complex I 20 kDa subunit family	MHS521	other_OG
23U17|Others	15	11.286681715575622	S	ribonuclease BN	MHS521	other_OG
23U1D|Others	4	5.9790732436472345	O	cytochrome c biogenesis protein	MHS521	other_OG
23U1G|Others	6	6.269592476489028	C	COG2141 Coenzyme F420-dependent N5,N10-methylene tetrahydromethanopterin reductase and related flavin-dependent oxidoreductases	MHS521	other_OG
23U1I|Others	2	3.6429872495446265	H	HD-superfamily hydrolase	MHS521	other_OG
23U1N|Others	27	15.929203539823009	I	Acetyl-CoA carboxylase, carboxyltransferase component (subunits alpha and beta)	MHS521	other_OG
23U1V|Others	22	28.645833333333336	S	Nucleotidase that shows phosphatase activity on nucleoside 5'-monophosphates	MHS521	other_OG
23U1W|Others	178	68.21259163604493	U	COG3451 Type IV secretory pathway, VirB4 components	MHS521	other_OG
23U21|Others	55	91.8174204355109	C	COG0437 Fe-S-cluster-containing hydrogenase components 1	MHS521	other_OG
23U22|Others	6	8.097165991902834	O	protein-L-isoaspartate(D-aspartate) O-methyltransferase	MHS521	other_OG
23U23|Others	9	6.0606060606060606	H	COG0043 3-polyprenyl-4-hydroxybenzoate decarboxylase and related decarboxylases	MHS521	other_OG
23U2Q|Others	6	11.1731843575419	L	COG0494 NTP pyrophosphohydrolases including oxidative damage repair enzymes	MHS521	other_OG
23U2W|Others	12	13.245033112582782	E	Belongs to the arginase family	MHS521	other_OG
23U2Y|Others	21	25.467728361494142	L	ribonuclease BN	MHS521	other_OG
23U2Z|Others	109	216.20693564933006	L	COG3436 Transposase and inactivated derivatives	MHS521	other_OG
23U31|Others	6	9.049773755656108	-	-	MHS521	other_OG
23U34|Others	18	7.471980074719801	O	Belongs to the peptidase S8 family	MHS521	other_OG
23U3A|Others	4	6.172839506172839	H	Condenses 4-methyl-5-(beta-hydroxyethyl)thiazole monophosphate (THZ-P) and 2-methyl-4-amino-5-hydroxymethyl pyrimidine pyrophosphate (HMP-PP) to form thiamine monophosphate (TMP)	MHS521	other_OG
23U3B|Others	3	5.649717514124293	S	DoxX family	MHS521	other_OG
23U3I|Others	18	22.22222222222222	O	COG1651 Protein-disulfide isomerase	MHS521	other_OG
23U3J|Others	5	6.6401062416998675	K	Transcriptional regulators	MHS521	other_OG
23U3S|Others	6	4.662004662004662	S	COG1593 TRAP-type C4-dicarboxylate transport system, large permease component	MHS521	other_OG
23U3U|Others	15	8.375209380234507	J	COG0154 Asp-tRNAAsn Glu-tRNAGln amidotransferase A subunit and related amidases	MHS521	other_OG
23U3X|Others	29	35.02415458937198	O	protein required for cytochrome oxidase assembly	MHS521	other_OG
23U4Q|Others	21	35.4606567748241	E	COG0346 Lactoylglutathione lyase and related lyases	MHS521	other_OG
23U4R|Others	14	32.562010038172055	-	-	MHS521	other_OG
23U4S|Others	1	3.4722222222222223	L	DNA repair enzyme that has both DNA N-glycosylase activity and AP-lyase activity. The DNA N-glycosylase activity releases various damaged pyrimidines from DNA by cleaving the N- glycosidic bond, leaving an AP (apurinic apyrimidinic) site. The AP-lyase activity cleaves the phosphodiester bond 3' to the AP site by a beta-elimination, leaving a 3'-terminal unsaturated sugar and a product with a terminal 5'-phosphate	MHS521	other_OG
23U4U|Others	5	5.192107995846314	H	Belongs to the D-isomer specific 2-hydroxyacid dehydrogenase family	MHS521	other_OG
23U4X|Others	34	22.010245539657305	S	membrane	MHS521	other_OG
23U51|Others	9	7.246376811594203	M	COG0438 Glycosyltransferase	MHS521	other_OG
23U52|Others	7	7.049345417925478	P	COG0798 Arsenite efflux pump ACR3 and related permeases	MHS521	other_OG
23U55|Others	6	4.640371229698376	E	Catalyzes the cleavage of L-kynurenine (L-Kyn) and L-3- hydroxykynurenine (L-3OHKyn) into anthranilic acid (AA) and 3- hydroxyanthranilic acid (3-OHAA), respectively	MHS521	other_OG
23U57|Others	9	14.354066985645932	C	COG2141 Coenzyme F420-dependent N5,N10-methylene tetrahydromethanopterin reductase and related flavin-dependent oxidoreductases	MHS521	other_OG
23U59|Others	15	11.286681715575622	E	Catalyzes the NADPH-dependent reduction of L-glutamate 5-phosphate into L-glutamate 5-semialdehyde and phosphate. The product spontaneously undergoes cyclization to form 1-pyrroline-5- carboxylate	MHS521	other_OG
23U5A|Others	10	13.440860215053764	K	DNA-dependent RNA polymerase catalyzes the transcription of DNA into RNA using the four ribonucleoside triphosphates as substrates	MHS521	other_OG
23U5G|Others	25	32.93807641633729	K	COG1414 Transcriptional regulator	MHS521	other_OG
23U5K|Others	6	6.8965517241379315	I	COG0671 Membrane-associated phospholipid phosphatase	MHS521	other_OG
23U5T|Others	21	21.08433734939759	C	Prokaryotic cytochrome b561	MHS521	other_OG
23U5W|Others	19	17.49539594843462	C	COG0371 Glycerol dehydrogenase and related enzymes	MHS521	other_OG
23U5X|Others	25	31.49418715456451	E	Glyoxalase bleomycin resistance protein dioxygenase	MHS521	other_OG
23U5Z|Others	17	13.231663035584605	F	Belongs to the metallo-dependent hydrolases superfamily. HutI family	MHS521	other_OG
23U62|Others	9	15.544041450777204	T	COG0784 FOG CheY-like receiver	MHS521	other_OG
23U6B|Others	12	12.232415902140673	P	Catalyzes the condensation of 4-aminobenzoate (pABA) with 5-phospho-alpha-D-ribose 1-diphosphate (PRPP) to produce beta-ribofuranosylaminobenzene 5'-phosphate (beta-RFA-P)	MHS521	other_OG
23U6C|Others	22	19.047619047619047	I	COG1960 Acyl-CoA dehydrogenases	MHS521	other_OG
23U6F|Others	17	19.144144144144143	S	ABC-type transport system involved in multi-copper enzyme maturation, permease component	MHS521	other_OG
23U6P|Others	26	32.39006797059231	L	EndoIII-related endonuclease	MHS521	other_OG
23U6T|Others	9	15.625000000000002	E	COG1246 N-acetylglutamate synthase and related acetyltransferases	MHS521	other_OG
23U6X|Others	6	9.132420091324201	P	Plays a role in the regulation of phosphate uptake	MHS521	other_OG
23U75|Others	9	9.036144578313253	-	-	MHS521	other_OG
23U7P|Others	24	8.869179600886918	S	transport system, fused permease components	MHS521	other_OG
23U7Q|Others	10	14.095545573647764	P	COG3639 ABC-type phosphate phosphonate transport system, permease component	MHS521	other_OG
23U7W|Others	8	6.633499170812604	S	membrane-associated protein domain	MHS521	other_OG
23U82|Others	42	35.35353535353536	L	COG3385 FOG Transposase and inactivated derivatives	MHS521	other_OG
23U87|Others	20	28.368794326241137	H	COG2005 N-terminal domain of molybdenum-binding protein	MHS521	other_OG
23U89|Others	35	29.021558872305143	S	COG0458 Carbamoylphosphate synthase large subunit (split gene in MJ)	MHS521	other_OG
23U8F|Others	14	24.305555555555557	F	thymidylate kinase	MHS521	other_OG
23U8Q|Others	43	35.0081103000811	G	COG0477 Permeases of the major facilitator superfamily	MHS521	other_OG
23U8V|Others	21	10.46337817638266	P	COG2217 Cation transport ATPase	MHS521	other_OG
23U8X|Others	17	11.904761904761905	L	COG1599 Single-stranded DNA-binding replication protein A (RPA), large (70 kD) subunit and related ssDNA-binding proteins	MHS521	other_OG
23U8Y|Others	210	225.21436296864175	L	COG3385 FOG Transposase and inactivated derivatives	MHS521	other_OG
23U90|Others	10	11.82033096926714	G	COG1082 Sugar phosphate isomerases epimerases	MHS521	other_OG
23U97|Others	4	10.925365275766751	J	With S4 and S5 plays an important role in translational accuracy. Located at the interface of the 30S and 50S subunits	MHS521	other_OG
23U9H|Others	2	7.092198581560284	P	transcriptional regulators	MHS521	other_OG
23U9J|Others	11	17.54385964912281	L	COG1573 Uracil-DNA glycosylase	MHS521	other_OG
23U9M|Others	27	44.65136138207377	S	membrane	MHS521	other_OG
23U9P|Others	13	15.815085158150852	-	-	MHS521	other_OG
23U9R|Others	6	6.079027355623101	J	exonuclease of the beta-lactamase fold involved in RNA processing	MHS521	other_OG
23U9U|Others	5	5.518763796909492	S	Auxin Efflux Carrier	MHS521	other_OG
23UAA|Others	4	6.3191153238546605	C	Nitroreductase family	MHS521	other_OG
23UAG|Others	22	28.749173280423282	E	branched-chain amino acid permease (azaleucine resistance)	MHS521	other_OG
23UAT|Others	16	19.035588511932104	D	Arsenite-activated ATPase ArsA	MHS521	other_OG
23UAX|Others	11	12.101210121012102	P	COG0581 ABC-type phosphate transport system, permease component	MHS521	other_OG
23UAZ|Others	35	30.32102022867194	H	COG1488 Nicotinic acid phosphoribosyltransferase	MHS521	other_OG
23UB5|Others	10	10.384215991692628	S	Tripartite tricarboxylate transporter family receptor	MHS521	other_OG
23UBG|Others	5	10.893246187363834	E	COG1063 Threonine dehydrogenase and related Zn-dependent dehydrogenases	MHS521	other_OG
23UBJ|Others	14	23.217247097844112	K	COG0582 Integrase	MHS521	other_OG
23UBR|Others	11	8.771929824561404	E	Catalyzes the gamma-elimination of phosphate from L- phosphohomoserine and the beta-addition of water to produce L- threonine	MHS521	other_OG
23UC0|Others	8	14.652014652014651	I	Prenyltransferase that catalyzes the transfer of the geranylgeranyl moiety of geranylgeranyl diphosphate (GGPP) to the C3 hydroxyl of sn-glycerol-1-phosphate (G1P). This reaction is the first ether-bond-formation step in the biosynthesis of archaeal membrane lipids	MHS521	other_OG
23UC4|Others	68	120.52255107572329	L	COG3385 FOG Transposase and inactivated derivatives	MHS521	other_OG
23UC7|Others	34	35.41666666666667	P	ABC-type nitrate sulfonate bicarbonate transport	MHS521	other_OG
23UC8|Others	25	17.84439685938615	P	COG3119 Arylsulfatase A and related enzymes	MHS521	other_OG
23UC9|Others	12	20.656179138321995	F	Catalyzes the cyclization of 5-formylamidoimidazole-4- carboxamide ribonucleotide to IMP	MHS521	other_OG
23UCC|Others	15	9.107468123861567	-	-	MHS521	other_OG
23UCG|Others	19	21.367712170257096	D	COG1192 ATPases involved in chromosome partitioning	MHS521	other_OG
23UCP|Others	7	9.186351706036746	S	Transport and Golgi organisation 2	MHS521	other_OG
23UCR|Others	13	14.590347923681257	P	ABC-type nitrate sulfonate bicarbonate transport systems periplasmic	MHS521	other_OG
23UCW|Others	5	6.5359477124183005	K	Transcriptional regulator	MHS521	other_OG
23UCY|Others	20	13.123359580052494	S	Membrane protein involved in the export of O-antigen and teichoic acid	MHS521	other_OG
23UD0|Others	4	8.771929824561402	F	Major role in the synthesis of nucleoside triphosphates other than ATP. The ATP gamma phosphate is transferred to the NDP beta phosphate via a ping-pong mechanism, using a phosphorylated active-site intermediate	MHS521	other_OG
23UD3|Others	9	24.193548387096776	S	PFAM periplasmic copper-binding	MHS521	other_OG
23UD5|Others	9	7.894736842105264	M	COG0668 Small-conductance mechanosensitive channel	MHS521	other_OG
23UD8|Others	118	227.87705114970916	L	COG3039 Transposase and inactivated derivatives, IS5 family	MHS521	other_OG
23UDA|Others	21	28.29813940925052	E	ABC transporter, ATP-binding protein	MHS521	other_OG
23UDE|Others	2	3.367003367003367	S	IMG reference gene	MHS521	other_OG
23UDS|Others	3	5.3475935828877	S	membrane	MHS521	other_OG
23UDU|Others	2	7.662835249042145	P	COG1230 Co Zn Cd efflux system component	MHS521	other_OG
23UDW|Others	19	14.328808446455504	L	Involved in regulation of DNA replication	MHS521	other_OG
23UE0|Others	25	11.704119850187265	C	COG1148 Heterodisulfide reductase, subunit A and related polyferredoxins	MHS521	other_OG
23UE2|Others	8	14.732965009208103	K	Ribbon-helix-helix protein, copG family	MHS521	other_OG
23UE4|Others	4	4.314994606256742	P	divalent heavy-metal cations transporter	MHS521	other_OG
23UE6|Others	16	32.960151317639244	K	COG1522 Transcriptional regulators	MHS521	other_OG
23UEA|Others	12	17.186517186517186	K	Bacterio-opsin activator HTH	MHS521	other_OG
23UEC|Others	4	4.47427293064877	H	NH(3)-dependent NAD( ) synthetase	MHS521	other_OG
23UEU|Others	4	6.033182503770739	M	glycosyl transferase family 2	MHS521	other_OG
23UEY|Others	5	5.574136008918617	P	Part of the ABC transporter complex PstSACB involved in phosphate import. Responsible for energy coupling to the transport system	MHS521	other_OG
23UEZ|Others	30	20.126160700500673	M	COG1215 Glycosyltransferases, probably involved in cell wall biogenesis	MHS521	other_OG
23UF0|Others	6	12.195121951219512	S	protein (competence- and mitomycin-induced)	MHS521	other_OG
23UFB|Others	8	5.532503457814661	E	chaperonin protecting lyase from inhibition	MHS521	other_OG
23UFF|Others	10	7.183908045977012	S	phosphohydrolase	MHS521	other_OG
23UFJ|Others	20	9.876543209876544	T	COG0642 Signal transduction histidine kinase	MHS521	other_OG
23UG5|Others	8	13.536379018612521	E	COG0110 Acetyltransferase (isoleucine patch superfamily)	MHS521	other_OG
23UGI|Others	29	24.647490129723636	Q	COG1228 Imidazolonepropionase and related amidohydrolases	MHS521	other_OG
23UGJ|Others	23	37.03703703703704	-	-	MHS521	other_OG
23UGY|Others	21	26.633640790267297	L	COG3385 FOG Transposase and inactivated derivatives	MHS521	other_OG
23UH0|Others	6	7.168458781362007	S	ABC-type transport system involved in multi-copper enzyme maturation, permease component	MHS521	other_OG
23UH2|Others	35	33.238366571699906	C	COG0473 Isocitrate isopropylmalate dehydrogenase	MHS521	other_OG
23UH5|Others	5	9.469696969696969	F	Pyrophosphatase that catalyzes the hydrolysis of nucleoside triphosphates to their monophosphate derivatives, with a high preference for the non-canonical purine nucleotides XTP (xanthosine triphosphate), dITP (deoxyinosine triphosphate) and ITP. Seems to function as a house-cleaning enzyme that removes non-canonical purine nucleotides from the nucleotide pool, thus preventing their incorporation into DNA RNA and avoiding chromosomal lesions	MHS521	other_OG
23UHC|Others	12	9.638554216867469	L	Involved in the cellular defense against the biological effects of O6-methylguanine (O6-MeG) and O4-methylthymine (O4-MeT) in DNA. Repairs the methylated nucleobase in DNA by stoichiometrically transferring the methyl group to a cysteine residue in the enzyme. This is a suicide reaction the enzyme is irreversibly inactivated	MHS521	other_OG
23UHK|Others	27	22.5	C	acyl-CoA transferases carnitine dehydratase	MHS521	other_OG
23UHM|Others	6	9.523809523809524	-	-	MHS521	other_OG
23UHQ|Others	10	12.077294685990339	K	Transcriptional regulator	MHS521	other_OG
23UI7|Others	53	47.747747747747745	C	COG1071 Pyruvate 2-oxoglutarate dehydrogenase complex, dehydrogenase (E1) component, eukaryotic type, alpha subunit	MHS521	other_OG
23UIB|Others	3	6.4935064935064934	Q	PFAM Gas vesicle synthesis	MHS521	other_OG
23UIF|Others	27	15.43739279588336	C	COG0644 Dehydrogenases (flavoproteins)	MHS521	other_OG
23UIK|Others	5	5.359056806002143	M	COG0463 Glycosyltransferases involved in cell wall biogenesis	MHS521	other_OG
23UIM|Others	6	8.547008547008547	-	-	MHS521	other_OG
23UIN|Others	13	12.487992315081653	S	protein conserved in archaea	MHS521	other_OG
23UIU|Others	10	13.63436941041477	I	COG0671 Membrane-associated phospholipid phosphatase	MHS521	other_OG
23UJ4|Others	37	69.27719468038745	L	COG3039 Transposase and inactivated derivatives, IS5 family	MHS521	other_OG
23UJ7|Others	8	13.60544217687075	K	transcriptional	MHS521	other_OG
23UJ8|Others	7	6.965174129353235	S	metal-dependent hydrolase of the TIM-barrel fold	MHS521	other_OG
23UJK|Others	129	76.38862058751562	S	PQQ-dependent enzyme-like	MHS521	other_OG
23UJR|Others	2	3.8535645472061657	-	-	MHS521	other_OG
23UK4|Others	24	30.09938767346688	G	COG0574 Phosphoenolpyruvate synthase pyruvate phosphate dikinase	MHS521	other_OG
23UK9|Others	4	11.299435028248588	L	Transposase	MHS521	other_OG
23UKD|Others	18	10.273972602739725	E	COG0747 ABC-type dipeptide transport system, periplasmic component	MHS521	other_OG
23UKE|Others	32	37.63780483017305	C	Aldehyde ferredoxin oxidoreductase	MHS521	other_OG
23UKP|Others	11	14.21710760232161	I	COG1028 Dehydrogenases with different specificities (related to short-chain alcohol dehydrogenases)	MHS521	other_OG
23UKV|Others	7	4.419191919191919	E	Belongs to the sodium solute symporter (SSF) (TC 2.A.21) family	MHS521	other_OG
23UMD|Others	24	20.512820512820515	M	COG4948 L-alanine-DL-glutamate epimerase and related enzymes of enolase superfamily	MHS521	other_OG
23UME|Others	32	26.24506694428976	P	COG1914 Mn2 and Fe2 transporters of the NRAMP family	MHS521	other_OG
23UMI|Others	5	6.038647342995169	-	-	MHS521	other_OG
23UMM|Others	9	8.797653958944283	P	Tripartite tricarboxylate transporter family receptor	MHS521	other_OG
23UMQ|Others	41	52.24780112897258	M	Choline-glycine betaine transporter	MHS521	other_OG
23UMV|Others	8	23.502551705613755	L	PFAM Transposase DDE domain	MHS521	other_OG
23UMX|Others	4	19.32367149758454	S	Sugar-transfer associated ATP-grasp	MHS521	other_OG
23UN1|Others	13	19.6078431372549	K	Sigma-70 like region 4 HTH domain-containing protein	MHS521	other_OG
23UN4|Others	33	14.986376021798366	T	signal transduction histidine kinase	MHS521	other_OG
23UN7|Others	15	23.482043143478514	-	-	MHS521	other_OG
23UNB|Others	9	13.043478260869566	P	carbonic anhydrase	MHS521	other_OG
23UP8|Others	19	22.576832151300238	I	COG0671 Membrane-associated phospholipid phosphatase	MHS521	other_OG
23UPC|Others	14	9.25925925925926	G	Domain of unknown function (DUF1939)	MHS521	other_OG
23UPJ|Others	11	14.082915807053737	I	Belongs to the enoyl-CoA hydratase isomerase family	MHS521	other_OG
23UPK|Others	6	6.34920634920635	P	COG1175 ABC-type sugar transport systems, permease components	MHS521	other_OG
23UQB|Others	27	30.201342281879192	E	COG0329 Dihydrodipicolinate synthase N-acetylneuraminate lyase	MHS521	other_OG
23UQG|Others	13	12.41642788920726	H	Belongs to the D-isomer specific 2-hydroxyacid dehydrogenase family	MHS521	other_OG
23UQI|Others	12	18.81107015388216	S	HAD-superfamily hydrolase, subfamily IA, variant 3	MHS521	other_OG
23UQJ|Others	204	221.3243985506728	L	Transposase and inactivated derivatives	MHS521	other_OG
23UQU|Others	10	5.08130081300813	E	COG0146 N-methylhydantoinase B acetone carboxylase, alpha subunit	MHS521	other_OG
23URV|Others	7	9.446693657219972	S	Ferritin-like domain	MHS521	other_OG
23USI|Others	15	25	-	-	MHS521	other_OG
23USS|Others	31	13.668430335097003	P	Catalase	MHS521	other_OG
23UT2|Others	19	21.515204103276066	E	COG0559 Branched-chain amino acid ABC-type transport system, permease components	MHS521	other_OG
23UTU|Others	34	20.178909067797957	F	COG1001 Adenine deaminase	MHS521	other_OG
23UTZ|Others	55	47.68872779343984	G	Major facilitator superfamily	MHS521	other_OG
23UU0|Others	35	35.46099290780142	P	ABC-type nitrate sulfonate bicarbonate transport	MHS521	other_OG
23UU6|Others	22	15.373864430468204	E	Belongs to the sodium solute symporter (SSF) (TC 2.A.21) family	MHS521	other_OG
23UUK|Others	5	7.246376811594203	S	integral membrane protein	MHS521	other_OG
23UV0|Others	8	7.469654528478058	T	COG0784 FOG CheY-like receiver	MHS521	other_OG
23UV1|Others	21	29.542389643081904	O	Urease accessory protein UreF	MHS521	other_OG
23UV2|Others	8	4.678362573099415	T	PQQ-dependent enzyme-like	MHS521	other_OG
23UVJ|Others	16	14.717508970382534	P	COG4638 Phenylpropionate dioxygenase and related ring-hydroxylating dioxygenases, large terminal subunit	MHS521	other_OG
23UVN|Others	54	50.847457627118644	S	dehydrogenases and related proteins	MHS521	other_OG
23UVW|Others	16	19.539632399003025	S	hydrolases or acyltransferases (alpha beta hydrolase superfamily)	MHS521	other_OG
23UVZ|Others	5	5.376344086021505	D	Required for chromosome condensation and partitioning	MHS521	other_OG
23UW2|Others	10	7.047216349541931	-	-	MHS521	other_OG
23UWC|Others	3	4.329004329004329	D	COG0455 ATPases involved in chromosome partitioning	MHS521	other_OG
23UWN|Others	4	6.908462867012091	I	COG1028 Dehydrogenases with different specificities (related to short-chain alcohol dehydrogenases)	MHS521	other_OG
23UX5|Others	28	41.48475928962288	G	Catalyzes the dephosphorylation of 2-phosphoglycolate	MHS521	other_OG
23UX7|Others	12	8.403361344537815	G	Trehalase	MHS521	other_OG
23UXG|Others	27	33.582089552238806	S	protein conserved in bacteria	MHS521	other_OG
23UXN|Others	6	11.299435028248586	S	COG0663 Carbonic anhydrases acetyltransferases, isoleucine patch superfamily	MHS521	other_OG
23UXS|Others	6	9.345794392523365	K	Bacterio-opsin activator HTH domain-containing protein	MHS521	other_OG
23UYT|Others	6	5.617977528089887	L	Integrase	MHS521	other_OG
23UZH|Others	15	10.1010101010101	C	geranylgeranyl reductase	MHS521	other_OG
23UZQ|Others	5	5.3418803418803416	S	hydrolases or acyltransferases (alpha beta hydrolase superfamily)	MHS521	other_OG
23UZZ|Others	8	9.22722029988466	K	transcriptional regulators	MHS521	other_OG
23V01|Others	9	12	K	COG0454 Histone acetyltransferase HPA2 and related acetyltransferases	MHS521	other_OG
23V1H|Others	12	8.281573498964804	E	Transport system 1 (Substrates cationic amino acids), subunit 2	MHS521	other_OG
23V22|Others	13	8.49673202614379	S	Belongs to the sodium solute symporter (SSF) (TC 2.A.21) family	MHS521	other_OG
23V2B|Others	17	20.833333333333336	S	metal-dependent membrane protease	MHS521	other_OG
23V2C|Others	20	26.99055330634278	F	Catalyzes the reductive methylation of 2'-deoxyuridine- 5'-monophosphate (dUMP) to 2'-deoxythymidine-5'-monophosphate (dTMP) while utilizing 5,10-methylenetetrahydrofolate (mTHF) as the methyl donor, and NADPH and FADH(2) as the reductant	MHS521	other_OG
23V2F|Others	9	12.536043322315212	C	COG1018 Flavodoxin reductases (ferredoxin-NADPH reductases) family 1	MHS521	other_OG
23V2M|Others	8	11.904761904761903	S	hydrolase (HAD superfamily)	MHS521	other_OG
23V2S|Others	49	105.06396575480217	L	COG3335 Transposase and inactivated derivatives	MHS521	other_OG
23V3K|Others	8	7.305936073059361	S	metal-dependent hydrolase of the TIM-barrel fold	MHS521	other_OG
23V3P|Others	3	6.802721088435374	-	-	MHS521	other_OG
23V3Q|Others	3	4.444444444444444	S	Protein of unknown function (DUF502)	MHS521	other_OG
